OG_sentences,gen_sentences,cosine_similarity_BERT,jaccard_similarity_BERT
A group of kids is playing in a yard and an old man is standing in the background,grouping young play court oldster man standing groundwork,0.622738,0.48639937310383236
A group of boys in a yard is playing and a man is standing in the background,grouping young court play man standing groundwork,0.68667066,0.504438537817735
A group of children is playing in the house and there is no man standing in the background,grouping young play domestic man standing groundwork,0.41241312,0.5181916885905795
The young boys are playing outdoors and the man is smiling nearby,young young play exterior man humour vicinity,0.7564428,0.5013391137123108
The kids are playing outdoors near a man with a smile,young play exterior vicinity man humour,0.687144,0.4868557353814443
There is no boy playing outdoors and there is no man smiling,boy play exterior man humour,0.23397736,0.5423201182309318
A brown dog is attacking another animal in front of the tall man in pants,gray dog hitting someone animal advance long man skirt,0.8286197,0.5373896633585294
A brown dog is attacking another animal in front of the man in pants,gray dog hitting someone animal advance man skirt,0.8104981,0.5448304116725922
A brown dog is helping another animal in front of the man in pants,gray dog succour someone animal advance man skirt,0.7381283,0.5165292802064315
Two dogs are fighting,till dog fighting,0.84828746,0.4195515513420105
Two dogs are wrestling and hugging,till dog fighting wrapping,0.72922975,0.4427230520681901
There is no dog wrestling and hugging,dog fighting wrapping,0.25676733,0.5411468852650035
A person in a black jacket is doing tricks on a motorbike,someone gray jacket trickery bike,0.6725719,0.5670174423017
A man in a black jacket is doing tricks on a motorbike,man gray jacket trickery bike,0.7218405,0.5708779567166379
There is no man in a black jacket doing tricks on a motorbike,man gray jacket trickery bike,0.4754566,0.567180722951889
A person on a black motorbike is doing tricks with a jacket,someone gray bike trickery jacket,0.68102074,0.5645047990899337
A skilled person is riding a bicycle on one wheel,skill someone bike bike someone bike,0.8521985,0.47130363434553146
A person is riding the bicycle on one wheel,someone bike bike someone bike,0.81673396,0.46379891889435904
Nobody is riding the bicycle on one wheel,someone bike bike someone bike,0.5063032,0.46402008258379424
A man with a jersey is dunking the ball at a basketball game,man sweater sacking goal baseball game,0.3810043,0.5654861841882978
The ball is being dunked by a man with a jersey at a basketball game,goal being soak man sweater baseball game,0.3646448,0.5880071754040925
There is no man dunking the ball at a basketball game,man sacking goal baseball game,0.3514865,0.531846261686749
The game of basketball consists of a ball being dunked by a man with a jersey,game baseball comprise goal being soak man sweater,0.30451423,0.5745496463775634
A man who is playing dunks the basketball into the net and a crowd is in background,man play tumble baseball rede bunch groundwork,0.43502063,0.5480338489567792
The player is dunking the basketball into the net and a crowd is in background,play sacking baseball rede bunch groundwork,0.29551828,0.5201150799791018
The player is missing the basket and a crowd is in background,play absence bag bunch groundwork,0.44614583,0.5215544833077325
Two people are kickboxing and spectators are watching,till folk boxing watching watching,0.58990467,0.48811004161834715
Two people are fighting and spectators are watching,till folk fighting watching watching,0.75956047,0.48004381145749775
Two people are kickboxing and spectators are not watching,till folk boxing watching watching,0.530304,0.5017018243670464
Two spectators are kickboxing and some people are watching,till watching boxing folk watching,0.61936444,0.48162349686026573
Two young women are sparring in a kickboxing fight,till young woman fighting boxing fighting,0.9113443,0.5011509507894516
Two women are sparring in a kickboxing match,till woman fighting boxing fit,0.8665514,0.4843508686338152
Two young women are not sparring in a kickboxing fight,till young woman fighting boxing fighting,0.60299456,0.5066947095534381
Kids in red shirts are playing in the leaves,young pink sweater play peel,0.5707771,0.47324504596846445
Children in red shirts are playing in the leaves,young pink sweater play peel,0.57336456,0.47921091318130493
Children in red shirts are sleeping in the leaves,young pink sweater bed peel,0.44820976,0.46978096451078144
Children covered by leaves are playing with red shirts,young covering peel play pink sweater,0.53626025,0.4683350125948588
Three boys are jumping in the leaves,quarters young glide peel,0.45231387,0.4260803081772544
Three kids are jumping in the leaves,quarters young glide peel,0.5205944,0.4159731323068792
Three kids are sitting in the leaves,quarters young seats peel,0.5589694,0.41550875251943414
Two children are lying in the snow and are drawing angels,till young fornicate cloud depiction deity,0.2843171,0.3578905633517674
Two children are lying in the snow and are making snow angels,till young fornicate cloud make cloud deity,0.38615358,0.38352505456317554
There is no child lying in the snow and making snow angels,young fornicate cloud make cloud deity,0.30623674,0.4321627758798145
Two angels are making snow on the lying children,till deity make cloud fornicate young,0.4060115,0.38398157556851703
Two people wearing snowsuits are on the ground making snow angels,till folk apparel outerwear groundwork make cloud deity,0.32327312,0.3929641470313072
Two people in snowsuits are lying in the snow and making snow angels,till folk outerwear fornicate cloud make cloud deity,0.3437054,0.4042077307347898
Nobody in snowsuits is lying in the snow and making snow angels,someone outerwear fornicate cloud make cloud deity,0.31510046,0.44969505071640015
A little girl is looking at a woman in costume,young girl looking woman apparel,0.8472508,0.5632095694541931
A young girl is looking at a woman in costume,young girl looking woman apparel,0.8544518,0.5982550223668416
The little girl is looking at a man in costume,young girl looking man apparel,0.72086275,0.569525937239329
A little girl in costume looks like a woman,young girl apparel seem like woman,0.9144728,0.5284982204437256
People wearing costumes are gathering in a forest and are looking in the same direction,folk apparel apparel gathering mountain looking heading,0.6331441,0.5289141129363667
Masked people are looking in the same direction in a forest,cloak folk looking heading mountain,0.64220434,0.5118375155660841
People wearing costumes are scattering in a forest and are looking in different directions,folk apparel apparel spreading mountain looking differ route,0.61840594,0.517609935739766
People are looking at some costumes gathered in the vicinity of the forest,folk looking apparel assemble vicinity mountain,0.61166334,0.5396077689670381
A lone biker is jumping in the air,individuality bike glide air,0.6345084,0.4907075075002817
"A biker is jumping in the air, alone",bike glide air individuality,0.5978449,0.5106601289340428
There is no biker jumping in the air,bike glide air,0.3699438,0.5415348735722628
A man is jumping into an empty swimming pool,man glide free washing lake,0.6651503,0.48085179924964905
A man is jumping into an empty pool,man glide free lake,0.59128594,0.507544015844663
A man is jumping into a full pool,man glide complete lake,0.64810884,0.5228175024191538
The man's jumper is in the empty pool,husbandman sweater free lake,0.40351766,0.5082076589266459
Four kids are doing backbends in the park,quarters young back stadium,0.3638019,0.45157843828201294
Four children are doing backbends in the park,quarters young back stadium,0.35725924,0.45975347501891
Four children are doing backbends in the gym,quarters young back exerciser,0.42294616,0.48315531412760415
Four girls are doing backbends and playing in the garden,quarters girl back play balcony,0.6539291,0.5335088161861196
Four girls are doing backbends and playing outdoors,quarters girl back play exterior,0.6565292,0.540209706624349
Four girls are doing backbends and playing indoors,quarters girl back play domestic,0.68113434,0.5403194189071655
A man who is playing is running with the ball in his hands,man play running goal gesture,0.8288081,0.5821176601780785
A player is running with the ball,play running goal,0.73822236,0.5029506802558898
A player is throwing the ball,play sacking goal,0.4441284,0.4187867045402527
Two groups of people are playing football,till grouping folk play footballer,0.5518466,0.37872723596436636
Two teams are competing in a football match,till team compete footballer fit,0.53004444,0.4121758682387216
Two teams are competing in a baseball game,till team compete baseball game,0.88126427,0.49489576999957746
Football is being played by two competing teams,footballer being play make compete team,0.67203504,0.42562289237976075
Five children are standing in front of a wooden hut,pet young standing advance lumber shed,0.601612,0.41440528981825886
Five children are standing in front of a hut made of wood,pet young standing advance shed make lumber,0.60548466,0.43434812128543854
Five children are standing in a wooden hut,pet young standing lumber shed,0.64834243,0.4002709516457149
Five wooden stands are in front of each child's hut,pet lumber stand advance young shed,0.48811433,0.4483472610774793
Five kids are standing close together and one kid has a gun,pet young standing close unite someone girl gun,0.50361925,0.45193406045436857
Five kids are standing close together and one kid has a weapon,pet young standing close unite someone girl gun,0.4549624,0.4528851002454758
Five kids are standing close together and none of the kids has a gun,pet young standing close unite nix young gun,0.20609313,0.42706626653671265
An old man is sitting in a field,oldster man seats region,0.570275,0.4546852753712581
A man is sitting in a field,man seats region,0.6013268,0.48675972819328306
A man is running in a field,man running region,0.8408783,0.541719913482666
A person is wearing a hat and is sitting on the grass,someone apparel cloak seats lumber,0.47945035,0.4718545016489531
A person is sitting in a field and is wearing a hat,someone seats region apparel cloak,0.65790737,0.495845056242413
There is no person wearing a hat and sitting on the grass,someone apparel cloak seats lumber,0.18047443,0.47605203954797043
A person is sitting and wearing a grass hat,someone seats apparel lumber cloak,0.58156085,0.43700140342116356
The current is being ridden by a group of friends in a raft,current being run grouping familiar treadle,0.23274916,0.5433121269399469
A group of friends are riding the current in a raft,grouping familiar bike current treadle,0.31753004,0.4641193879975213
A group is not riding the current in a raft,grouping bike current treadle,0.39030206,0.47113755717873573
This group of people is practicing water safety and wearing preservers,grouping folk performing freshwater security apparel retainer,0.608832,0.4248789223757657
Preservers are being worn by a group of people who are practicing water safety,retainer being weary grouping folk performing freshwater security,0.5164672,0.49519936905966866
Nobody is practicing water safety and wearing preservers,someone performing freshwater security apparel retainer,0.25324857,0.4362707208184635
A deer is jumping over a fence,fox glide wall,0.37866795,0.5229273557662963
A deer is jumping over the enclosure,fox glide enclosing,0.39519012,0.4702390084664027
A deer isn't jumping over the fence,fox glide wall,0.2834538,0.5458861738443375
A wild deer is jumping a fence,animal fox glide wall,0.4794833,0.5057321245020087
A deer is jumping a fence,fox glide wall,0.40000176,0.5323884023560418
There is no deer jumping fences,fox glide wall,0.20340231,0.5173719167709351
People are walking outside a building that has many murals on it,folk going exterior build plenty mural,0.46977723,0.5440880091566789
People are walking outside the building that has several murals on it,folk going exterior build multiple mural,0.4920665,0.5496910935954044
People are walking inside a building that has many murals on it,folk going inwardness build plenty mural,0.45152092,0.49048179671877906
Several people are in front of a building which is covered by colors,multiple folk advance build covering colour,0.57508737,0.5357824407125774
Several people are in front of a colorful building,multiple folk advance colour build,0.51900184,0.47248861619404386
Nobody is in front of the colorful building,someone advance colour build,0.13226402,0.5088016639153162
A boy is hitting a baseball,boy hitting baseball,0.98440003,0.6304138435257806
A child is hitting a baseball,young hitting baseball,0.9460043,0.5728447172376845
A child is missing a baseball,young absence baseball,0.8042867,0.5448955231242709
A family is watching a little boy who is hitting a baseball,family watching young boy hitting baseball,0.9832208,0.6113361153337691
A family is watching a boy who is hitting a baseball,family watching boy hitting baseball,0.9768286,0.6459768526256084
A family is watching a little boy who is missing a baseball,family watching young boy absence baseball,0.9312291,0.5990098383691576
A little boy is watching a family that is hitting a baseball,young boy watching family hitting baseball,0.9763287,0.6112017333507538
A large group of Asian people is eating at a restaurant,plenty grouping foreigner folk eating repast,0.63144,0.3837552726268768
A group of people from Asia is eating at a restaurant,grouping folk story eating repast,0.5749633,0.3856713142659929
A small group of people is waiting to eat in a restaurant,young grouping folk wait comer repast,0.35720766,0.4361992985010147
A group of people in a large Asian restaurant is eating,grouping folk plenty foreigner repast eating,0.5923985,0.3676270008087158
Various people are eating at red tables in a crowded restaurant with purple lights,differ folk eating pink table plenty repast pink glow,0.53267425,0.47090403487284976
Various customers are eating in a crowded restaurant with purple lights,differ customer eating plenty repast pink glow,0.50805765,0.4756638156740289
Few people are eating at red tables in a restaurant without lights,folk eating pink table repast nonexistence glow,0.61750466,0.3959064613217893
A purple crowd of people is eating on various red lit restaurant tables,pink bunch folk eating differ pink glow repast table,0.55825967,0.4595751010853311
A motorcycle rider is standing up on the seat of a white motorcycle,bike traveler standing seats gray bike,0.57591724,0.5376485554795516
A motorcycle is riding standing up on the seat of the vehicle,bike bike standing seats automobile,0.66537297,0.55441293295692
No motorcycle rider is standing up on the seat of a motorcycle,bike traveler standing seats bike,0.4994475,0.5335169083931867
Someone is on a black and white motorcycle and is standing on the seat,someone gray gray bike standing seats,0.6380005,0.5749104589223861
A rider is on a black and white bike and is standing on the seat,traveler gray gray bike standing seats,0.67452395,0.5557733490353539
Nobody is on a motorcycle and is standing on the seat,someone bike standing seats,0.3714766,0.5710265636444092
A motorcyclist is riding a motorbike dangerously along a roadway,bike bike bike peril adjoin route,0.624526,0.4845264813174372
A motorcyclist is riding a motorbike along a roadway,bike bike bike adjoin route,0.6965783,0.5177733145262066
There is no motorcyclist riding a motorbike along a roadway,bike bike bike adjoin route,0.35771194,0.5045048117637634
A man with a helmet painted red is riding a blue motorcycle down the road,man helm dye pink bike gray bike road,0.5891888,0.5297583782154581
A motorcyclist with a red helmet is riding a blue motorcycle down the road,bike pink helm bike gray bike road,0.5585878,0.544799022052599
A motorcyclist without a helmet is waiting on a blue motorcycle near the road,bike nonexistence helm wait gray bike vicinity road,0.69144136,0.47308546943323954
A dog is catching a stick in the air and another is watching,dog seizing whip air someone watching,0.8050925,0.5479180097579956
A dog is leaping high in the air and another is watching,dog glide elevation air someone watching,0.7268531,0.5669133506323162
There is no dog leaping in the air,dog glide air,0.29740614,0.5565945307413737
Two dogs are playing by a tree,till dog play lumber,0.6593065,0.4095879445473353
Two dogs are playing by a plant,till dog play vegetation,0.88598245,0.47257723049684003
Two dogs are sleeping by a tree,till dog bed lumber,0.5398004,0.3756432632605235
A girl in white is dancing,girl gray dancing,0.8529177,0.5436964167488946
A girl is wearing white clothes and is dancing,girl apparel gray apparel dancing,0.830148,0.4856270168508802
There is no girl in white dancing,girl gray dancing,0.45804107,0.505113935470581
The dancer is dancing in front of the sound equipment,dancing dancing advance tune equipment,0.8781692,0.5541991511980693
The blond girl is dancing in front of the sound equipment,pink girl dancing advance tune equipment,0.82701564,0.5459439859670752
The blond girl is dancing behind the sound equipment,pink girl dancing back tune equipment,0.8007,0.5148809472719829
The equipment in front of the blond dancing girl is sound,equipment advance pink dancing girl tune,0.67820597,0.5541656858780805
The children of a family are patiently playing and waiting,young family bravery play wait,0.77155995,0.5272385723450604
The children of a family are playing and waiting,young family play wait,0.9116466,0.5648583907347459
There are no children playing and waiting,young play wait,0.242444,0.49730426669120786
Three Asian kids are dancing and a serious man is looking,quarters foreigner young dancing tough man looking,0.72151864,0.4240204974224693
Three Asian kids are dancing and a man is looking,quarters foreigner young dancing man looking,0.7953398,0.4245590918204364
Three Asian kids are dancing and there is no man looking,quarters foreigner young dancing man looking,0.57334805,0.4348517623212602
An Asian man is dancing and three kids are looking,foreigner man dancing quarters young looking,0.8211402,0.4179004010032205
A woman is wearing an Egyptian hat on her head,woman apparel kip cloak chief,0.62118626,0.46094585210084915
A woman is wearing an Egyptian headdress,woman apparel kip hairpin,0.5755658,0.46891194581985474
A woman is wearing an Indian headdress,woman apparel domestic hairpin,0.51635826,0.43030773676358736
An Egyptian is wearing a woman's headdress,kip apparel woman hairpin,0.61165607,0.5247514963150024
The woman is wearing glasses and a black headdress,woman apparel sight gray hairpin,0.71202016,0.4782516732811928
The woman with a black hat is wearing sunglasses,woman gray cloak apparel crepuscule,0.66620326,0.4040333348162034
The woman is not wearing glasses or a headdress,woman apparel sight hairpin,0.35912535,0.44943507115046183
The black woman is wearing glasses over the headdress,gray woman apparel sight hairpin,0.63720775,0.4943450465798378
A hiker is on top of the mountain and is doing a joyful dance,traveler overtop mountain joy dance,0.84206045,0.6068412661552429
A hiker is on top of the mountain and is dancing,traveler overtop mountain dancing,0.91912216,0.5921836530461031
There is no hiker dancing on top of the mountain,traveler dancing overtop mountain,0.52051425,0.5648015029728413
A man is on a rock high above some trees and is standing in an uncomfortable position,man rubble elevation lumber standing displease position,0.65841484,0.4247360740389143
A man is on a rock high above some trees and is standing in a strange position,man rubble elevation lumber standing stranger position,0.6251554,0.4628152640966269
There is no man on a rock high above some trees standing in a strange position,man rubble elevation lumber standing stranger position,0.6085609,0.46789232492446897
A cowgirl is riding a brown horse and is cornering a barrel,girl bike gray cattle bending bar,0.6282819,0.5851168662309647
A cowgirl is riding a horse and corners a barrel,girl bike cattle quarters bar,0.6126852,0.5506559498608112
A cowboy is riding a horse and cornering a barrel,cager bike cattle bending bar,0.46331447,0.5359485149383545
A cowgirl is riding a barrel near a horse in the corner,girl bike bar vicinity cattle round,0.62816435,0.5347973555326462
The brown horse is very near a red barrel at the rodeo,gray cattle vicinity pink bar roleplay,0.5040488,0.4736103653907776
The brown horse is near a red barrel at the rodeo,gray cattle vicinity pink bar roleplay,0.50946975,0.4629392561159636
The brown horse is far from a red barrel at the rodeo,gray cattle long pink bar roleplay,0.39595214,0.4909760073611611
A boy is standing in the cold water,boy standing cold freshwater,0.886497,0.5631450873154861
A boy is standing in the water,boy standing freshwater,0.88206685,0.5523736693642356
A boy is standing outside the water,boy standing exterior freshwater,0.87920034,0.4940519332885742
The kid is swimming through the blue ocean,girl washing gray air,0.2469418,0.4295646995306015
The boy is wading through the blue ocean,boy wetting gray air,0.36736518,0.4746175706386566
The boy is sitting near the blue ocean,boy seats vicinity gray air,0.5134703,0.4191040311540876
A skilled man is playing a guitar on stage,skill man play gyration stage,0.59685194,0.4918448567390442
A man is playing a guitar on stage,man play gyration stage,0.629631,0.47841949646289533
There is no man playing a guitar on stage,man play gyration stage,0.31164443,0.4795638450554439
A person has blonde and flyaway hair and is playing a guitar,someone pink fly hair play gyration,0.5639281,0.5162932962179184
A guitarist has blonde and flyaway hair,conductor pink fly hair,0.5252293,0.5044047037760416
A bald person is playing a guitar,dull someone play gyration,0.57029,0.48268666366736096
Several children are sitting down and have their knees raised,multiple young seats bosom rising,0.5398347,0.4857560321688652
Several children are lying down and are raising their knees,multiple young fornicate rising bosom,0.5214292,0.4266206357214186
Several children are standing up,multiple young standing,0.8854858,0.4879339933395386
Two young girls are sitting on the ground,till young girl seats groundwork,0.70634997,0.4249649686472757
Two girls are sitting on the ground,till girl seats groundwork,0.6750126,0.3831382344166438
Two girls are lying on the ground,till girl fornicate groundwork,0.5361105,0.32382773075784954
A nude lady is walking in front of many people in body paint,nudity dame going advance plenty folk creature dye,0.30911943,0.47783084078268573
A nude lady is walking in front of a crowd in body paint,nudity dame going advance bunch creature dye,0.33352676,0.4977659128961109
There is no lady walking in body paint in front of a crowd ,dame going creature dye advance bunch,0.1237169,0.5262962422872844
A nude crowd in body paint is walking in front of a lady ,nudity bunch creature dye going advance dame,0.37131247,0.5002023918288094
"A young, topless woman is covered in paint",young overtop woman covering dye,0.65046877,0.5668867155909538
A topless girl is covered in paint,overtop girl covering dye,0.66974664,0.545968390428103
"An old, topless woman is covered in paint",oldster overtop woman covering dye,0.6666533,0.5202936214559218
A group of people is near the ocean,grouping folk vicinity air,0.39475274,0.3717533307416098
A crowd of people is near the water,bunch folk vicinity freshwater,0.69752157,0.42736866218703135
A crowd of people is far from the water,bunch folk long freshwater,0.3640506,0.49789716941969736
A group of children in uniforms is standing at a gate and one is kissing the mother,grouping young apparel standing gate someone betrothal mother,0.6173054,0.5046681145141865
A group of children wearing the same clothes is waiting at a gate and one is kissing the mother,grouping young apparel apparel wait gate someone betrothal mother,0.6044815,0.4882972971085579
A group of children in uniforms is standing at a gate and there is no one kissing the mother,grouping young apparel standing gate someone betrothal mother,0.37901676,0.5256690056093277
A group of mothers in uniforms is standing near the children and one is kissing the gate,grouping mother apparel standing vicinity young someone betrothal gate,0.7089714,0.4747219681739807
A man is in a parking lot and is playing tennis against a large wall,man automobile plenty play dancing plenty wall,0.5043963,0.47546637058258057
A lone man is in a parking lot and is playing tennis against a large wall,individuality man automobile plenty play dancing plenty wall,0.433515,0.4548348498344421
A man is in a parking lot and is playing tennis against a friend,man automobile plenty play dancing feint,0.4719866,0.44157001234236215
A man is pointing at a silver sedan,man indication coin till,0.35613564,0.4878637492656708
A man is pointing at a car,man indication car,0.8845636,0.5669598579406738
There is no man pointing at a car,man indication car,0.3431536,0.5296447331255133
A group of people is on a beach,grouping folk lake,0.32607824,0.4067429006099701
A group of people is near the sea,grouping folk vicinity mar,0.4376191,0.39742124506405424
A group of people is on a mountain,grouping folk mountain,0.6986325,0.5177899946769079
"A man, a woman and two girls are walking on the beach",husbandman woman make girl going lake,0.19304359,0.4273876339197159
Four people are walking on the beach,quarters folk going lake,0.353422,0.36804602362892846
"A man, a woman and two girls are sitting on the beach",husbandman woman make girl seats lake,0.29117793,0.40923298597335817
A schoolgirl with a black bag is on a crowded train,school gray bag plenty train,0.5458294,0.5692541634335238
