OG_sentences,gen_sentences,cosine_similarity_BERT,jaccard_similarity_BERT
A woman is tapping her fingers nervously,woman hitting gesture nervousness,0.8416924,0.5121866281215961
A woman is tapping her fingers,woman hitting gesture,0.69477725,0.5260771844122145
There is no woman tapping her fingers,woman hitting gesture,0.23126554,0.5065552711486816
A woman is tapping her fingers on a desk,woman hitting gesture table,0.5194314,0.5451753093646123
A woman is tapping her fingers on a table,woman hitting gesture table,0.7429258,0.5549892874864432
A woman is resting her fingers on a table,woman vacation gesture table,0.6335133,0.5192744181706355
A dog is pushing a toddler into a rain puddle,dog pushing young cloud pud,0.66816574,0.5664822086691856
A dog is pushing a toddler into a puddle of rain,dog pushing young pud cloud,0.6603384,0.5784497015616473
A dog is pulling a toddler out of a rain puddle,dog pulling young cloud pud,0.6569854,0.5771243396927329
The dog is knocking a boy into the water,dog beating boy freshwater,0.86754525,0.5705873290697734
A boy is being knocked into the water by the dog,boy being hit freshwater dog,0.9017012,0.5649618366185356
The dog is not knocking the boy into the water,dog beating boy freshwater,0.49934787,0.5535628162324429
A boy is knocking a dog with a bottle of water,boy beating dog bottle freshwater,0.8944007,0.5910320580005646
A man is hungrily eating a bowl of cereal,man longing eating sack crockery,0.72779274,0.4673672255716826
A man is eating a bowl of cereal,man eating sack crockery,0.7961568,0.4656938155492147
There is no man eating a bowl of cereal,man eating sack crockery,0.34210736,0.4665691405534744
Cereal is being eaten by the man,fertiliser being eating man,0.5780115,0.5154600484030587
The man is eating cereal,man eating crockery,0.7881454,0.4385136365890503
There is no man eating cereal,man eating crockery,0.27654228,0.4249259558590976
A man is strumming the guitar,man thrashing gyration,0.45963407,0.4797422971044268
A man is packing away the guitar,man wrapping leaving gyration,0.58815205,0.49055516223112744
The man is playing the flute,man play flub,0.36774734,0.563509155403484
The person is playing the flute,someone play flub,0.32816696,0.4946244250644337
The man in not playing the flute,man play flub,0.37603268,0.5599308162927628
There is no woman adding spices to some meat,woman addition condiment meat,0.39767474,0.526520060641425
A woman is adding spices to some meat,woman addition condiment meat,0.88146055,0.5121979117393494
The woman is adding sugar to the meat slowly,woman addition butter meat decelerate,0.71207327,0.46898866444826126
The woman is adding sugar to the meat,woman addition butter meat,0.7924992,0.5517084449529648
The woman is not adding sugar to the meat,woman addition butter meat,0.36095077,0.5408631746585553
A dog is biting a can,dog beating,0.6635162,0.6170832316080729
A can is being bitten by a dog,being hit dog,0.7304315,0.612960631197149
A dog is dropping a can,dog fall,0.787343,0.5689476728439331
A dog is opening a can of food,dog launch food,0.80689824,0.5344863100485369
A dog is opening a jar of food,dog launch sack food,0.76577723,0.49302456929133487
A dog is closing a can of food,dog close food,0.735379,0.5788934230804443
A cat is playing with a watermelon,cat play sausage,0.717829,0.5894092592326078
One cat is playing with a watermelon,someone cat play sausage,0.7388084,0.5451844334602356
There is no cat playing with a watermelon,cat play sausage,0.30312485,0.5555707961320877
The cat is playing passionately with a watermelon,cat play passion sausage,0.6904025,0.5931469116892133
The cat is playing with a watermelon,cat play sausage,0.7039038,0.5938450802456249
The cat isn't playing with a watermelon,cat play sausage,0.38217595,0.5863604820691622
The boy is playing a guitar,boy play gyration,0.49993646,0.5020698964595794
A boy is playing a guitar,boy play gyration,0.54595584,0.4954658269882202
There is no boy playing a guitar,boy play gyration,0.20266418,0.48766649853099475
A teenager is playing the guitar,young play gyration,0.51606876,0.47678446769714355
A kid is playing a guitar,girl play gyration,0.39006877,0.46423574090003966
A kid is putting the guitar away,girl put gyration leaving,0.34592855,0.4808632383743922
A woman is wakeboarding on a lake,woman watercraft lake,0.7885424,0.5370970020691553
One woman is wakeboarding on the lake,someone woman watercraft lake,0.75190777,0.49951007732978236
A woman is watching the lake,woman watching lake,0.9860523,0.6216813325881958
The woman is waterskiing fearlessly,woman watercraft fear,0.54869545,0.5432027926047643
The woman is waterskiing,woman watercraft,0.7721193,0.548468013604482
The woman is not waterskiing,woman watercraft,0.5002922,0.5239099264144897
Someone is banging the lens of a camera against a nail,someone beating sight closet lash,0.64649665,0.5629205808920019
Someone is banging a camera lens against a nail,someone beating closet sight lash,0.6328473,0.5320395867029826
There is no one banging a camera lens against a nail,someone beating closet sight lash,0.16357324,0.5475095300113454
Someone is nailing a camera lens with loud bangs,someone tilling closet sight tough beard,0.46386307,0.4805353914990145
A camera is being hammered onto the nail by the man,closet being hitting till lash man,0.618914,0.5337466829352908
The man is hammering a nail with a camera,man thrashing lash closet,0.56766135,0.48805274069309235
The man is not hammering a nail with a camera,man thrashing lash closet,0.21376568,0.48524633926503796
The camera man is nailing a hammer to the wall,closet man tilling whip wall,0.7240082,0.5254447635482339
A person is slicing an onion,someone cutting sausage,0.702993,0.569727611541748
A person is cutting an onion,someone cutting sausage,0.6846049,0.544588757885827
A person near an onion has a cut,someone vicinity sausage cut,0.64741325,0.5237140976465665
One person is cutting an onion,someone someone cutting sausage,0.58494884,0.47769186496734617
There is no person cutting an onion,someone cutting sausage,0.1144982,0.5591587722301483
A person is eating a cut onion,someone eating cut sausage,0.823483,0.5408959171988748
A person is wrapping up an onion,someone wrapping sausage,0.766613,0.5769474446773529
The oriental lady is cutting a carrot into thin pieces,exterior dame cutting sausage lean part,0.54816866,0.488578949123621
The oriental lady is cutting a carrot into pieces that are thin,exterior dame cutting sausage part lean,0.5741777,0.5348915722635057
The oriental lady is not cutting a carrot into thin pieces,exterior dame cutting sausage lean part,0.21460898,0.5024832627352547
A thin lady is piecing together oriental carrot cuts,lean dame tilling unite exterior sausage cutting,0.5183778,0.48517993754810756
A man is pouring a plate of shredded cheese into a pot of sauce,man infuse table cutting sausage sack sausage,0.7639506,0.49881426244974136
A man is pouring a plate of cheese which is shredded into a pot of sauce,man infuse table sausage cutting sack sausage,0.79236114,0.52960372200379
A man is taking a plate of shredded cheese off of a pot of sauce,man getting table cutting sausage sack sausage,0.76561785,0.549820065498352
A man is pouring a pot of cheese sauce into a shredded plate,man infuse sack sausage sausage cutting table,0.7563552,0.4996223890263101
The woman is adding cheese to the sauce,woman addition sausage sausage,0.65482664,0.5653542876243591
The lady is adding cheese to the sauce,dame addition sausage sausage,0.5347804,0.5547906756401062
The woman is removing cheese from the sauce,woman disposal sausage sausage,0.64128256,0.5418962389230728
Some cameras are being burned by a person with a blow torch,cinematography being combust someone hit flame,0.78039503,0.49453008716756647
A person is burning some cameras with a blow torch,someone kindle cinematography hit flame,0.66785485,0.49204302165243363
A person is repairing some cameras with a blow torch,someone repair cinematography hit flame,0.7260215,0.5297179661299053
A person by some cameras is blowing on a burning torch,someone cinematography pushing kindle flame,0.67145896,0.5218447791902643
The tall person is setting fire to the cameras,long someone setting fire cinematography,0.6453384,0.4519360177218914
The person is setting fire to the cameras,someone setting fire cinematography,0.8074329,0.4509247711726597
There is no person setting fire to the cameras,someone setting fire cinematography,0.24505877,0.4688449303309123
One man is playing the guitar,someone man play gyration,0.59716904,0.45882746848193084
The man is playing an acoustic guitar,man play musicality gyration,0.5021149,0.4344597917336684
The man is playing a guitar which is acoustic,man play gyration musicality,0.49869898,0.49145203034083046
The man isn't playing an acoustic guitar,man play musicality gyration,0.4072725,0.4559967041015625
A person is cutting an onion into pieces,someone cutting sausage part,0.65673757,0.5128474881251653
A person is dicing an onion,someone cutting sausage,0.61781883,0.5621904850006103
A person is piecing together an onion,someone tilling unite sausage,0.62499106,0.5183223944443923
A person is slicing a carrot into pieces,someone cutting sausage part,0.6232334,0.5384471737421476
A carrot is being sliced into pieces by a person,sausage being cutting part someone,0.6609728,0.5480267405509949
There is no person slicing a carrot into pieces,someone cutting sausage part,0.13879758,0.5435328611305782
The man is slicing a potato,man cutting pie,0.7967291,0.5833663702011108
The person is carefully slicing a potato,someone precis cutting pie,0.7292098,0.5105359703302383
The man is wrapping a potato,man wrapping pie,0.78335375,0.5602248112360636
The man is cooking slices of potato,man eating cutting pie,0.8132716,0.5125418630513278
The man is slicing the potato,man cutting pie,0.7964576,0.5855909705162048
The person is slicing the potato,someone cutting pie,0.73609674,0.540329760313034
The man is not slicing the potato,man cutting pie,0.3195796,0.5692936236208136
Somebody is cutting a tomato,someone cutting tomentum,0.50446343,0.5241960465908051
Someone is cutting a tomato,someone cutting tomentum,0.49712253,0.4850362141927083
There is no one cutting a tomato,someone cutting tomentum,0.11841616,0.5164557153528387
The lady is slicing a tomato,dame cutting tomentum,0.42856604,0.5315746502442793
The woman is slicing a tomato,woman cutting tomentum,0.6073197,0.5352112813429399
The woman is holding a whole tomato,woman keeping total tomentum,0.37887168,0.5030210862557093
A man is preparing some dish,man readying crockery,0.79895574,0.4062921702861786
A man is preparing a dish,man readying crockery,0.8108186,0.42633422712485
A man is cleaning a dish,man washing crockery,0.8915459,0.45229598067023535
The woman is slicing an onion with a knife,woman cutting sausage cutter,0.7514241,0.5501755135399955
An onion is being sliced with a knife by the woman,sausage being cutting cutter woman,0.74907255,0.562539454549551
The woman is not slicing an onion with a knife,woman cutting sausage cutter,0.31039223,0.5430595914522807
Some runners are competing in a race,run compete compete,0.871454,0.4462792336940765
Runners are competing in a race,run compete compete,0.88904417,0.5038402610354953
Runners are not taking part in the race,run getting part compete,0.28394684,0.4688057154417038
Runners are racing in a competition,run compete contestation,0.8311107,0.4744751751422882
The runners are racing impetuously around a track,run compete accouterment circumvent route,0.47346103,0.41940697431564333
The runners are racing around a track,run compete circumvent route,0.6335776,0.4292671588750986
The runners are not racing around a track,run compete circumvent route,0.32534456,0.4340718814304897
A man is racing,man compete,0.8933861,0.5634165207544962
A man is running,man running,0.9901699,0.6041808029015859
A man is standing still,man standing stay,0.85839605,0.563875637948513
A man is running down the road,man running road,0.94044554,0.6039964020252228
One man is running down the road,someone man running road,0.87315965,0.5547472238540649
There is no man running down the road,man running road,0.41985115,0.563061838800257
The keyboard is being played with his nose by a man,knap being play cough man,0.45655242,0.5737118162214756
A man is playing the keyboard with his nose,man play knap cough,0.40524054,0.555762882416065
A man is idling,man chilling,0.6765816,0.5315714478492737
A man at the keyboard is playing with his nose,man knap play cough,0.48719984,0.5472152233123779
The man is funnily playing the piano with his nose,man humour play plane cough,0.58986926,0.5361457616090775
The man is playing the piano with his nose,man play plane cough,0.48675215,0.550738683113685
There is no man playing the piano with his nose,man play plane cough,0.27498692,0.5297745210783822
A baby rhino is following an adult rhino,girl fox following adult fox,0.5780462,0.5644762794176738
"A rhino, which is little, is following an adult rhino",rat young following adult fox,0.57465684,0.6244108833764729
A baby rhino is shunning an adult rhino,girl fox evasion adult fox,0.49673608,0.5287097096443176
A baby and an adult are being followed by a rhino,girl adult being following fox,0.4144603,0.5801548502024483
"A rhino, which is a youngling, is walking around a pen with its mother",rat young going circumvent writ mother,0.40357965,0.5883678352391278
A baby rhino is walking around a pen with its mother,girl fox going circumvent writ mother,0.37136382,0.4758887319337754
A baby rhino and its mother are standing in a pen,girl fox mother standing writ,0.5296004,0.5430923071172502
A mother is giving the baby a pen with a walking rhino on it,mother giving girl writ going fox,0.5836554,0.583206220106645
A man is riding a motorcycle,man bike bike,0.7387202,0.5368807713190714
A man is getting off the motorcycle,man getting bike,0.70010114,0.5884409308433532
A man is dangerously riding a motorcycle through a town,man peril bike bike citizen,0.56630415,0.48579103806439566
A man is riding a motorcycle through the town,man bike bike citizen,0.5751441,0.5196065856860235
There is no man riding a motorcycle through the town,man bike bike citizen,0.38968223,0.513138085603714
A group of people is singing,grouping folk sing,0.8096439,0.5128348886966705
A few people are singing,folk sing,0.8189587,0.5179921984672546
A group of people is silent,grouping folk hush,0.5215986,0.43859355558048596
Some people are singing,folk sing,0.82581115,0.4841420551141103
Some persons are singing,personality sing,0.68292135,0.4605398178100586
Some people are silent,folk hush,0.7229967,0.3623051813670567
A man is playing a trumpet brightly,man play flummox glow,0.4866894,0.5145104408264161
A man is playing a trumpet,man play flummox,0.45226273,0.5049121081829071
A man is putting a trumpet away,man put flummox leaving,0.5659154,0.4987437639917646
The man is playing a guitar,man play gyration,0.53627694,0.49334219098091125
A guitar is being played by the man,gyration being play man,0.5261102,0.5173219946714548
The man is not playing a guitar,man play gyration,0.30691174,0.49148191105235706
One man is dancing,someone man dancing,0.8887838,0.5119874392236982
A man is motionless,man unmentionable,0.6302661,0.3846913516521454
A man is speaking,man speak,0.93692625,0.6026389797528585
A man is silent,man hush,0.68601644,0.5039110694612775
A man is carefully climbing a rope,man precis climb rope,0.87305254,0.5319122509522871
A man is climbing a rope,man climb rope,0.9691497,0.5971662203470866
A man is untying a rope,man irresolution rope,0.61916006,0.409289355079333
A man is being roped before a climb,man being rope climb,0.877385,0.5882174189274127
One panda is climbing,someone cat climb,0.39787892,0.41386105333055767
A panda is climbing,cat climb,0.43870604,0.47032931447029114
There is no panda climbing,cat climb,0.31449735,0.4486137884003775
A woman is dancing beautifully in a cage,woman dancing prettify cager,0.8679826,0.48503899574279785
A woman is dancing in a cage,woman dancing cager,0.88564456,0.5612121332775463
There is no woman dancing in a cage,woman dancing cager,0.38080075,0.5341194023688635
A woman is being caged for the dance,woman being cager dance,0.85815257,0.5691135483128684
The woman is dancing,woman dancing,0.98233914,0.6035143435001373
The lady is dancing,dame dancing,0.8864368,0.5931049187978109
The woman is not dancing,woman dancing,0.41637653,0.5685670375823975
Four people are floating on a raft,quarters folk glide treadle,0.42444888,0.39823487401008606
A few people are floating on a raft,folk glide treadle,0.48204383,0.47719768683115643
Nobody is floating on a raft,someone glide treadle,0.13190626,0.4805350124835968
People are riding and paddling a raft,folk bike tilling treadle,0.5212793,0.4402945339679718
Some persons are riding and paddling a raft,personality bike tilling treadle,0.46701896,0.3909284472465515
People are not riding and paddling a raft,folk bike tilling treadle,0.3377617,0.44219640096028645
People are paddling near a raft that is being ridden,folk tilling vicinity treadle being run,0.44443834,0.5028376068387713
A cat is eagerly eating corn on the cob,cat longing eating brood cube,0.8248786,0.5416789688169956
A cat is eating corn on the cob,cat eating brood cube,0.8514997,0.5678143699963888
There is no cat eating corn on the cob,cat eating brood cube,0.41689625,0.5538680920234094
A cat is eating some corn,cat eating brood,0.8624123,0.5553620325194465
The cat is eating some corn,cat eating brood,0.8387579,0.5530708101060655
A cat is walking away from some corn,cat going leaving brood,0.81459737,0.5507101813952128
Someone is slicing a tomato,someone cutting tomentum,0.4750633,0.5169071733951569
Nobody is slicing a tomato,someone cutting tomentum,0.112823665,0.49258862137794496
The person is quickly slicing a vegetable,someone hurry cutting vegetation,0.6912893,0.5491839945316315
The person is slicing a vegetable,someone cutting vegetation,0.6688607,0.5741598904132843
The person isn't slicing a vegetable,someone cutting vegetation,0.32387024,0.574905127286911
A little girl is playing a grand piano on stage,young girl play plenty plane stage,0.6172905,0.5234362408518791
"A little girl is playing a piano, which is very big, on stage",young girl play plane adult stage,0.6302229,0.5344732375372023
There is no little girl playing a grand piano on stage,young girl play plenty plane stage,0.38511798,0.5106581519631779
"A girl, who is little, is playing the piano",girl young play plane,0.5167779,0.5609465638796488
A little girl is playing the piano,young girl play plane,0.518494,0.49421450766650116
There is no little girl playing the piano,young girl play plane,0.2802951,0.4709516068299611
A man is packing a guitar,man wrapping gyration,0.52843404,0.4702503442764282
Someone is strumming the guitar,someone thrashing gyration,0.51371884,0.47087913293104905
Someone is playing the guitar,someone play gyration,0.67028546,0.4810568028026157
Someone is putting the guitar away,someone put gyration leaving,0.5890333,0.4739273353056474
The man is dancing frantically,man dancing fury,0.83367157,0.5350974678993226
The man is dancing,man dancing,0.97722805,0.6043725609779358
The man is not dancing,man dancing,0.3564782,0.5811862008912223
Three women are dancing,quarters woman dancing,0.91957724,0.4248265453747341
A few women are dancing,woman dancing,0.9744313,0.5392272216933114
Three women are standing still,quarters woman standing stay,0.781456,0.4302787913216485
A man is playing a flute made of bamboo,man play flub make lumber,0.30515745,0.5216022484442767
A man is playing a bamboo flute,man play lumber flub,0.3640669,0.5105125222887311
There is no man playing a bamboo flute,man play lumber flub,0.20434439,0.4960537672042847
The man is playing a flute,man play flub,0.36299908,0.5659704316746105
A flute is being played by the man,flub being play man,0.3970462,0.5593978081430707
The man is not playing a flute,man play flub,0.2718052,0.5558156967163086
A person is absently cutting mushrooms with a knife,someone absence cutting moth cutter,0.45270336,0.5168969591458639
A person is cutting mushrooms with a knife,someone cutting moth cutter,0.48919776,0.5061478912830353
A person is putting away the mushrooms,someone put leaving moth,0.41922265,0.5163209709254178
A person is slicing some mushrooms,someone cutting moth,0.40968195,0.5646662294864655
A person is cutting some mushrooms,someone cutting moth,0.47243753,0.5478736956914266
There is no person cutting some mushrooms,someone cutting moth,0.12963277,0.5615076720714569
A tiger is pacing around a cage,rat beating circumvent cager,0.5720426,0.44952990611394245
A tiger is walking around a cage,rat going circumvent cager,0.47684783,0.4290450598512377
A tiger is walking outside a cage,rat going exterior cager,0.50531054,0.48399171233177185
A tiger is walking around with no aim,rat going circumvent goal,0.4078288,0.4757096639701298
A tiger is walking around aimlessly,rat going circumvent unmentionable,0.39626598,0.3750045821070671
A tiger is sitting,rat seats,0.47965825,0.4891838828722636
A tiger is aimlessly walking around,rat unmentionable going circumvent,0.34936926,0.37300436198711395
A monkey is brushing the dog,rat washing dog,0.5988493,0.5319089955753751
The monkey is brushing the dog,rat washing dog,0.61061764,0.5396924283769395
There is no monkey brushing the dog,rat washing dog,0.3864984,0.5121618866920471
A bull dog is being brushed by the monkey,swine dog being washing rat,0.53201383,0.5329869906107585
The monkey is brushing a bull dog,rat washing swine dog,0.5399298,0.4935826410849889
The monkey is not brushing a bull dog,rat washing swine dog,0.24694213,0.4905015046779926
A bull dog is brushing the monkey,swine dog washing rat,0.5832438,0.49379006524880725
A woman is swiftly cutting an onion,woman hurry cutting sausage,0.7904246,0.5478281875451406
The lady is dicing onions,dame cutting sausage,0.6961663,0.5386330882708231
The woman is dicing onions,woman cutting sausage,0.7555208,0.5545199182298448
The woman is throwing onions away,woman sacking sausage leaving,0.70870537,0.4607796018773859
A man is wearing a hard hat and dancing,man apparel tough cloak dancing,0.8787427,0.5169288873672485
A man is wearing a hat which is hard and is dancing,man apparel cloak tough dancing,0.89064157,0.5732998616165585
A man is naked and standing still,man nudity standing stay,0.71439636,0.5054780195156733
A man is dancing with a worn hard hat,man dancing weary tough cloak,0.8135659,0.5008001625537872
A man with a hard hat is dancing,man tough cloak dancing,0.85053957,0.5629353477404668
The man with a hard hat is dancing,man tough cloak dancing,0.8346009,0.5652370957227854
There is no man with a hard hat dancing,man tough cloak dancing,0.35240245,0.5516378709248134
Two boys are playing a video game,till young play video game,0.8511997,0.4371752341588338
A couple of boys are playing a video game,betrothal young play video game,0.7687263,0.4424175061285496
Two boys are studying,till young teach,0.47505936,0.33955468450273785
Two boys on a couch are playing games on the TV,till young bed play game telecom,0.6253258,0.4299132192836088
Two boys on a couch are playing video games,till young bed play video game,0.8605565,0.44390353361765544
Two boys on a couch are reading a book,till young bed lecturing writing,0.5877886,0.3699571410814921
Video games of two playing boys are on a couch,video game make play young bed,0.7968694,0.489272627979517
A woman is cutting a potato,woman cutting pie,0.79813486,0.5444196727540758
The man is slicing vegetables,man cutting vegetation,0.6765903,0.5643248094452752
Vegetables are being sliced by a man,vegetation being cutting man,0.70584726,0.5933966040611267
The man is not slicing vegetables,man cutting vegetation,0.3371029,0.5471860110759735
The lady is breaking an egg for the mixer,dame breakage meat mingle,0.47776365,0.4949273546536764
The lady is cracking an egg for the mixer,dame breakage meat mingle,0.37140393,0.49137370189030966
The lady isn't cracking an egg for the mixer,dame breakage meat mingle,0.18170786,0.5140028630985933
The lady is carefully slicing up the meat,dame precis cutting meat,0.75657463,0.5862858983186575
The lady is slicing up the meat,dame cutting meat,0.8566382,0.6226715228774331
The lady isn't slicing up the meat,dame cutting meat,0.2908004,0.6188429548190191
The lady is eating slices of meat,dame eating cutting meat,0.88954926,0.5663024078715931
Some ferrets are climbing down from a shelf,rat climb closet,0.56861395,0.48385440309842426
Ferrets are climbing down from a shelf,cattle climb closet,0.64462155,0.5375233346765692
Ferrets are climbing up a shelf,cattle climb closet,0.63191795,0.5454290449619293
A few ferrets are climbing out of the cage,rat climb cager,0.72332555,0.5338201182229179
Several ferrets are climbing out of the cage,multiple rat climb cager,0.7363085,0.5223997448171888
Several ferrets are climbing into the cage,multiple rat climb cager,0.7350527,0.5086012345093948
A man is getting into an automobile,man getting automobile,0.91500527,0.6071077704429626
A man is getting into a car,man getting car,0.91790104,0.5990358233451843
A man is getting off the car,man getting car,0.79768175,0.5937221586704254
A man is hurriedly getting into a car in a garage,man hurry getting car truck,0.72044337,0.5772961046960619
A man is getting into a car in a garage,man getting car truck,0.7369394,0.5465873948165348
A man is parking a car in a garage,man automobile car truck,0.69657373,0.47303986090880173
A man is getting a garage for the car,man getting truck car,0.73284405,0.5567042460808387
A person is cutting a capsicum into pieces,someone cutting condiment part,0.71568644,0.4874583014420101
A capsicum is being cut into pieces by a person,condiment being cut part someone,0.8433716,0.5181461993385764
