OG_sentences,gen_sentences,cosine_similarity_BERT,jaccard_similarity_BERT
There is no girl riding a horse,girl bike cattle,0.37329584,0.5260559678077698
The girl is trotting on the horse,girl thrashing cattle,0.51822615,0.5323761839133042
The person is trotting on the horse,someone thrashing cattle,0.41176343,0.4789992616726802
The boy is trotting on the horse,boy thrashing cattle,0.45481372,0.53478453709529
A man is breaking a slab of concrete with a sledge hammer,man breakage lean stucco slug whip,0.6611719,0.45776168595660816
A man is breaking a block of concrete with a sledge hammer,man breakage inhibit stucco slug whip,0.5201924,0.436897917934086
There is no man breaking a slab of concrete with a sledge hammer,man breakage lean stucco slug whip,0.33907604,0.49549192967622174
The man is using a sledgehammer to break a concrete block that is on another man,man utilize shackle break stucco inhibit someone man,0.5933891,0.516482661510336
The man is using a sledgehammer to break a concrete block that is on another person,man utilize shackle break stucco inhibit someone someone,0.56353384,0.5164726746493372
The woman is using a sledgehammer to break a concrete block that is on another man,woman utilize shackle break stucco inhibit someone man,0.55381215,0.524711549282074
A dog is barking at a ball,dog beating goal,0.71108174,0.5900516293265603
An animal is barking at a ball,animal beating goal,0.66886425,0.5751472603191029
There is no dog barking at a ball,dog beating goal,0.19278838,0.5629671762386957
A dog is swimming after a tennis ball,dog washing dancing goal,0.66501796,0.4637659341096878
A dog is swimming after a ball,dog washing goal,0.6106267,0.4747576773166656
A cat is swimming after a tennis ball,cat washing dancing goal,0.82026964,0.4682276596625646
A cupcake is being eaten by a girl,pie being eating girl,0.86510843,0.5818148652712504
A girl is eating a cupcake,girl eating pie,0.8884511,0.583098570505778
A boy is eating a cupcake,boy eating pie,0.8922318,0.5831143392456902
A woman is eating a cupcake,woman eating pie,0.8886272,0.57365306880739
A woman is eating a cake,woman eating pie,0.86287725,0.5807273520363702
A woman is not eating a cupcake,woman eating pie,0.28398842,0.5557765305042267
A person is spitting,someone thrashing,0.6727147,0.45797820223702324
A man is playing keyboards,man play tableware,0.49574587,0.4858574628829956
A man is not playing keyboards,man play tableware,0.22201702,0.4850532358342951
A man is riding a rodeo bull,man bike roleplay swine,0.52669156,0.415348089658297
A man is falling off a mechanical bull,man fall engine swine,0.7417984,0.497987857231727
A man is cutting a boot with a sword,man cutting launch gun,0.6245375,0.5494942894348731
A man is cutting a boot with a blade,man cutting launch peel,0.57843125,0.5499461705868061
There is no man cutting a boot with a sword,man cutting launch gun,0.22889033,0.5517500638961792
A person is severing the toe of an empty leather boot with a sword,someone breakage footgear free skin launch gun,0.4145788,0.5105085298418999
A man is severing the toe of an empty leather boot with a sword,man breakage footgear free skin launch gun,0.48245862,0.49978600939114887
A woman is severing the toe of an empty leather boot with a sword,woman breakage footgear free skin launch gun,0.5870584,0.5060875738660494
A chef is cleaning a bowl of soup,chief washing sack sausage,0.63377416,0.45978081226348877
A bowl of soup is being cleaned by a chef,sack sausage being tidy chief,0.48567933,0.4921582043170929
A chef is getting a bowl of soup dirty,chief getting sack sausage dirt,0.5645474,0.5021578669548035
A man is wiping the edge of a bowl,man washing border sack,0.7937784,0.5456525524457295
A man is cleaning the edge of a bowl,man washing border sack,0.80276364,0.5155472925731114
There is no man wiping the edge of a bowl,man washing border sack,0.34314358,0.5385184213519096
The guitar is being played by a kid,gyration being play girl,0.377913,0.5016562296794012
A kid is playing the guitar,girl play gyration,0.39808708,0.4651602268218994
A kid is playing the piano,girl play plane,0.34028757,0.47634584373897976
A young boy is singing and playing a guitar,young boy sing play gyration,0.8081354,0.5363979538281759
A kid is singing and playing a guitar,girl sing play gyration,0.60394275,0.49179672736387986
There is no young boy singing and playing a guitar,young boy sing play gyration,0.30391353,0.518985740840435
Someone is stirring a pot of chili with a spoon,someone mingle sack chilliness lump,0.32267684,0.483582788043552
A pot of chili is being stirred by someone with a spoon,sack chilliness being mingle someone lump,0.34906057,0.517041024836627
Nobody is stirring a pot of chili with a spoon,someone mingle sack chilliness lump,0.09730559,0.46979916758007473
Someone is stirring chili in a kettle,someone mingle chilliness strainer,0.36314526,0.43321679319654194
Someone is stirring chili in a pot,someone mingle chilliness sack,0.27553856,0.4409224646432059
Someone is not stirring chili in a kettle,someone mingle chilliness strainer,0.27246925,0.44609450101852416
A person is eating in a restaurant,someone eating repast,0.74326307,0.47328814593228424
A person is eating at a table,someone eating table,0.9729586,0.6077123165130616
A person is not eating at a table,someone eating table,0.33269396,0.5969296097755432
A man is making a bed,man make bed,0.9510835,0.6133027540312873
A person is making a bed,someone make bed,0.94012827,0.5784584482510885
A person is not making a bed,someone make bed,0.41393924,0.5645884692668914
A cat is playing with a small bottle,cat play young bottle,0.9367008,0.5655465175708135
An animal is playing with a small bottle,animal play young bottle,0.8174353,0.5446336617072424
A cat is playing with a big bottle,cat play plenty bottle,0.8646272,0.5613476832707723
A bottle is being licked by the cat,bottle being chew cat,0.8607695,0.601131694657462
The cat is licking a bottle,cat chew bottle,0.8530217,0.5498913049697876
The dog is licking a bottle,dog chew bottle,0.7645204,0.542688125371933
A small dog is lying on the bed,young dog fornicate bed,0.8272966,0.47347453236579895
A small dog is lying on a bed,young dog fornicate bed,0.8276086,0.47211927601269316
A small cat is lying on a bed,young cat fornicate bed,0.87283957,0.4722948372364044
A small animal is lying on the bed,young animal fornicate bed,0.76216877,0.4599519499710628
A small dog is lying under the bed,young dog fornicate bed,0.83534324,0.44402793049812317
A woman is cutting butter,woman cutting butter,0.98563397,0.5764071494340897
A woman is slicing butter,woman cutting butter,0.95872366,0.6087862186961703
A man is slicing butter,man cutting butter,0.95542836,0.6098965671327379
There is no woman slicing tofu,woman cutting sausage,0.23206133,0.5243571400642395
The man is playing with a skull,man play bosom,0.56356853,0.5613125725225969
The person is playing with a skull,someone play bosom,0.5278157,0.5074519081549211
There is no man playing with a skull,man play bosom,0.17029408,0.5262262473503748
The man is playing the instrument,man play instrumentation,0.9116645,0.51826691031456
Some cheese is being put on a pizza by a man,sausage being put pie man,0.81093335,0.5638926215469837
The cook is sprinkling cheese on the pizza,cook thrashing sausage pie,0.6827934,0.5003528892993927
The man is sprinkling cheese on the pizza,man thrashing sausage pie,0.70579815,0.5380959920585155
There is no man sprinkling cheese on the pizza,man thrashing sausage pie,0.4176097,0.525723373188692
A man is firing a shotgun,man beating gun,0.7448889,0.5734287103017172
A man is firing a gun,man beating gun,0.77389646,0.5693450768788656
A man is reloading a shotgun,man readjustment gun,0.7633586,0.47638168434302014
A man is shooting a shotgun,man gun gun,0.7837763,0.5211412972874112
There is no man shooting a shotgun,man gun gun,0.40405446,0.5068040251731872
A famous singer is dancing on the ceiling,celebrity song dancing wall,0.73102856,0.5412873576084772
A great singer is dancing on the ceiling,plenty song dancing wall,0.72609645,0.4954097966353099
There is no famous singer dancing on the ceiling,celebrity song dancing wall,0.37399247,0.5426673614061795
A man is dancing on the ceiling,man dancing wall,0.8217617,0.5741350293159485
A person is dancing on the ceiling,someone dancing wall,0.7941014,0.5659068644046783
A man is dancing on the floor,man dancing layer,0.87008965,0.5511168837547302
A cow is eating grass,cow eating lumber,0.84395206,0.49307633770836723
A cow is grazing,cow tilling,0.7852279,0.5623652189970016
A cow is not eating grass,cow eating lumber,0.37445027,0.48741846680641177
Hay is being eaten by a cow,cattle being eating cow,0.90282,0.569461004300551
A cow is eating hay,cow eating sieve,0.8668055,0.49723153644137913
A cow is not eating hay,cow eating sieve,0.3388152,0.49246994853019715
A man is having lunch,man eating,0.8233285,0.571649261883327
A man is eating,man eating,0.98924154,0.6057394643624624
A man is puking,man muckle,0.6057675,0.5166422054171562
A woman is dancing gracefully,woman dancing gracefulness,0.97557974,0.4861269647424871
A woman is sleeping,woman bed,0.7767025,0.5303471485773722
A baby is playing with a doll,girl play statue,0.56048584,0.4986271560192108
A baby is playing with a toy,girl play game,0.5917452,0.4804867386817932
A baby is not playing with a doll,girl play statue,0.29236913,0.48901939392089844
A tiger cub is playing with a ball,rat cat play goal,0.44310975,0.5085127154986063
A baby tiger is playing with a ball,girl rat play goal,0.50821567,0.5220738848050436
There is no baby tiger playing with a ball,girl rat play goal,0.25372922,0.5163926390501169
The man is playing a game on a lawn,man play game pavement,0.79995036,0.5583832774843488
The man is playing a game on the grass,man play game lumber,0.5926304,0.545717179775238
There is no man playing a game on the grass,man play game lumber,0.20338675,0.522168246905009
The animal is grazing on the grass,animal tilling lumber,0.5042095,0.4788414148183969
There is no rhino grazing on the grass,fox tilling lumber,0.21733436,0.4841748038927714
A man is talking to a woman,man talking woman,0.9124565,0.588133430480957
A man and a woman are speaking,man woman speak,0.89765,0.5950847804546356
A man is talking to a boy,man talking boy,0.92983454,0.6058680832386016
A woman is talking to a man,woman talking man,0.9211974,0.5921380579471588
A woman is cracking eggs,woman breakage poultry,0.66681254,0.4053492546081543
A woman is breaking eggs,woman breakage poultry,0.79315376,0.40354321002960203
A man is cracking eggs,man breakage poultry,0.62222075,0.4068958401679993
A man is not riding a bicycle,man bike bike,0.46855372,0.546281921863556
A man is riding an electric bicycle,man bike electrode bike,0.84100723,0.5091562487862327
A person is riding an electric bicycle,someone bike electrode bike,0.8174863,0.5087598291310397
There is no man riding an electric bicycle,man bike electrode bike,0.49091738,0.5063772896925608
A cat is jumping into a container,cat glide strainer,0.7916877,0.4768780198964206
A cat is jumping into a box,cat glide bag,0.79479045,0.5176159143447876
A dog is jumping into a box,dog glide bag,0.5654754,0.4973252356052399
A boy is talking to a leaf,boy talking peel,0.7758944,0.6083365917205811
A young man is talking to a leaf,young man talking peel,0.7862222,0.5884278963009516
An old man is talking to a leaf,oldster man talking peel,0.76049995,0.538464761697329
A fish is being cut by a man,shellfish being cut man,0.86356443,0.5275203264676608
A man is cutting a fish,man cutting shellfish,0.9024712,0.48529455065727234
There is no man cutting a fish,man cutting shellfish,0.2937799,0.4996412017128684
A man is slicing a fish,man cutting shellfish,0.8803746,0.5205966234207153
A fish is being sliced by a man,shellfish being cutting man,0.8586607,0.5309668366725628
A person is frying some food,someone fry food,0.9516182,0.5816963182555305
A person is cooking some food,someone eating food,0.73331344,0.5501384867562188
A person is not frying,someone fry,0.27933037,0.5369248390197754
A person is peeling a potato,someone peel pie,0.75306916,0.5318440861172147
A potato is being peeled by a person,pie being peel someone,0.7538049,0.5539664328098297
There is no person peeling a potato,someone peel pie,0.2231802,0.5325907647609711
A man is rowing a canoe,man roving watercraft,0.7102307,0.48079026242097217
A man is rowing a boat,man roving watercraft,0.6763289,0.47999802728494007
A woman is rowing a boat,woman roving watercraft,0.7230375,0.4929206818342209
A man is shooting with a gun,man gun gun,0.85721254,0.5208372890949249
A man is shooting with a weapon,man gun gun,0.83526284,0.5120871126651764
A man is shooting with a bow,man gun shackle,0.5470623,0.508194316517223
A woman is dancing near a fire,woman dancing vicinity fire,0.9749907,0.5093866338332494
A woman is dancing near a fireplace,woman dancing vicinity fireplace,0.9786097,0.5127606938282648
There is no woman dancing near a fire,woman dancing vicinity fire,0.37133142,0.5138712296119103
A guitar is being played by a girl,gyration being play girl,0.6535794,0.5154287264897273
A girl is playing a guitar,girl play gyration,0.6569473,0.4981153905391693
A man is diving off a rock,man delve rubble,0.35568547,0.43726080656051636
A man is diving off a cliff,man delve ravine,0.33364362,0.45875902970631915
There is no man diving off a cliff,man delve ravine,0.15671304,0.47090107661027175
A motorcycle is being ridden by a man,bike being run man,0.7082807,0.5984861529790438
The woman is playing the guitar,woman play gyration,0.63484627,0.5069479942321777
The person is playing the guitar,someone play gyration,0.5875158,0.47588254809379577
A man is boiling noodles in water,man evaporation sausage freshwater,0.57223046,0.4184816241264343
Someone is stirring noodles in the water,someone mingle sausage freshwater,0.626385,0.4606264325288626
Someone is stirring food in the water,someone mingle food freshwater,0.713498,0.4781969143794133
Nobody is stirring noodles in the water,someone mingle sausage freshwater,0.19480932,0.4374979046674875
The women are singing and dancing,woman sing dancing,0.9513949,0.559370736281077
The persons are singing and dancing,personality sing dancing,0.8938144,0.5424575077162849
The women are not singing and dancing,woman sing dancing,0.3333177,0.5406876981258393
Two women are dancing and singing in front of a crowd,till woman dancing sing advance bunch,0.8341075,0.49172087627298694
Two women are dancing and singing in front of many people,till woman dancing sing advance plenty folk,0.8053153,0.48358397020234
Two men are dancing and singing in front of a crowd,till husbandman dancing sing advance bunch,0.6746739,0.429741190539466
A lemur is biting a person's finger,salamander beating someone gesture,0.49098063,0.550783783197403
An animal is biting a person's finger,animal beating someone gesture,0.7300488,0.588663637638092
A lemur is licking a person's finger,salamander chew someone gesture,0.6687068,0.5083455704152584
An animal is biting someone's finger,animal beating someone gesture,0.73115325,0.5888234652005709
An animal is biting somebody's hand,animal beating someone gesture,0.78024995,0.5910742970613333
A boy is skateboarding on a half pipe,boy chessman part piping,0.39122963,0.49511273418154034
A man is skateboarding on a half pipe,man chessman part piping,0.3678562,0.4879535904952458
A girl is skateboarding on a half pipe,girl chessman part piping,0.38523543,0.49391288842473713
A skateboarder is doing acrobatics on a half pipe,chessman dancing part piping,0.592865,0.543969730536143
A skateboarder is doing tricks on a half pipe,chessman trickery part piping,0.3004083,0.5008728466928005
A skateboarder is falling off a half pipe,chessman fall part piping,0.437582,0.5157319349902016
A big dog is running on the ground,plenty dog running groundwork,0.7771013,0.4726840624442467
A dog is running on the ground,dog running groundwork,0.8859184,0.5098543925718828
A dog is sitting on the ground,dog seats groundwork,0.8098798,0.4711122512817383
The girl is tapping her fingernails,girl hitting lash,0.46713763,0.5890636389905756
A girl is tapping her fingernails,girl hitting lash,0.48382905,0.5917494893074036
A boy is tapping his fingernails,boy hitting lash,0.37421435,0.5992729230360552
A man and a woman are driving down the road in a car,man woman drive road car,0.94231224,0.5926443139712015
A man and a woman are driving down the road in an open-air vehicle,man woman drive road air automobile,0.89390016,0.5769996832717549
Two men are driving down the road in an open-air vehicle,till husbandman drive road air automobile,0.65089476,0.46452700793743135
A man and a woman are driving down the street in a jeep,man woman drive strait jape,0.6941042,0.49463150799274447
Two persons are driving down the street in a jeep,till personality drive strait jape,0.26048353,0.34272142017588897
A man and a woman are not driving down the street in a jeep,man woman drive strait jape,0.2670019,0.5141320938155765
Ingredients are being poured into a bowl by a woman,compound being shed sack woman,0.5382787,0.5288923643529415
A woman is pouring ingredients into a bowl,woman infuse stuff sack,0.6415825,0.48360455461910795
There is no woman pouring ingredients into a bowl,woman infuse stuff sack,0.23702052,0.4861319820086161
The chef is seasoning the oil,chief condiment oil,0.62493896,0.5070396932688627
The woman is seasoning the oil,woman condiment oil,0.8718225,0.5641445517539978
The woman is not seasoning the oil,woman condiment oil,0.50923985,0.5589148799578348
A horse is being ridden by a person,cattle being run someone,0.5359291,0.5873260406347421
A person is riding a horse,someone bike cattle,0.5749518,0.5108042889171176
A person is riding a motorbike,someone bike bike,0.80889934,0.5563064396381379
Potatoes are being sliced by a woman,sausage being cutting woman,0.8287631,0.5701797703901926
There is no woman slicing potatoes,woman cutting sausage,0.30149013,0.5207787275314331
The man is training,man trainer,0.82742393,0.5416461924711863
The man is doing exercises,man exerciser,0.8443517,0.511616975069046
The man is not doing exercises,man exerciser,0.45531493,0.4979456331994798
Two men are boxing,till husbandman boxing,0.70156443,0.3347824439406395
Two men are hugging,till husbandman wrapping,0.5818671,0.3343673348426819
A man is putting vegetables into a pot,man put vegetation sack,0.5894988,0.5008323330145615
Vegetables are being put into a pot by a man,vegetation being put sack man,0.56080496,0.5629999497357536
A man is removing vegetables from a pot,man disposal vegetation sack,0.7068255,0.4422617738063519
Someone is pouring ingredients into a pot,someone infuse stuff sack,0.54124284,0.46648046603569615
Someone is adding ingredients to a pot,someone addition stuff sack,0.65681285,0.49042919278144836
Nobody is pouring ingredients into a pot,someone infuse stuff sack,0.09328035,0.4393752354841966
The man is standing on a rocky mountain and gray clouds are in the background,man standing rubble mountain gray cloud groundwork,0.8256634,0.5332528576254845
"The man is standing on a mountain, which is rocky, and gray clouds are in the background",man standing mountain mountain gray cloud groundwork,0.8951788,0.5937272310256958
The man is not standing on a rocky mountain and gray clouds are not in the background,man standing rubble mountain gray cloud groundwork,0.48766327,0.5403178953207456
"A person with a back pack, who is topless, is in front of a pile of rocks and clouds are in the background",someone back package overtop advance lump rubble cloud groundwork,0.44697902,0.5969094304662002
A topless person with a back pack is in front of a pile of rocks and clouds are in the background,overtop someone back package advance lump rubble cloud groundwork,0.4356969,0.5542180397931267
A fully dressed person is behind a pile of rocks and a clear sky is in the background,complete apparel someone back lump rubble tidy air groundwork,0.42795455,0.5114412862679054
A black topless person is packing a pile of rocks and a front of clouds are in the background,gray overtop someone wrapping lump rubble advance cloud groundwork,0.5960142,0.5205167774111032
The dog is catching a ball,dog seizing goal,0.56015825,0.4920689702033997
A dog is catching a ball,dog seizing goal,0.6251277,0.4886879205703735
There is no dog catching a ball,dog seizing goal,0.16614169,0.4821116490797563
A dog is furiously chasing a ball through dirt,dog fury pursue goal dirt,0.8256783,0.5498763498137978
A dog is chasing a ball through dirt,dog pursue goal dirt,0.8295968,0.5579424599806467
A dog is leaving a ball in the dirt,dog leaving goal dirt,0.8041838,0.5996896028518677
A boy in a blue shirt has dirt on his face,boy gray skirt dirt facet,0.73196626,0.5118466094136238
A boy in a blue dyed shirt has dirt on his face,boy gray dye skirt dirt facet,0.6999842,0.5151006014723527
A topless boy has a clean face,overtop boy tidy facet,0.69809145,0.5010367769461411
A boy has a blue face and dirt on the shirt,boy gray facet dirt skirt,0.66772044,0.5134585984051228
"A child, who has blond hair, is holding a yellow bottle",young pink hairpin keeping gray bottle,0.6721395,0.5323067247867584
A blond child is holding a yellow bottle,pink young keeping gray bottle,0.71601677,0.5119937520760757
There is no blond child holding a yellow bottle,pink young keeping gray bottle,0.33161318,0.5119896488530296
A man in a hat is pacing through a store,man cloak beating store,0.5966834,0.5565999895334244
A man in a hat is walking through a store,man cloak going store,0.7666638,0.5355427066485087
A man in a hat is walking past a store,man cloak going past store,0.86036336,0.5474475212395191
A walker is in a hat store for men,traveler cloak store husbandman,0.6420367,0.4663961172103882
The man in a hat suited for cowboys is walking through a market and is putting a hand in his pocket,man cloak fit cattle going market put gesture bag,0.7226062,0.5566924549639225
The man in a cowboy hat is walking through a market and is putting a hand in his pocket,man cager cloak going market put gesture bag,0.66808724,0.5246540616298544
The man in a cowboy hat is not walking through a market and is not putting a hand in his pocket,man cager cloak going market put gesture bag,0.3002786,0.5389667499449945
A large white crane is flying near the water,plenty gray treadle fly vicinity freshwater,0.5028699,0.35865652561187744
"A crane, which is large and white, is flying near the water",treadle plenty gray fly vicinity freshwater,0.43794087,0.4636939375296883
A large white crane is flying far above the water,plenty gray treadle fly long freshwater,0.5122601,0.39213090141614276
A white bird is landing swiftly in the water,gray poultry landing hurry freshwater,0.38995934,0.4366038055980907
The white bird is landing swiftly in the water,gray poultry landing hurry freshwater,0.39212474,0.44970018723431754
A white bird is swiftly taking off from the water,gray poultry hurry getting freshwater,0.45463008,0.46590495109558105
The land near a white bird is being watered swiftly,nation vicinity gray poultry being soak hurry,0.44330138,0.456864751520611
A brown dog is calmly standing in the water,gray dog tranquillity standing freshwater,0.805325,0.5073710539761711
A brown dog is standing in the water,gray dog standing freshwater,0.7882168,0.5363803368348342
There is no brown dog standing in the water,gray dog standing freshwater,0.53786373,0.5247260417257037
A dog with golden fur is in the water,dog gray skin freshwater,0.6595615,0.501714859689985
A dog with a golden coat is in the water,dog gray cloak freshwater,0.6315564,0.49153008311986923
A dog with golden fur is out of the water,dog gray skin freshwater,0.6602143,0.5136249343554179
"A girl in a blue shirt, who looks young, is walking on the sidewalk and holding up a pink sign",girl gray skirt seem young going pavement keeping pink marque,0.7557204,0.5768123991561659
A young girl in a blue shirt is walking on the sidewalk and holding up a pink sign,young girl gray skirt going pavement keeping pink marque,0.7568125,0.5555177181959152
There is no young girl in a blue shirt walking on the sidewalk and holding up a pink sign,young girl gray skirt going pavement keeping pink marque,0.48157066,0.5599600446635279
A young girl by a pink sign is holding up a blue shirt and is walking on the sidewalk,young girl pink marque keeping gray skirt going pavement,0.7274054,0.567175030708313
The girl is carrying a sign and a group of people is following her,girl bringing marque grouping folk following,0.70713437,0.5666976485933576
The girl is carrying a sign and is being followed by a group of people,girl bringing marque being following grouping folk,0.7616338,0.5868124443551769
The girl is not carrying a sign and no group of people is following her,girl bringing marque grouping folk following,0.17643602,0.5450935011560266
One man in a big city is holding up a sign and begging for money,someone man plenty citizen keeping marque supplication money,0.4980691,0.5082838678359985
A man in a big city is holding a sign and begging for money,man plenty citizen keeping marque supplication money,0.46587956,0.5220667434775311
A man in a small city is doing charity work,man young citizen kindness labour,0.60590607,0.499003533522288
A big city is begging for men and money holders,plenty citizen supplication husbandman money retainer,0.539448,0.4251066267490387
A homeless man is holding up a sign and is begging for money,incompetent man keeping marque supplication money,0.5968655,0.5057220384478569
A homeless man is holding up a sign and is pitifully begging for money,incompetent man keeping marque regret supplication money,0.7016615,0.5182269745402865
A homeless man is putting down a sign and refusing some charity,incompetent man put marque disavow kindness,0.5931531,0.4572437380750974
