OG_sentences,gen_sentences,cosine_similarity_BERT,jaccard_similarity_BERT
A man in a blue cowboy hat is riding a white horse,man gray cager cloak bike gray cattle,0.5383116,0.4412214727628799
A man in a blue cowboy hat is riding a black horse,man gray cager cloak bike gray cattle,0.5539803,0.46816812242780415
Three people are driving ATVs,quarters folk drive automobile,0.64420164,0.387552285194397
ATVs are being driven by three people,automobile being drive quarters folk,0.53738827,0.4434318450781015
There are no people driving ATVs,folk drive automobile,0.28476644,0.44345511198043824
Three people are driving four wheel ATVs in a field,quarters folk drive quarters bike automobile region,0.5113456,0.4079498185051812
Three people are driving four wheel vehicles in a field,quarters folk drive quarters bike automobile region,0.596805,0.3806041163556716
Three people are driving four wheel ATVs in a street,quarters folk drive quarters bike automobile strait,0.6078268,0.39731717109680176
Two white dogs and one brown dog are chasing a ball,till gray dog someone gray dog pursue goal,0.49322048,0.38987470927991363
Two white dogs and one brown dog are chasing a toy,till gray dog someone gray dog pursue game,0.69034195,0.3885622400986521
Two white dogs and one brown dog are not chasing a ball,till gray dog someone gray dog pursue goal,0.461071,0.41058188676834106
Two white dogs are playing with a brown dog and a tennis ball,till gray dog play gray dog dancing goal,0.6847536,0.43736690282821655
Two white dogs are playing with a brown dog and a ball,till gray dog play gray dog goal,0.65314126,0.4479757735603734
Two white cats are playing with a brown dog and a ball,till gray cat play gray dog goal,0.7520002,0.46278536633441325
A white race car is driving through a puddle,gray compete car drive pud,0.54992247,0.5119787414868673
A white racing vehicle is driving through a puddle,gray compete automobile drive pud,0.41268682,0.5066723465919495
There is no white race car driving through a puddle,gray compete car drive pud,0.17890814,0.5113509222865105
The white rally car is throwing mud into the air and is approaching a bend in the track,gray revolt car sacking dirt air coming bending route,0.65741897,0.5234001135003978
A white rally car is throwing mud into the air and is approaching a bend in the track,gray revolt car sacking dirt air coming bending route,0.6460271,0.5186590182370153
A black rally car is throwing mud into the air and is approaching a bend in the track,gray revolt car sacking dirt air coming bending route,0.72933185,0.5266121214833753
A dog is jumping at a shiny blue soccer ball in a field of dry leaves,dog glide glow gray footballer goal region froth peel,0.59184253,0.47053507301542496
An animal is jumping at a shiny blue soccer ball in a field of dry leaves,animal glide glow gray footballer goal region froth peel,0.51713276,0.47534154962610314
There is no dog jumping at a shiny blue soccer ball in a field of dry leaves,dog glide glow gray footballer goal region froth peel,0.32035354,0.4901862676654543
A dog is jumping at dry leaves in a field of shiny blue soccer balls,dog glide froth peel region glow gray footballer lump,0.5044923,0.44898924690026504
A small black dog is wearing a red collar and is in the leaves with a blue ball,young gray dog apparel pink cloak peel gray goal,0.5536946,0.5115384395633426
A little black dog is wearing a red collar and is in the leaves with a blue ball,young gray dog apparel pink cloak peel gray goal,0.5470317,0.5142236437116351
A big black dog is wearing a red collar and is in the leaves with a blue ball,plenty gray dog apparel pink cloak peel gray goal,0.41972566,0.49962787543024334
A dog is running towards a ball,dog running till goal,0.8087311,0.5517238812013106
A dog is running towards a toy,dog running till game,0.8115079,0.538510187105699
A dog is not running towards a ball,dog running till goal,0.36538428,0.5509497225284576
A dog is running through a field and is chasing a ball,dog running region pursue goal,0.75994086,0.5489389300346375
A dog is running through a field and is chasing a toy,dog running region pursue game,0.84248716,0.5436462198986727
There is no dog running through a field and chasing a ball,dog running region pursue goal,0.32891113,0.542057149550494
Four athletes are with a man in a crowded stadium,quarters exerciser man plenty stadium,0.62139964,0.5005206651985645
Four athletes are with a person in a crowded stadium,quarters exerciser someone plenty stadium,0.5350322,0.49314091354608536
Four athletes are with a woman in a crowded stadium,quarters exerciser woman plenty stadium,0.6504228,0.5107353441417217
A person in a pink jacket is running onto the field,someone pink jacket running till region,0.8223264,0.5496909933931687
A person in pink is running onto the field,someone pink running till region,0.7789655,0.5382836290768215
A person in a pink jacket is not running onto the field,someone pink jacket running till region,0.39505774,0.5574539204438528
A fur scarf is being held by an Asian woman,skin scarf being happening foreigner woman,0.6883739,0.4646300883854137
An Asian woman is holding a fur scarf,foreigner woman keeping skin scarf,0.72479737,0.4414996845381601
There is no Asian woman holding a fur scarf,foreigner woman keeping skin scarf,0.42451704,0.4489029447237651
A woman dressed in elegant clothing is inside a crowd of people and is looking down,woman apparel tidy clothing inwardness bunch folk looking,0.5821533,0.5073531682674701
An elegant woman is inside a crowd of people and is looking down,tidy woman inwardness bunch folk looking,0.5159552,0.5269057693935576
A woman dressed in elegant clothing is inside a crowd of people and is looking up,woman apparel tidy clothing inwardness bunch folk looking,0.5844141,0.5088665233208582
A boy is running through the sea at the beach,boy running mar lake,0.73249614,0.5320781597069332
A boy is running through the water at the beach,boy running freshwater lake,0.7950944,0.5335780223210652
A girl is running through the water at the beach,girl running freshwater lake,0.8188708,0.5309575438499451
A boy in a white t-shirt is splashing in shallow water,boy gray sweater thrashing dull freshwater,0.68854594,0.47233053134835284
A kid in a white t-shirt is splashing in shallow water,girl gray sweater thrashing dull freshwater,0.4841855,0.45424523301746533
There is no boy in a white t-shirt splashing in shallow water,boy gray sweater thrashing dull freshwater,0.6126801,0.4942088897029559
Two tall basketball players are scrambling for the ball on the court,till long baseball gambler thrashing goal court,0.41282055,0.447465255856514
Two basketball players are scrambling for the ball on the court,till baseball gambler thrashing goal court,0.4443977,0.44130631739443
Two football players are scrambling for the ball on the court,till footballer gambler thrashing goal court,0.5205718,0.43751570452814514
A basketball player is on the court floor and another one is grabbing the ball,baseball play court layer someone someone seizing goal,0.35191298,0.48752734065055847
A basketball player is on the court floor and the ball is being grabbed by another one,baseball play court layer goal being catch someone someone,0.31250775,0.5158998989141904
There is no basketball player on the court floor and no one is grabbing the ball,baseball play court layer someone seizing goal,0.13049585,0.5145817448695501
The white dogs are looking curiously at the black llama,gray dog looking asking gray flame,0.39516348,0.4763178544885972
The white dogs are looking at the black llama,gray dog looking gray flame,0.30323,0.4813102185726166
The white dogs aren't looking curiously at the black llama,gray dog looking asking gray flame,0.32002348,0.4848369046261436
The black llama is curiously looking at the white dogs,gray flame asking looking gray dog,0.5033756,0.48270943936179667
A black sheep is standing near three white dogs,gray cattle standing vicinity quarters gray dog,0.70337105,0.38877808697083416
A black sheep is standing close to three white dogs,gray cattle standing close quarters gray dog,0.7174446,0.44439223233391256
A black sheep is standing far from three white dogs,gray cattle standing long quarters gray dog,0.59835446,0.4341582831214456
Two poodles are in the snow and one is jumping high,till dog cloud someone glide elevation,0.43708262,0.43593042757776046
Two poodles are in the snow and one is jumping,till dog cloud someone glide,0.4606123,0.43415845558047295
Two poodles are in the snow and one is lying down,till dog cloud someone fornicate,0.43300918,0.4003444063036065
A grey dog is jumping toward a black and white dog in the soft snow,gray dog glide till gray gray dog lean cloud,0.6032001,0.4949565902352333
A grey dog is jumping toward a black and white dog in the snow,gray dog glide till gray gray dog cloud,0.60312873,0.4959658248858018
A grey dog is jumping toward a black and white dog in the water,gray dog glide till gray gray dog freshwater,0.6629205,0.48993242305258045
The man surrounded by photographers is wearing a gray suit and glasses,man circumvent cinematography apparel gray fit sight,0.53389525,0.42295706272125244
The man surrounded by men with a camera is wearing a gray suit and glasses,man circumvent husbandman closet apparel gray fit sight,0.5285381,0.47272084997250485
The woman surrounded by photographers is wearing a gray suit and glasses,woman circumvent cinematography apparel gray fit sight,0.5148163,0.4280088206996088
A man in a elegant dress is being surrounded by photographers,man tidy apparel being circumvent cinematography,0.38188457,0.4136160271508353
A man in a suit is being surrounded by photographers,man fit being circumvent cinematography,0.39219394,0.4232003375103599
A man in a suit is not being surrounded by photographers,man fit being circumvent cinematography,0.41748872,0.4375859946012497
A photographer is being surrounded by men,picture being circumvent husbandman,0.48073503,0.39356780903679983
Children in swimming suits are playing in the pool,young washing apparel play lake,0.6175388,0.45087118233953205
Children in swimming suits are playing in the water,young washing apparel play freshwater,0.74457824,0.4631660660107931
Children in swimming suits are not playing in the water,young washing apparel play freshwater,0.3940731,0.46765364706516266
The boys are wearing bathing suits and water is splashing around,young apparel washing apparel freshwater thrashing circumvent,0.56709224,0.3719680930177371
The kids are wearing bathing suits and water is splashing around,young apparel washing apparel freshwater thrashing circumvent,0.6107315,0.36234162499507266
The kids are not wearing suits and water is splashing around,young apparel apparel freshwater thrashing circumvent,0.5358572,0.37133830526600714
Boys are dangling from straps and kicking at each other,girl bending clutches beating,0.3851443,0.5155992321670055
People are dangling from straps and kicking at each other,folk bending clutches beating,0.70450866,0.5336861200630665
Nobody is dangling from straps and kicking at each other,someone bending clutches beating,0.22043312,0.5613973177969456
A blonde girl is hanging by gymnastic ropes,pink girl lacing fitness rope,0.7837305,0.5480470446979299
A girl is hanging by gymnastic ropes,girl lacing fitness rope,0.7792686,0.5644637266794841
A blonde man is hanging by gymnastic ropes,pink man lacing fitness rope,0.75320923,0.5481101835475248
A man dressed in black and white is holding up the tennis racket and is waiting for the ball,man apparel gray gray keeping dancing rig wait goal,0.57428133,0.5280582349875877
A player dressed in black and white is holding up the tennis racket and is waiting for the ball,play apparel gray gray keeping dancing rig wait goal,0.5123991,0.5103258038389271
A man dressed in black and white is dropping the tennis racket and is waiting for the ball,man apparel gray gray fall dancing rig wait goal,0.5164794,0.5212572195700237
A tennis player in mid game is holding a racquet,dancing play middle game keeping sack,0.44085538,0.4717857937018077
A racquet is being held by a tennis player in mid game,sack being happening dancing play middle game,0.44496787,0.4852754246620905
A tennis player in mid game is not holding a racquet,dancing play middle game keeping sack,0.30440375,0.47831169241353083
A dog is playing in the green field,dog play gray region,0.640679,0.5261133511861166
A dog is playing on the green grass,dog play gray lumber,0.6244705,0.4793549317580003
A dog is sleeping on the green grass,dog bed gray lumber,0.57177496,0.435252097936777
A brown and white dog is playing on the grass,gray gray dog play lumber,0.6141862,0.4873594380915165
A brown and white dog is playing on the lawn,gray gray dog play pavement,0.74939173,0.4987689405679703
A brown and white cat is playing on the grass,gray gray cat play lumber,0.8263534,0.488916240632534
A tan skinned kid is looking at the camera,hue skin girl looking closet,0.3011833,0.5103747367858886
A tan skinned child is looking at the camera,hue skin young looking closet,0.48096967,0.4970777710278829
There is no tan skinned child looking at the camera,hue skin young looking closet,0.2532007,0.5003867372870445
A little boy with a bib is watching the camera,young boy biff watching closet,0.6315774,0.5011943802237511
A young boy with a bib is watching the camera,young boy biff watching closet,0.6068235,0.5196536034345627
A little boy with a bib is not watching the camera,young boy biff watching closet,0.43387696,0.4984108104425318
A young boy in the blue shirt is jumping into the water,young boy gray skirt glide freshwater,0.7203599,0.5145444399432132
The young boy in the blue shirt is jumping into the water,young boy gray skirt glide freshwater,0.7163496,0.5219485446026451
The young boy in the blue shirt is not jumping into the water,young boy gray skirt glide freshwater,0.46838257,0.5324270457029343
A young boy is diving into a still lake,young boy delve stay lake,0.6388321,0.5157674551010132
A young boy is jumping into a still lake,young boy glide stay lake,0.6934832,0.5693812327725547
A young girl is jumping into a still lake,young girl glide stay lake,0.6962962,0.567755000931876
Two men are carrying colorful baskets and blankets and walking near a building,till husbandman bringing colour bag scarf going vicinity build,0.49239916,0.4085566639900208
Two people are carrying colorful baskets and blankets and walking near a building,till folk bringing colour bag scarf going vicinity build,0.516026,0.442368283867836
Two people are carrying gray baskets and blankets and walking near a building,till folk bringing gray bag scarf going vicinity build,0.59106374,0.4542696997523308
Two people are walking with laden baskets and colorful blankets,till folk going burden bag colour scarf,0.53762674,0.4535093539290958
Two people are walking with laden baskets and blankets,till folk going burden bag scarf,0.6175877,0.4647989198565483
Two people are sitting with laden baskets and blankets,till folk seats burden bag scarf,0.6344422,0.45048893988132477
A young girl is sitting in a swimsuit,young girl seats sweater,0.62456226,0.5466991911331812
A young girl is sitting in swimming gear,young girl seats washing steering,0.6848619,0.5040901257441595
A young man is sitting in swimming gear,young man seats washing steering,0.6359224,0.5004453063011169
"A young girl is wearing a blue patterned swim suit, a black and yellow swim cap and has blue swimming goggles on her head",young girl apparel gray pattern soak apparel gray gray soak cover gray washing sight chief,0.6187242,0.49058012735275996
"A little girl is wearing a blue patterned swim suit, a black and yellow swim cap and has blue swimming goggles on the head",young girl apparel gray pattern soak apparel gray gray soak cover gray washing sight chief,0.63189495,0.4963305862176986
"A young boy is wearing a blue patterned swim suit, a black and yellow swim cap and has blue swim goggles on her head",young boy apparel gray pattern soak apparel gray gray soak cover gray soak sight chief,0.623115,0.4882683597859882
A dog is running on a snowy road,dog running cold road,0.88799435,0.5829039903787466
A dog is running on a snowy path,dog running cold route,0.8221501,0.567378296301915
A dog is running on a muddy path,dog running dull route,0.6878314,0.6026938144977276
A brown dog is running through a snowy path,gray dog running cold route,0.75636137,0.5576180617014567
A brown dog is running through a snowy trail,gray dog running cold route,0.7556907,0.5530969619750976
A white dog is running through a snowy trail,gray dog running cold route,0.70675087,0.5184146881103515
Two boys in white outfits and red protective gear are sparring on a mat,till young gray apparel pink protection steering fighting comer,0.36441588,0.4215329755907473
Two children in white outfits and red protective gear are sparring on a mat,till young gray apparel pink protection steering fighting comer,0.49323416,0.4159541726112366
Two children in white outfits and red protective gear are sitting on a mat,till young gray apparel pink protection steering seats comer,0.4866054,0.3844204415445742
Two boys are doing martial arts on a blue mat,till young fighting arts gray comer,0.39619035,0.429960235953331
Two kids are doing martial arts on a blue mat,till young fighting arts gray comer,0.4561459,0.4269535541534424
Two boys are doing martial arts on a green mat,till young fighting arts gray comer,0.36638498,0.4252826198935509
A black and white dog is playing with a ruined volleyball in a brown field,gray gray dog play destroy baseball gray region,0.64175415,0.5434267471234003
A black and white dog is playing with a tattered volleyball in a brown field,gray gray dog play weary baseball gray region,0.5579057,0.5222443127632141
A black and white dog is playing with a frisbee in a brown field,gray gray dog play biff gray region,0.5973588,0.5240441068359043
A black and white dog is playing with a broken volleyball,gray gray dog play breakage baseball,0.6368165,0.5058923529254066
A black and white dog is playing with a broken ball,gray gray dog play breakage goal,0.74638295,0.5030269589689043
A black and white dog is playing with a new volleyball,gray gray dog play young baseball,0.5921578,0.5138686579816482
A young boy in a helmet is riding a bike on the road,young boy helm bike bike road,0.9196739,0.5925575055574116
A bike is ridden on the road by a young boy in a helmet ,bike run road young boy helm,0.87518024,0.6188148600714547
A young boy in a helmet is riding a bike on the lawn,young boy helm bike bike pavement,0.84047794,0.556494078040123
The little boy is riding a bicycle in a race,young boy bike bike compete,0.91414684,0.5644206722577413
A bicycle is being ridden by the little boy in a race,bike being run young boy compete,0.90715504,0.6082303743613394
The little girl is riding a bicycle in a race,young girl bike bike compete,0.9267937,0.5657812277475993
Mud is covering a topless woman,dirt covering overtop woman,0.73416597,0.5245083520809809
A topless woman is being covered in mud,overtop woman being covering dirt,0.6793791,0.543644122282664
There is no topless woman covered in mud,overtop woman covering dirt,0.48825517,0.528573853628976
A topless woman is being smeared with a brown substance and a blurry crowd is in the background,overtop woman being froth gray stuff obscure bunch groundwork,0.6884177,0.5726941119540822
A woman is being smeared with brown substance and a blurry crowd is in the background,woman being froth gray stuff obscure bunch groundwork,0.60963094,0.5731560375009265
A topless woman is being smeared with brown substance and a nobody is in the background,overtop woman being froth gray stuff someone groundwork,0.54485387,0.5538289546966553
Two boys and a man are playing games at an arcade,till young man play game stadium,0.58568096,0.43452856821172375
Two kids and a man are playing games at an arcade,till young man play game stadium,0.5681119,0.42589105928645415
Two kids and a woman are playing games at an arcade,till young woman play game stadium,0.5738661,0.43840982633478504
A family is purchasing something at the vending machine,family purchasing stuff selling engine,0.7759584,0.49650124992643085
A family is buying something at the vending machine,family purchasing stuff selling engine,0.7661938,0.49788727504866465
A family is not purchasing something at a vending machine,family purchasing stuff selling engine,0.36060408,0.5037820855776469
A female cheerleader is sitting on the knee of a male cheerleader,woman booster seats bosom husbandman booster,0.58171195,0.5062463446096941
A female cheerleader is sitting on the knee of a man,woman booster seats bosom man,0.6724225,0.5280901226732466
A female cheerleader is jumping on the knee of a male cheerleader,woman booster glide bosom husbandman booster,0.5776564,0.5264989246021617
Some cheerleaders are taking a break,motivator getting break,0.73307157,0.49329539636770886
Some cheerleaders are relaxing,motivator relieve,0.31176764,0.45714133977890015
Some cheerleaders are dancing,motivator dancing,0.7383612,0.47233562337027657
A group of people is holding drinks and pointing at the camera,grouping folk keeping drink indication closet,0.29177997,0.4947190065132944
Drinks are being held by people pointing at the camera,drink being happening folk indication closet,0.4797868,0.48839007318019867
A group of people is holding food and pointing at the camera,grouping folk keeping food indication closet,0.43592757,0.48973749185863297
Several young people are posing for a photo and holding beers,multiple young folk pose photo keeping drink,0.63224375,0.5229156547122531
Several young people are posing for a photo and holding drinks,multiple young folk pose photo keeping drink,0.711599,0.5335311128033532
Several old people are posing for a photo and holding beers,multiple oldster folk pose photo keeping drink,0.5984973,0.4759913275116368
A girl with red hair and red eyebrows is talking,girl pink hair pink beard talking,0.70255524,0.5572537216875288
A girl with red hair and red eyebrows is in midspeech,girl pink hair pink beard medium,0.5433445,0.5812286355278709
"The girl has red hair and eyebrows, several piercings in a ear and a drawing on the back",girl pink hair beard multiple incision earphone depiction back,0.6597682,0.5188000465140623
"The girl has red hair and eyebrows, several piercings in a ear and a tattoo on the back",girl pink hair beard multiple incision earphone incision back,0.6800647,0.5068781919339124
"The girl has red hair and eyebrows, several piercings in a ear and no tattoo on the back",girl pink hair beard multiple incision earphone incision back,0.5997412,0.5105536772924311
A woman in blue has a yellow ball in the mitt,woman gray gray goal middle,0.5268551,0.522137638181448
A woman in blue has a yellow ball in the hand,woman gray gray goal gesture,0.5143515,0.47863029316067696
A man in blue has a yellow ball in the mitt,man gray gray goal middle,0.48760238,0.5236104503273964
The girl in blue is chasing the base runner with a number on the jersey,girl gray pursue base run quantity sweater,0.55962765,0.5940338671207428
The girl in blue is chasing the player with a number on the jersey,girl gray pursue play quantity sweater,0.5505073,0.5879456222057342
The man in blue is chasing the base runner with a number on the jersey,man gray pursue base run quantity sweater,0.4866522,0.5955954979766499
The young man is rock climbing,young man rubble climb,0.7500523,0.49958818609064276
The man is rock climbing,man rubble climb,0.6982893,0.49543442991044784
The young man is not rock climbing,young man rubble climb,0.38475975,0.49910134573777515
A man in a purple hat is climbing a rocky wall with bare hands,man pink cloak climb rubble wall flat gesture,0.6984741,0.4838112046321233
A rocky wall is climbed by a man in a purple hat with bare hands,rubble wall climb man pink cloak flat gesture,0.6147815,0.5187834615890796
A man in a purple hat isn't climbing a rocky wall with bare hands,man pink cloak climb rubble wall flat gesture,0.5523201,0.5067557050631597
Two people are driving a jeep and a lady is sitting on the top of it,till folk drive jape dame seats overtop,0.4917575,0.48557980298995973
Two people are driving a jeep and a girl is sitting on the top of it,till folk drive jape girl seats overtop,0.6488249,0.49703426122665406
Two people are driving a boat and a lady is sitting on the top of it,till folk drive watercraft dame seats overtop,0.48809892,0.4707847714424133
A blond woman is sitting on the roof of a yellow vehicle and two people are inside,pink woman seats wall gray automobile make folk inwardness,0.64989406,0.4732252359390259
A woman with blond hair is sitting on the roof of a yellow vehicle and two people are inside,woman pink hair seats wall gray automobile make folk inwardness,0.6299493,0.4792426247750559
A blond woman is sitting on the roof of a yellow vehicle and two people are outside,pink woman seats wall gray automobile make folk exterior,0.6011659,0.5063079159993392
A large brown dog is jumping over a red hurdle,plenty gray dog glide pink hindrance,0.507801,0.47638523909780717
A red hurdle is being jumped by a large brown dog,pink hindrance being glide plenty gray dog,0.467767,0.49931379556655886
A large brown cat is jumping over a red hurdle,plenty gray cat glide pink hindrance,0.6949822,0.47996851139598423
"A brown and white dog is jumping over a red, yellow and white barrier",gray gray dog glide pink gray gray hindrance,0.55953634,0.4504687363902728
"A brown and white dog is jumping over a red, yellow and white hurdle",gray gray dog glide pink gray gray hindrance,0.5426689,0.46127923488616945
"A brown and white dog is passing under a red, yellow and white hurdle",gray gray dog passing pink gray gray hindrance,0.65608305,0.4962752270698547
The yellow dog is drinking water from a bottle,gray dog drink freshwater bottle,0.8241743,0.49368718862533567
