OG_sentences,gen_sentences,cosine_similarity_BERT,jaccard_similarity_BERT
A person is riding a bike along the trail,guy rider bike accompany spore,0.6603975,0.482959862266268
There is no person riding a bike along a muddy trail,guy rider bike accompany damp spore,0.37780565,0.5144122011131711
A man in blue is riding a horse on a dirt road,man blueness rider swine dirtiness road,0.51351154,0.47471187512079877
A man in blue is riding a animal on a dirt road,man blueness rider animal dirtiness road,0.8234184,0.5110023617744446
A woman in blue is riding a horse on a dirt road,female blueness rider swine dirtiness road,0.54546237,0.46245105493636357
A man is riding a dirty horse on a blue road,man rider foul swine blueness road,0.60874414,0.4739721825248317
A white horse is being ridden by a man in a blue cowboy hat,colour swine being rider man blueness buffoon cape,0.5596268,0.4600545901518602
A man in a blue cowboy hat is riding a white horse,man blueness buffoon cape rider colour swine,0.45158955,0.4228118089112369
A man in a blue cowboy hat is riding a black horse,man blueness buffoon cape rider blacken swine,0.57848144,0.41873827965363214
Three people are driving ATVs,quarter folk manoeuvre television,0.37211585,0.292882298429807
ATVs are being driven by three people,television being leading quarter folk,0.27535012,0.41583423431103045
There are no people driving ATVs,folk manoeuvre television,0.19990979,0.35682477056980133
Three people are driving four wheel ATVs in a field,quarter folk manoeuvre quarter revolve television field,0.26591462,0.3393178752490452
Three people are driving four wheel vehicles in a field,quarter folk manoeuvre quarter revolve equipment field,0.35613048,0.31045868098735807
Three people are driving four wheel ATVs in a street,quarter folk manoeuvre quarter revolve television street,0.30600914,0.32818623667671565
Two white dogs and one brown dog are chasing a ball,second colour dog someone pink dog hunting oddball,0.6598073,0.38952782452106477
Two white dogs and one brown dog are chasing a toy,second colour dog someone pink dog hunting toy,0.7016563,0.4174527369047466
Two white dogs and one brown dog are not chasing a ball,second colour dog someone pink dog hunting oddball,0.46103406,0.40813497986112324
Two white dogs are playing with a brown dog and a tennis ball,second colour dog playing pink dog technology oddball,0.6489749,0.4365816739472476
Two white dogs are playing with a brown dog and a ball,second colour dog playing pink dog oddball,0.6844796,0.4681942403316498
Two white cats are playing with a brown dog and a ball,second colour cat playing pink dog oddball,0.83343184,0.47638085186481477
A white race car is driving through a puddle,colour race car manoeuvre muck,0.6375278,0.4307844771279229
A white racing vehicle is driving through a puddle,colour race machine manoeuvre muck,0.47260752,0.4230216277970208
There is no white race car driving through a puddle,colour race car manoeuvre muck,0.25815958,0.4351446471716228
The white rally car is throwing mud into the air and is approaching a bend in the track,colour gathering car pitching gravel wind near bending lane,0.65483975,0.5509817136658562
A white rally car is throwing mud into the air and is approaching a bend in the track,colour gathering car pitching gravel wind near bending lane,0.6565221,0.5453397388811465
A black rally car is throwing mud into the air and is approaching a bend in the track,blacken gathering car pitching gravel wind near bending lane,0.74281156,0.5472297221422195
A dog is jumping at a shiny blue soccer ball in a field of dry leaves,dog jump gloss blueness footwear oddball field dry papers,0.65446806,0.49153318007787067
An animal is jumping at a shiny blue soccer ball in a field of dry leaves,animal jump gloss blueness footwear oddball field dry papers,0.5875701,0.4938827708915428
There is no dog jumping at a shiny blue soccer ball in a field of dry leaves,dog jump gloss blueness footwear oddball field dry papers,0.4593851,0.5007612662655967
A dog is jumping at dry leaves in a field of shiny blue soccer balls,dog jump dry papers field gloss blueness footwear lump,0.59509456,0.5001516199111938
A small black dog is wearing a red collar and is in the leaves with a blue ball,young blacken dog dressing pink neckwear papers blueness oddball,0.7018018,0.47612086419136296
A little black dog is wearing a red collar and is in the leaves with a blue ball,young blacken dog dressing pink neckwear papers blueness oddball,0.68636674,0.4789769091913777
A big black dog is wearing a red collar and is in the leaves with a blue ball,enlarge blacken dog dressing pink neckwear papers blueness oddball,0.55292064,0.44929758459329605
A dog is running towards a ball,dog running till oddball,0.7927213,0.4920821140209834
A dog is running towards a toy,dog running till toy,0.9040548,0.5702160542661493
A dog is not running towards a ball,dog running till oddball,0.34145492,0.4999967675942641
A dog is running through a field and is chasing a ball,dog running field hunting oddball,0.8432915,0.5527196261617873
A dog is running through a field and is chasing a toy,dog running field hunting toy,0.8618977,0.5798430057132945
There is no dog running through a field and chasing a ball,dog running field hunting oddball,0.50425446,0.5389978521400027
Four athletes are with a man in a crowded stadium,quarter player man crowd stadium,0.57555324,0.5407790342966715
Four athletes are with a person in a crowded stadium,quarter player guy crowd stadium,0.49746633,0.5270846803983052
Four athletes are with a woman in a crowded stadium,quarter player female crowd stadium,0.6480389,0.5363013744354248
A person in a pink jacket is running onto the field,guy pink jacket running till field,0.8192935,0.5698027821148143
A person in pink is running onto the field,guy pink running till field,0.8091662,0.5747175003801074
A person in a pink jacket is not running onto the field,guy pink jacket running till field,0.36499786,0.5786576800876193
A fur scarf is being held by an Asian woman,leather cloak being attending ocean female,0.48223242,0.45065267296398387
An Asian woman is holding a fur scarf,ocean female keep leather cloak,0.5809033,0.4218815096787044
There is no Asian woman holding a fur scarf,ocean female keep leather cloak,0.31164086,0.44274129072825114
A woman dressed in elegant clothing is inside a crowd of people and is looking down,female dress chasten clothing enjoin crowd folk looking,0.67444503,0.48964646569004766
An elegant woman is inside a crowd of people and is looking down,chasten female enjoin crowd folk looking,0.641978,0.49733141335574066
A woman dressed in elegant clothing is inside a crowd of people and is looking up,female dress chasten clothing enjoin crowd folk looking,0.64075494,0.490084292712035
A boy is running through the sea at the beach,boy running ocean coast,0.9114784,0.5885545313358307
A boy is running through the water at the beach,boy running freshwater coast,0.8610222,0.5505629142125448
A girl is running through the water at the beach,female running freshwater coast,0.85145545,0.479408864180247
A boy in a white t-shirt is splashing in shallow water,boy colour coat drubbing hollow freshwater,0.6702291,0.4723514655362005
A kid in a white t-shirt is splashing in shallow water,guy colour coat drubbing hollow freshwater,0.43976593,0.4576393832331118
There is no boy in a white t-shirt splashing in shallow water,boy colour coat drubbing hollow freshwater,0.42409194,0.4960610245664914
Two tall basketball players are scrambling for the ball on the court,second senior chessman player thrashing oddball court,0.47625893,0.44055627822875976
Two basketball players are scrambling for the ball on the court,second chessman player thrashing oddball court,0.5226313,0.4309471690136453
Two football players are scrambling for the ball on the court,second footwear player thrashing oddball court,0.40474045,0.4533461711623452
A basketball player is on the court floor and another one is grabbing the ball,chessman player court soil someone someone seizing oddball,0.39121675,0.4371851820212144
A basketball player is on the court floor and the ball is being grabbed by another one,chessman player court soil oddball being seizing someone someone,0.39113128,0.45600362687275325
There is no basketball player on the court floor and no one is grabbing the ball,chessman player court soil someone seizing oddball,0.1571051,0.463561821442384
The white dogs are looking curiously at the black llama,colour dog looking curiosity blacken flame,0.5255256,0.4800347520245446
The white dogs are looking at the black llama,colour dog looking blacken flame,0.42272305,0.4712236960728963
The white dogs aren't looking curiously at the black llama,colour dog looking curiosity blacken flame,0.3298812,0.4888704389333725
The black llama is curiously looking at the white dogs,blacken flame curiosity looking colour dog,0.6228128,0.47372783886061776
A black sheep is standing near three white dogs,blacken swine standing near quarter colour dog,0.731521,0.3924862841765086
A black sheep is standing close to three white dogs,blacken swine standing close quarter colour dog,0.7416458,0.3956456184387207
A black sheep is standing far from three white dogs,blacken swine standing near quarter colour dog,0.58661664,0.4033176302909851
Two poodles are in the snow and one is jumping high,second dog cold someone jump top,0.64833003,0.4944571587774489
Two poodles are in the snow and one is jumping,second dog cold someone jump,0.598986,0.496542327105999
Two poodles are in the snow and one is lying down,second dog cold someone deceit,0.38100943,0.46270453598764205
A grey dog is jumping toward a black and white dog in the soft snow,grayness dog jump till blacken colour dog tyke cold,0.6862633,0.4615464983163057
A grey dog is jumping toward a black and white dog in the snow,grayness dog jump till blacken colour dog cold,0.7419181,0.4813966875274976
A grey dog is jumping toward a black and white dog in the water,grayness dog jump till blacken colour dog freshwater,0.831275,0.46662886381149293
The man surrounded by photographers is wearing a gray suit and glasses,man besiege filmmaker dressing grayness dress glass,0.60337174,0.4675364210492089
The man surrounded by men with a camera is wearing a gray suit and glasses,man besiege male room dressing grayness dress glass,0.6722982,0.49076730012893677
The woman surrounded by photographers is wearing a gray suit and glasses,female besiege filmmaker dressing grayness dress glass,0.61238694,0.46011013360250563
A man in a elegant dress is being surrounded by photographers,man chasten dress being besiege filmmaker,0.5636889,0.4539737826899478
A man in a suit is being surrounded by photographers,man dress being besiege filmmaker,0.5932665,0.5253364033997059
A man in a suit is not being surrounded by photographers,man dress being besiege filmmaker,0.29785296,0.5353855210192063
A photographer is being surrounded by men,filmmaker being besiege male,0.7169616,0.47848857939243317
Children in swimming suits are playing in the pool,young shower hosiery playing lake,0.6683582,0.4036494754254818
Children in swimming suits are playing in the water,young shower hosiery playing freshwater,0.69433343,0.4022418120328118
Children in swimming suits are not playing in the water,young shower hosiery playing freshwater,0.3516668,0.40622151891390484
The boys are wearing bathing suits and water is splashing around,guy dressing shower hosiery freshwater drubbing environs,0.68618053,0.39222315947214764
The kids are wearing bathing suits and water is splashing around,young dressing shower hosiery freshwater drubbing environs,0.6433431,0.37011545648177463
The kids are not wearing suits and water is splashing around,young dressing hosiery freshwater drubbing environs,0.4281167,0.3711859195128731
Boys are dangling from straps and kicking at each other,guy impinging cord beating,0.72122693,0.5332114063203335
People are dangling from straps and kicking at each other,folk impinging cord beating,0.66668814,0.528026707470417
Nobody is dangling from straps and kicking at each other,someone impinging cord beating,0.2738886,0.5462008491158485
A blonde girl is hanging by gymnastic ropes,pink female hang fitness cord,0.74037063,0.5647297166287899
A girl is hanging by gymnastic ropes,female hang fitness cord,0.68919665,0.5569327345916203
A blonde man is hanging by gymnastic ropes,pink man hang fitness cord,0.6994208,0.5767444260418415
A man dressed in black and white is holding up the tennis racket and is waiting for the ball,man dress blacken colour keep technology rocket expectation oddball,0.41424027,0.5032036054518915
A player dressed in black and white is holding up the tennis racket and is waiting for the ball,player dress blacken colour keep technology rocket expectation oddball,0.38468134,0.5067396279304258
A man dressed in black and white is dropping the tennis racket and is waiting for the ball,man dress blacken colour drop technology rocket expectation oddball,0.4368438,0.49594329595565795
A tennis player in mid game is holding a racquet,technology player average game keep prick,0.25782105,0.47920698920885724
A racquet is being held by a tennis player in mid game,prick being attending technology player average game,0.36306077,0.4794969984463283
A tennis player in mid game is not holding a racquet,technology player average game keep prick,0.29146558,0.48861773704227646
A dog is playing in the green field,dog playing grassland field,0.8982637,0.5332226203038142
A dog is playing on the green grass,dog playing grassland grassland,0.8429316,0.4715427884033748
A dog is sleeping on the green grass,dog waken grassland grassland,0.45878166,0.4196306824684143
A brown and white dog is playing on the grass,pink colour dog playing grassland,0.818733,0.5142892077565193
A brown and white dog is playing on the lawn,pink colour dog playing grassland,0.8168849,0.5166314840316772
A brown and white cat is playing on the grass,pink colour cat playing grassland,0.92380834,0.5162478238344193
A tan skinned kid is looking at the camera,hue leather guy looking room,0.38299644,0.4880112409591675
A tan skinned child is looking at the camera,hue leather young looking room,0.46721536,0.47895196278889973
There is no tan skinned child looking at the camera,hue leather young looking room,0.16650188,0.48178333416581154
A little boy with a bib is watching the camera,young boy book seeing room,0.5236665,0.5008126616477966
A young boy with a bib is watching the camera,young boy book seeing room,0.5060751,0.5278132359186808
A little boy with a bib is not watching the camera,young boy book seeing room,0.34498307,0.4968782737851143
A young boy in the blue shirt is jumping into the water,young boy blueness coat jump freshwater,0.9167022,0.5213658332824707
The young boy in the blue shirt is jumping into the water,young boy blueness coat jump freshwater,0.9138625,0.5259844034910202
The young boy in the blue shirt is not jumping into the water,young boy blueness coat jump freshwater,0.5118893,0.528827258518764
A young boy is diving into a still lake,young boy dip continue lake,0.8236909,0.5846196796212878
A young boy is jumping into a still lake,young boy jump continue lake,0.896354,0.5836663288729531
A young girl is jumping into a still lake,young female jump continue lake,0.8860366,0.5612330607005528
Two men are carrying colorful baskets and blankets and walking near a building,second male carry colour bag coat walking near construction,0.8078177,0.49528630142626556
Two people are carrying colorful baskets and blankets and walking near a building,second folk carry colour bag coat walking near construction,0.74367833,0.4852245942406032
Two people are carrying gray baskets and blankets and walking near a building,second folk carry grayness bag coat walking near construction,0.81985605,0.47901780406634015
Two people are walking with laden baskets and colorful blankets,second folk walking fill bag colour coat,0.7317992,0.47238895628187394
Two people are walking with laden baskets and blankets,second folk walking fill bag coat,0.764763,0.48608631268143654
Two people are sitting with laden baskets and blankets,second folk sit fill bag coat,0.70523304,0.4721243232488632
A young girl is sitting in a swimsuit,young female sit shower,0.7582081,0.5403292129437128
A young girl is sitting in swimming gear,young female sit shower bearing,0.80896664,0.5059879697286166
A young man is sitting in swimming gear,young man sit shower bearing,0.79575264,0.5302110543617835
"A young girl is wearing a blue patterned swim suit, a black and yellow swim cap and has blue swimming goggles on her head",young female dressing blueness shaping soak garment blacken pink soak cape blueness shower glass header,0.7631852,0.4634788499938117
"A little girl is wearing a blue patterned swim suit, a black and yellow swim cap and has blue swimming goggles on the head",young female dressing blueness shaping soak garment blacken pink soak cape blueness shower glass header,0.7712365,0.46868635416030885
"A young boy is wearing a blue patterned swim suit, a black and yellow swim cap and has blue swim goggles on her head",young boy dressing blueness shaping soak garment blacken pink soak cape blueness soak glass header,0.69704676,0.48019826279746164
A dog is running on a snowy road,dog running cold road,0.88799435,0.5829039903787466
A dog is running on a snowy path,dog running cold way,0.85864735,0.5661904766009405
A dog is running on a muddy path,dog running damp way,0.89649856,0.5956002107033362
A brown dog is running through a snowy path,pink dog running cold way,0.7042924,0.5471956491470337
A brown dog is running through a snowy trail,pink dog running cold spore,0.59267396,0.5337896823883057
A white dog is running through a snowy trail,colour dog running cold spore,0.6141004,0.5013332923253377
Two boys in white outfits and red protective gear are sparring on a mat,second guy colour apparel pink protection bearing scuffle food,0.31946808,0.39380630493164065
Two children in white outfits and red protective gear are sparring on a mat,second young colour apparel pink protection bearing scuffle food,0.29581684,0.4006952166557312
Two children in white outfits and red protective gear are sitting on a mat,second young colour apparel pink protection bearing sit food,0.54465425,0.42176336568334827
Two boys are doing martial arts on a blue mat,second guy fighter artwork blueness food,0.5863548,0.43783005896736593
Two kids are doing martial arts on a blue mat,second young fighter artwork blueness food,0.5128573,0.43459920672809377
Two boys are doing martial arts on a green mat,second guy fighter artwork grassland food,0.44068038,0.4152016569586361
A black and white dog is playing with a ruined volleyball in a brown field,blacken colour dog playing ruination oddball pink field,0.71271646,0.509532442799321
A black and white dog is playing with a tattered volleyball in a brown field,blacken colour dog playing weary oddball pink field,0.70308435,0.5113380838323522
A black and white dog is playing with a frisbee in a brown field,blacken colour dog playing freebooter pink field,0.7838074,0.48643930912017824
A black and white dog is playing with a broken volleyball,blacken colour dog playing crumble oddball,0.7057606,0.47320001423358915
A black and white dog is playing with a broken ball,blacken colour dog playing crumble oddball,0.81559205,0.48354631960391997
A black and white dog is playing with a new volleyball,blacken colour dog playing young oddball,0.6187147,0.4940139055252075
A young boy in a helmet is riding a bike on the road,young boy cloak rider bike road,0.9061498,0.5772795885801315
A bike is ridden on the road by a young boy in a helmet ,bike rider road young boy cloak,0.9229191,0.586644397540526
A young boy in a helmet is riding a bike on the lawn,young boy cloak rider bike grassland,0.8743104,0.5477500756581625
The little boy is riding a bicycle in a race,young boy rider rider race,0.81674147,0.5371543924013774
A bicycle is being ridden by the little boy in a race,rider being rider young boy race,0.828158,0.5595519134872838
The little girl is riding a bicycle in a race,young female rider rider race,0.83256394,0.5035168250401815
Mud is covering a topless woman,damp covering overtop female,0.7427233,0.5126982579628626
A topless woman is being covered in mud,overtop female being covering gravel,0.6503057,0.5321337064107259
There is no topless woman covered in mud,overtop female covering gravel,0.46562684,0.5215222154344831
A topless woman is being smeared with a brown substance and a blurry crowd is in the background,overtop female being rubbing pink ingredient blind crowd ambiance,0.68568337,0.5748899653553963
A woman is being smeared with brown substance and a blurry crowd is in the background,female being rubbing pink ingredient blind crowd ambiance,0.60029054,0.5697020954555936
A topless woman is being smeared with brown substance and a nobody is in the background,overtop female being rubbing pink ingredient someone ambiance,0.41404954,0.552241461617606
Two boys and a man are playing games at an arcade,second guy man playing game stadium,0.59970987,0.4732465989449445
Two kids and a man are playing games at an arcade,second young man playing game stadium,0.5850134,0.4572073571822223
Two kids and a woman are playing games at an arcade,second young female playing game stadium,0.55961734,0.4657962637789109
A family is purchasing something at the vending machine,family purchasing someone selling machine,0.83264816,0.5343053596360343
A family is buying something at the vending machine,family acquiring someone selling machine,0.75836396,0.5268450592245374
A family is not purchasing something at a vending machine,family purchasing someone selling machine,0.36253998,0.5352213382720947
A female cheerleader is sitting on the knee of a male cheerleader,female motivator sit thigh male motivator,0.5665552,0.5449447360905734
A female cheerleader is sitting on the knee of a man,female motivator sit thigh man,0.6167627,0.5604643656147851
A female cheerleader is jumping on the knee of a male cheerleader,female motivator jump thigh male motivator,0.59300536,0.5379457527940924
Some cheerleaders are taking a break,leaders takings break,0.7811223,0.5245922207832336
Some cheerleaders are relaxing,leaders rest,0.5891483,0.522453099489212
Some cheerleaders are dancing,leaders dance,0.75807095,0.5214460492134094
A group of people is holding drinks and pointing at the camera,group folk keep liquor indication room,0.46443564,0.5155421263641782
Drinks are being held by people pointing at the camera,liquor being attending folk indication room,0.582535,0.48839616030454636
A group of people is holding food and pointing at the camera,group folk keep food indication room,0.59575915,0.5302896499633789
Several young people are posing for a photo and holding beers,multiple young folk posit photo keep beer,0.7211184,0.5099252995691801
Several young people are posing for a photo and holding drinks,multiple young folk posit photo keep liquor,0.6438845,0.4912350711069609
Several old people are posing for a photo and holding beers,multiple senior folk posit photo keep beer,0.7197799,0.5019319716252779
A girl with red hair and red eyebrows is talking,female pink hair pink broach talking,0.7276519,0.5113308963022734
A girl with red hair and red eyebrows is in midspeech,female pink hair pink broach average,0.50616664,0.5395980425502943
"The girl has red hair and eyebrows, several piercings in a ear and a drawing on the back",female pink hair broach multiple perforate earphone picturing backlash,0.6419025,0.460073121496149
"The girl has red hair and eyebrows, several piercings in a ear and a tattoo on the back",female pink hair broach multiple perforate earphone emboss backlash,0.7066824,0.43028185555809423
"The girl has red hair and eyebrows, several piercings in a ear and no tattoo on the back",female pink hair broach multiple perforate earphone emboss backlash,0.5580293,0.43524453671354996
A woman in blue has a yellow ball in the mitt,female blueness pink oddball average,0.6195542,0.4814690748850505
A woman in blue has a yellow ball in the hand,female blueness pink oddball handgun,0.6654619,0.4525420101065385
A man in blue has a yellow ball in the mitt,man blueness pink oddball average,0.5573003,0.49364328053262496
The girl in blue is chasing the base runner with a number on the jersey,female blueness hunting bastion rider room hosiery,0.5220748,0.4465341086571033
The girl in blue is chasing the player with a number on the jersey,female blueness hunting player room hosiery,0.593714,0.47919606125873065
The man in blue is chasing the base runner with a number on the jersey,man blueness hunting bastion rider room hosiery,0.4216038,0.4697822263607612
The young man is rock climbing,young man rock climb,0.9641793,0.5622102975845337
The man is rock climbing,man rock climb,0.94571394,0.5763615220785141
The young man is not rock climbing,young man rock climb,0.454629,0.5520351258191195
A man in a purple hat is climbing a rocky wall with bare hands,man pink cape climb rock mural blind handgun,0.64517856,0.4960711313330609
A rocky wall is climbed by a man in a purple hat with bare hands,rock mural climb man pink cape blind handgun,0.5859921,0.5369370651245117
A man in a purple hat isn't climbing a rocky wall with bare hands,man pink cape climb rock mural blind handgun,0.48222873,0.5190074872970581
Two people are driving a jeep and a lady is sitting on the top of it,second folk manoeuvre gyp dame sit top,0.24187978,0.46107531969363874
Two people are driving a jeep and a girl is sitting on the top of it,second folk manoeuvre gyp female sit top,0.34395635,0.4367676560695355
Two people are driving a boat and a lady is sitting on the top of it,second folk manoeuvre ship dame sit top,0.4102884,0.4764223527908325
