OG_sentences,gen_sentences,cosine_similarity_BERT,jaccard_similarity_BERT
A boy is playing on a toy,boy playing toy,0.9646546,0.6204223513603211
A girl is playing on a toy phone,female playing toy phone,0.970905,0.5629006326198578
The man is aiming a gun,man aim handgun,0.9248158,0.5205363392829895
The man is handling a gun,man processing handgun,0.83130896,0.47728299498558047
The man is drawing a gun,man picturing handgun,0.6960944,0.4701131744818254
A horse is being ridden by a girl,swine being rider female,0.56176865,0.508043531860624
A girl is riding a horse,female rider swine,0.5589416,0.44057345390319824
There is no girl riding a horse,female rider swine,0.2692396,0.4501972198486328
The girl is trotting on the horse,female thrashing swine,0.398602,0.433027799640383
The person is trotting on the horse,guy thrashing swine,0.19469105,0.45736082962581087
The boy is trotting on the horse,boy thrashing swine,0.33076057,0.48671823740005493
A man is breaking a slab of concrete with a sledge hammer,man breakup lean concrete slug whip,0.717047,0.5195542318480355
A man is breaking a block of concrete with a sledge hammer,man breakup obstruct concrete slug whip,0.659179,0.4994816102764823
There is no man breaking a slab of concrete with a sledge hammer,man breakup lean concrete slug whip,0.3800198,0.5478209338404916
The man is using a sledgehammer to break a concrete block that is on another man,man use whip break concrete obstruct someone man,0.8058145,0.5796616850075899
The man is using a sledgehammer to break a concrete block that is on another person,man use whip break concrete obstruct someone guy,0.8084807,0.579555231112021
The woman is using a sledgehammer to break a concrete block that is on another man,female use whip break concrete obstruct someone man,0.797451,0.5686639216211107
A dog is barking at a ball,dog beating oddball,0.8143417,0.5643012573321661
An animal is barking at a ball,animal beating oddball,0.74601567,0.5572658727566401
There is no dog barking at a ball,dog beating oddball,0.27915508,0.5429511070251465
A dog is swimming after a tennis ball,dog shower technology oddball,0.48359963,0.39341670274734497
A dog is swimming after a ball,dog shower oddball,0.63818765,0.4442486058581959
A cat is swimming after a tennis ball,cat shower technology oddball,0.7129235,0.3968372115722069
A cupcake is being eaten by a girl,biscuit being eat female,0.81548506,0.542970264951388
A girl is eating a cupcake,female eating biscuit,0.90879583,0.5163725018501282
A boy is eating a cupcake,boy eating biscuit,0.91571873,0.5963200396961637
A woman is eating a cupcake,female eating biscuit,0.9132085,0.5586514075597128
A woman is eating a cake,female eating biscuit,0.84936273,0.5479742421044244
A woman is not eating a cupcake,female eating biscuit,0.3178125,0.5501663744449615
A person is spitting,guy drubbing,0.62922496,0.46445844570795697
A man is playing keyboards,man playing stylus,0.5454507,0.562208460436927
A man is not playing keyboards,man playing stylus,0.34847748,0.5506942987442016
A man is riding a rodeo bull,man rider race swine,0.5461401,0.44815091292063397
A man is falling off a mechanical bull,man fell machine swine,0.770767,0.5036987433066735
A man is cutting a boot with a sword,man slash kickoff handgun,0.65347517,0.46471362908681235
A man is cutting a boot with a blade,man slash kickoff lash,0.5210318,0.4908234051295689
There is no man cutting a boot with a sword,man slash kickoff handgun,0.3153107,0.47574785724282265
A person is severing the toe of an empty leather boot with a sword,guy breakup foot hollow leather kickoff handgun,0.5615193,0.4953320145606995
A man is severing the toe of an empty leather boot with a sword,man breakup foot hollow leather kickoff handgun,0.63262665,0.505970618724823
A woman is severing the toe of an empty leather boot with a sword,female breakup foot hollow leather kickoff handgun,0.6176741,0.49737493515014647
A chef is cleaning a bowl of soup,cook cleaning mug soup,0.9011087,0.5564940571784973
A bowl of soup is being cleaned by a chef,mug soup being cleaning cook,0.89323485,0.6047520677248637
A chef is getting a bowl of soup dirty,cook getting mug soup foul,0.89492583,0.5586831867694855
A man is wiping the edge of a bowl,man rubbing edge mug,0.7338372,0.57434454758962
A man is cleaning the edge of a bowl,man cleaning edge mug,0.86606187,0.5764905168459966
There is no man wiping the edge of a bowl,man rubbing edge mug,0.23712839,0.5718449130654335
The guitar is being played by a kid,pianoforte being playing guy,0.26748103,0.5150676767031351
A kid is playing the guitar,guy playing pianoforte,0.25822932,0.4838005304336548
A kid is playing the piano,guy playing pianoforte,0.83727115,0.5619213051266141
A young boy is singing and playing a guitar,young boy singing playing pianoforte,0.5644666,0.54738507100514
A kid is singing and playing a guitar,guy singing playing pianoforte,0.49189562,0.5023050506909689
There is no young boy singing and playing a guitar,young boy singing playing pianoforte,0.24158366,0.5133227626482646
Someone is stirring a pot of chili with a spoon,someone shuffle pot ail mug,0.4577114,0.5648752649625143
A pot of chili is being stirred by someone with a spoon,pot ail being mingle someone mug,0.50915205,0.5597908020019531
Nobody is stirring a pot of chili with a spoon,someone shuffle pot ail mug,0.20901391,0.5494453072547912
Someone is stirring chili in a kettle,someone shuffle ail pot,0.38210252,0.5278508988293734
Someone is stirring chili in a pot,someone shuffle ail pot,0.39956516,0.542014024474404
Someone is not stirring chili in a kettle,someone shuffle ail pot,0.33352536,0.529405395189921
A person is eating in a restaurant,guy eating food,0.7197108,0.5084720551967621
A person is eating at a table,guy eating tableland,0.811411,0.4922033223238858
A person is not eating at a table,guy eating tableland,0.17833367,0.49626441796620685
A man is making a bed,man create bed,0.9453118,0.580118199189504
A person is making a bed,guy create bed,0.84601176,0.5417284104559157
A person is not making a bed,guy create bed,0.33446229,0.5360193431377411
A cat is playing with a small bottle,cat playing young bottle,0.94231224,0.5759806632995605
An animal is playing with a small bottle,animal playing young bottle,0.85375524,0.5586988081534704
A cat is playing with a big bottle,cat playing enlarge bottle,0.8982343,0.5122274160385132
A bottle is being licked by the cat,bottle being rubbing cat,0.85876274,0.6063746213912964
The cat is licking a bottle,cat rubbing bottle,0.8420323,0.5473028421401978
The dog is licking a bottle,dog rubbing bottle,0.78250146,0.5385285913944244
A small dog is lying on the bed,young dog deceit bed,0.66463315,0.5096685061087975
A small dog is lying on a bed,young dog deceit bed,0.6649915,0.5078859099974999
A small cat is lying on a bed,young cat deceit bed,0.7816037,0.5072992306489211
A small animal is lying on the bed,young animal deceit bed,0.49543482,0.49394772144464344
A small dog is lying under the bed,young dog deceit bed,0.6717644,0.4817785987487206
A woman is cutting butter,female slash butter,0.814699,0.5028357207775116
A woman is slicing butter,female slash butter,0.79889077,0.5548119147618612
A man is slicing butter,man slash butter,0.8142283,0.6008277336756388
There is no woman slicing tofu,female slash soup,0.27495784,0.49050076603889464
The man is playing with a skull,man playing marrow,0.56594104,0.5614984414794228
The person is playing with a skull,guy playing marrow,0.42632344,0.5413797281005166
There is no man playing with a skull,man playing marrow,0.17111476,0.5309207042058309
The man is playing the instrument,man playing apparatus,0.8427855,0.5697636008262634
Some cheese is being put on a pizza by a man,sauce being put pie man,0.74595785,0.5579841881990433
The cook is sprinkling cheese on the pizza,cook rubbing sauce pie,0.69558066,0.5335306247075399
The man is sprinkling cheese on the pizza,man rubbing sauce pie,0.7132651,0.5663446426391602
There is no man sprinkling cheese on the pizza,man rubbing sauce pie,0.2871127,0.549924973398447
A man is firing a shotgun,man shooting handgun,0.8886129,0.5252177298069001
A man is firing a gun,man shooting handgun,0.9227798,0.5185185670852661
A man is reloading a shotgun,man refresh handgun,0.7371765,0.5213176553899591
A man is shooting a shotgun,man shooting handgun,0.909866,0.5333800077438354
There is no man shooting a shotgun,man shooting handgun,0.3946282,0.5051018433137373
A famous singer is dancing on the ceiling,celebrity singing dance roof,0.7458464,0.5478092779715856
A great singer is dancing on the ceiling,perfect singing dance roof,0.7028848,0.5110875815153122
There is no famous singer dancing on the ceiling,celebrity singing dance roof,0.37358245,0.5520973985011761
A man is dancing on the ceiling,man dance roof,0.7843344,0.5673355340957642
A person is dancing on the ceiling,guy dance roof,0.65315354,0.5355244159698487
A man is dancing on the floor,man dance soil,0.72184,0.5686210572719574
A cow is eating grass,cow eating grassland,0.9322871,0.506779412428538
A cow is grazing,cow hunting,0.8024562,0.5941368596894401
A cow is not eating grass,cow eating grassland,0.41643915,0.498248827457428
Hay is being eaten by a cow,hay being eat cow,0.93247545,0.6019093069163236
A cow is eating hay,cow eating hay,0.98084676,0.5895205363631248
A cow is not eating hay,cow eating hay,0.40510663,0.5762056046062045
A man is having lunch,man food,0.7070593,0.5179279957498822
A man is eating,man eating,0.98924154,0.6057394643624624
A man is puking,man drubbing,0.7227713,0.4746602376302083
A woman is dancing gracefully,female dance gracefulness,0.9528861,0.45445529981092975
A woman is sleeping,female waken,0.439538,0.4467865228652954
A baby is playing with a doll,young playing toy,0.75779426,0.4864983379840851
A baby is playing with a toy,young playing toy,0.927897,0.5406231641769409
A baby is not playing with a doll,young playing toy,0.3231812,0.47834632071581756
A tiger cub is playing with a ball,monkey cat playing oddball,0.4562329,0.47175303330788243
A baby tiger is playing with a ball,young monkey playing oddball,0.58164996,0.4727806036288922
There is no baby tiger playing with a ball,young monkey playing oddball,0.3574047,0.4704515167645046
The man is playing a game on a lawn,man playing game grassland,0.86695224,0.5763949581554958
The man is playing a game on the grass,man playing game grassland,0.8809035,0.5810499020985195
There is no man playing a game on the grass,man playing game grassland,0.3072859,0.5444299618403117
The animal is grazing on the grass,animal hunting grassland,0.7109709,0.5247208674748739
There is no rhino grazing on the grass,monkey hunting grassland,0.37317997,0.5156188011169434
A man is talking to a woman,man talking female,0.90616924,0.5923327267169952
A man and a woman are speaking,man female speak,0.85848594,0.5842941343784332
A man is talking to a boy,man talking boy,0.92983454,0.6058680832386016
A woman is talking to a man,female talking man,0.87010133,0.5604426801204682
A woman is cracking eggs,female crack meat,0.6398716,0.48074860870838165
A woman is breaking eggs,female breakup meat,0.58358175,0.4209801223542955
A man is cracking eggs,man crack meat,0.7164105,0.49581386893987656
A man is not riding a bicycle,man rider rider,0.4512484,0.47105523347854616
A man is riding an electric bicycle,man rider electricity rider,0.7446579,0.48430230942639435
A person is riding an electric bicycle,guy rider electricity rider,0.64148134,0.4292027625170621
There is no man riding an electric bicycle,man rider electricity rider,0.44173115,0.4818708101908366
A cat is jumping into a container,cat jump container,0.91451275,0.5894079327583313
A cat is jumping into a box,cat jump bag,0.85522425,0.55818692445755
A dog is jumping into a box,dog jump bag,0.6924363,0.5411374628543854
A boy is talking to a leaf,boy talking page,0.71500665,0.5718242526054382
A young man is talking to a leaf,young man talking page,0.7032648,0.5647422422965368
An old man is talking to a leaf,senior man talking page,0.7051728,0.5553789635499319
A fish is being cut by a man,meat being cut man,0.76895213,0.5452446490526199
A man is cutting a fish,man slash meat,0.6386694,0.4990151524543762
There is no man cutting a fish,man slash meat,0.22241224,0.48860591650009155
A man is slicing a fish,man slash meat,0.65001327,0.532352602481842
A fish is being sliced by a man,meat being slash man,0.6880074,0.5401271233956019
A person is frying some food,guy roast food,0.7309389,0.5013100637329949
A person is cooking some food,guy cook food,0.8876933,0.5237811009089152
A person is not frying,guy roast,0.09139255,0.5077017034803119
A person is peeling a potato,guy rubbing pie,0.64870834,0.4816461443901062
A potato is being peeled by a person,pie being pinniped guy,0.659237,0.4435005145413535
There is no person peeling a potato,guy rubbing pie,0.17951606,0.46739030426198785
A man is rowing a canoe,man pitching ship,0.5769935,0.5583396553993225
A man is rowing a boat,man pitching ship,0.671155,0.5817195475101471
A woman is rowing a boat,female pitching ship,0.70545805,0.5365831792354584
A man is shooting with a gun,man shooting handgun,0.956451,0.5504240068522367
A man is shooting with a weapon,man shooting weaponry,0.9504781,0.5556132359938188
A man is shooting with a bow,man shooting broach,0.7254559,0.5582233504815535
A woman is dancing near a fire,female dance near fire,0.95126957,0.5624725601889871
A woman is dancing near a fireplace,female dance near fireplace,0.9591512,0.5657434571873058
There is no woman dancing near a fire,female dance near fire,0.347292,0.5629740158716837
A guitar is being played by a girl,pianoforte being playing female,0.47855836,0.48957691589991253
A girl is playing a guitar,female playing pianoforte,0.3930473,0.466604557302263
A man is diving off a rock,man dip rock,0.7072562,0.5858984649181366
A man is diving off a cliff,man dip rock,0.6111108,0.5588753402233124
There is no man diving off a cliff,man dip rock,0.27385643,0.5476551110094244
A motorcycle is being ridden by a man,rider being rider man,0.6132595,0.5106035425112798
The woman is playing the guitar,female playing pianoforte,0.37763858,0.5113596452607049
The person is playing the guitar,guy playing pianoforte,0.2322425,0.5167840321858724
A man is boiling noodles in water,man evaporation morsel freshwater,0.4661662,0.3911540247499943
Someone is stirring noodles in the water,someone shuffle morsel freshwater,0.46378678,0.4567943490468539
Someone is stirring food in the water,someone shuffle food freshwater,0.6773837,0.5136664013067881
Nobody is stirring noodles in the water,someone shuffle morsel freshwater,0.23850948,0.43650286014263445
The women are singing and dancing,female singing dance,0.9435854,0.5525121423933241
The persons are singing and dancing,personnel singing dance,0.9332454,0.5546799500783285
The women are not singing and dancing,female singing dance,0.34420097,0.5318065226078034
Two women are dancing and singing in front of a crowd,second female dance singing face crowd,0.89944667,0.5146436130299288
Two women are dancing and singing in front of many people,second female dance singing face multiple folk,0.83847857,0.5103825628757477
Two men are dancing and singing in front of a crowd,second male dance singing face crowd,0.8823423,0.5228808942963096
A lemur is biting a person's finger,monkey rubbing someone stylus,0.581589,0.5675914213061333
An animal is biting a person's finger,animal rubbing someone stylus,0.62919444,0.5562245527903239
A lemur is licking a person's finger,monkey rubbing someone stylus,0.61791766,0.5491007089614868
An animal is biting someone's finger,animal rubbing someone stylus,0.62542295,0.5551071848188128
An animal is biting somebody's hand,animal rubbing someone handgun,0.6221309,0.5407273689905803
A boy is skateboarding on a half pipe,boy chessman pol hose,0.3323366,0.47825680885996136
A man is skateboarding on a half pipe,man chessman pol hose,0.2932583,0.4682927003928593
A girl is skateboarding on a half pipe,female chessman pol hose,0.24649653,0.4314846098423004
A skateboarder is doing acrobatics on a half pipe,chessman choreography pol hose,0.3286332,0.5028292944556788
A skateboarder is doing tricks on a half pipe,chessman gimmick pol hose,0.24605939,0.4520252086222172
A skateboarder is falling off a half pipe,chessman fell pol hose,0.6115188,0.5113685471670968
A big dog is running on the ground,enlarge dog running soil,0.66472936,0.4737024169701796
A dog is running on the ground,dog running soil,0.89446044,0.598512715101242
A dog is sitting on the ground,dog sit soil,0.90566623,0.5880791783332825
The girl is tapping her fingernails,female beating stylus,0.6835648,0.5246787342158231
A girl is tapping her fingernails,female beating stylus,0.69135034,0.520438633181832
A boy is tapping his fingernails,boy beating stylus,0.6732201,0.5911726247180592
A man and a woman are driving down the road in a car,man female manoeuvre road car,0.80772084,0.5100457757711411
A man and a woman are driving down the road in an open-air vehicle,man female manoeuvre road outside machine,0.60148895,0.5100049749016762
Two men are driving down the road in an open-air vehicle,second male manoeuvre road outside machine,0.51179385,0.4499381411643255
A man and a woman are driving down the street in a jeep,man female manoeuvre street gyp,0.35856593,0.46263049897693453
Two persons are driving down the street in a jeep,second personnel manoeuvre street gyp,0.2720656,0.37095678514904445
A man and a woman are not driving down the street in a jeep,man female manoeuvre street gyp,0.2659157,0.4803216592832045
Ingredients are being poured into a bowl by a woman,ingredient being pour mug female,0.64874375,0.584491777420044
A woman is pouring ingredients into a bowl,female pour ingredient mug,0.8086098,0.5336404939492544
There is no woman pouring ingredients into a bowl,female pour ingredient mug,0.29399735,0.5537735865666316
The chef is seasoning the oil,cook flavor oil,0.7877294,0.5653163135051728
The woman is seasoning the oil,female flavor oil,0.73021257,0.5707626938819885
The woman is not seasoning the oil,female flavor oil,0.47025526,0.5584859143603932
A horse is being ridden by a person,swine being rider guy,0.36154085,0.4807035880429404
A person is riding a horse,guy rider swine,0.34682375,0.4272632300853729
A person is riding a motorbike,guy rider rider,0.5890744,0.453421950340271
Potatoes are being sliced by a woman,pome being slash female,0.45510715,0.4955213161615225
There is no woman slicing potatoes,female slash pome,0.31680128,0.45624682578173553
The man is training,man formation,0.6413174,0.5194888015588125
The man is doing exercises,man experimentation,0.6731514,0.4523165225982666
The man is not doing exercises,man experimentation,0.40805304,0.4331006341510349
Two men are boxing,second male pitching,0.46719104,0.4284155709402902
Two men are hugging,second male embracing,0.8833275,0.5059176534414291
A man is putting vegetables into a pot,man assigning herb pot,0.76392925,0.4810587580387409
Vegetables are being put into a pot by a man,vegetation being put pot man,0.78261846,0.6008337661623955
A man is removing vegetables from a pot,man eliminate herb pot,0.71949345,0.517635906736056
Someone is pouring ingredients into a pot,someone pour ingredient pot,0.89402664,0.577879705212333
Someone is adding ingredients to a pot,someone supplement ingredient pot,0.7885866,0.5503280379555442
Nobody is pouring ingredients into a pot,someone pour ingredient pot,0.19144154,0.5514978441325101
The man is standing on a rocky mountain and gray clouds are in the background,man standing rock mountain grayness wind ambiance,0.86573154,0.5235378534897513
"The man is standing on a mountain, which is rocky, and gray clouds are in the background",man standing hill rock grayness wind ambiance,0.7771667,0.5826146072811551
The man is not standing on a rocky mountain and gray clouds are not in the background,man standing rock mountain grayness wind ambiance,0.6054496,0.5282568597793579
"A person with a back pack, who is topless, is in front of a pile of rocks and clouds are in the background",guy backlash package overtop face heap rock wind ambiance,0.53298134,0.5948313619639423
A topless person with a back pack is in front of a pile of rocks and clouds are in the background,overtop guy backlash package face heap rock wind ambiance,0.44800937,0.5553827484448751
A fully dressed person is behind a pile of rocks and a clear sky is in the background,perfect dress guy hereafter heap rock tidy ocean ambiance,0.51494145,0.5182901301554271
A black topless person is packing a pile of rocks and a front of clouds are in the background,blacken overtop guy package heap rock face wind ambiance,0.636457,0.5303275373674208
The dog is catching a ball,dog seizing oddball,0.7770356,0.4660748676820235
A dog is catching a ball,dog seizing oddball,0.79887474,0.46173436533321033
There is no dog catching a ball,dog seizing oddball,0.29597065,0.4600011110305786
A dog is furiously chasing a ball through dirt,dog fury hunting oddball dirtiness,0.7090293,0.4847281857540733
A dog is chasing a ball through dirt,dog hunting oddball dirtiness,0.7099816,0.45266002842358183
A dog is leaving a ball in the dirt,dog leaving oddball dirtiness,0.6956145,0.5190288027127584
A boy in a blue shirt has dirt on his face,boy blueness coat dirtiness face,0.90449953,0.5085780753029717
A boy in a blue dyed shirt has dirt on his face,boy blueness dye coat dirtiness face,0.8927098,0.5140226171130226
A topless boy has a clean face,overtop boy tidy face,0.7349542,0.5404626085208013
A boy has a blue face and dirt on the shirt,boy blueness face dirtiness coat,0.91350317,0.5115892820888095
"A child, who has blond hair, is holding a yellow bottle",young pink hairstyle keep pink bottle,0.65471625,0.5248666280194333
A blond child is holding a yellow bottle,pink young keep pink bottle,0.67112863,0.48307077701275164
There is no blond child holding a yellow bottle,pink young keep pink bottle,0.2564571,0.4873301684856415
A man in a hat is pacing through a store,man cape pitching depository,0.37869176,0.5097237043082714
A man in a hat is walking through a store,man cape walking depository,0.6893253,0.4917604446411133
A man in a hat is walking past a store,man cape walking past depository,0.891736,0.5104443766176701
A walker is in a hat store for men,walking cape depository male,0.5816151,0.5071215501853398
The man in a hat suited for cowboys is walking through a market and is putting a hand in his pocket,man cape appropriate buffoon walking market assigning handgun bag,0.74821925,0.5254727426697227
The man in a cowboy hat is walking through a market and is putting a hand in his pocket,man buffoon cape walking market assigning handgun bag,0.7392238,0.5059058169523875
The man in a cowboy hat is not walking through a market and is not putting a hand in his pocket,man buffoon cape walking market assigning handgun bag,0.36164343,0.5154135879129171
A large white crane is flying near the water,enlarge colour bearing fly near freshwater,0.4645298,0.38019942185458017
"A crane, which is large and white, is flying near the water",machine enlarge colour fly near freshwater,0.5182909,0.49426068230108783
A large white crane is flying far above the water,enlarge colour bearing fly near freshwater,0.39318892,0.3591359853744507
A white bird is landing swiftly in the water,colour bird landing fast freshwater,0.75030524,0.4942825883626938
The white bird is landing swiftly in the water,colour bird landing fast freshwater,0.76019704,0.5040352679789066
A white bird is swiftly taking off from the water,colour bird fast takings freshwater,0.6528216,0.48348306285010445
The land near a white bird is being watered swiftly,land near colour bird being soak fast,0.6000349,0.5611480882293299
A brown dog is calmly standing in the water,pink dog calm standing freshwater,0.7621696,0.5361809432506561
A brown dog is standing in the water,pink dog standing freshwater,0.69681597,0.5234879943040701
There is no brown dog standing in the water,pink dog standing freshwater,0.43565646,0.5117864864213126
A dog with golden fur is in the water,dog money leather freshwater,0.47000223,0.4755804198128836
A dog with a golden coat is in the water,dog money coat freshwater,0.5539372,0.5099923690160115
A dog with golden fur is out of the water,dog money leather freshwater,0.46130103,0.4909651835759481
"A girl in a blue shirt, who looks young, is walking on the sidewalk and holding up a pink sign",female blueness garment seeing young walking street keep pink mark,0.8688866,0.5733517625115134
A young girl in a blue shirt is walking on the sidewalk and holding up a pink sign,young female blueness coat walking street keep pink mark,0.8936516,0.5475049040147236
There is no young girl in a blue shirt walking on the sidewalk and holding up a pink sign,young female blueness coat walking street keep pink mark,0.5380764,0.5559002839285752
A young girl by a pink sign is holding up a blue shirt and is walking on the sidewalk,young female pink mark keep blueness coat walking street,0.90821064,0.5606798755711523
The girl is carrying a sign and a group of people is following her,female carry mark group folk hereafter,0.6304969,0.5286757293201628
The girl is carrying a sign and is being followed by a group of people,female carry mark being continue group folk,0.6185458,0.5759925083680586
The girl is not carrying a sign and no group of people is following her,female carry mark group folk hereafter,0.2514664,0.5101558674465526
One man in a big city is holding up a sign and begging for money,unit man enlarge country keep mark supplication money,0.42399424,0.4550042198254512
A man in a big city is holding a sign and begging for money,man enlarge country keep mark supplication money,0.41351044,0.4882197181383769
A man in a small city is doing charity work,man young country kindness travail,0.529775,0.47759199937184654
