OG_sentences,gen_sentences,cosine_similarity_BERT,jaccard_similarity_BERT
Someone is falling off a horse,someone fell swine,0.7074537,0.5163937926292419
Someone is on a horse,someone swine,0.43808293,0.5084101632237434
A horse is falling on someone,swine fell someone,0.6737422,0.5062781512737274
The man is abruptly knocked off of a horse,man fast hit swine,0.42161188,0.5488447397947311
The man is being knocked off of a horse,man being hit swine,0.5269097,0.5389793770653861
The man is not knocked off of a horse,man hit swine,0.21285424,0.5347403746384841
A woman is tapping her fingers nervously,female beating stylus nervousness,0.82039785,0.4692132931489211
A woman is tapping her fingers,female beating stylus,0.72983587,0.4687066740459866
There is no woman tapping her fingers,female beating stylus,0.29158074,0.49413549304008486
A woman is tapping her fingers on a desk,female beating stylus bench,0.5361861,0.4649923535493704
A woman is tapping her fingers on a table,female beating stylus tableland,0.61387986,0.4358980102198465
A woman is resting her fingers on a table,female rest stylus tableland,0.7655643,0.42953155296189444
A dog is pushing a toddler into a rain puddle,dog pushing young wind muck,0.68507683,0.5220456999890944
A dog is pushing a toddler into a puddle of rain,dog pushing young muck wind,0.6812557,0.5286736786365509
A dog is pulling a toddler out of a rain puddle,dog pulling young wind muck,0.6895639,0.5345807439751096
The dog is knocking a boy into the water,dog beating boy freshwater,0.86754525,0.5705873290697734
A boy is being knocked into the water by the dog,boy being hit freshwater dog,0.9017012,0.5649618366185356
The dog is not knocking the boy into the water,dog beating boy freshwater,0.49934787,0.5535628162324429
A boy is knocking a dog with a bottle of water,boy beating dog bottle freshwater,0.8944007,0.5910320580005646
A man is hungrily eating a bowl of cereal,man longing eating mug hay,0.6444924,0.5579172410070896
A man is eating a bowl of cereal,man eating mug hay,0.67692745,0.5823263774315516
There is no man eating a bowl of cereal,man eating mug hay,0.27814224,0.5529998678427476
Cereal is being eaten by the man,hay being eat man,0.64168745,0.5860826869805654
The man is eating cereal,man eating hay,0.6520879,0.5535069182515144
There is no man eating cereal,man eating hay,0.2610422,0.5107008483674791
A man is strumming the guitar,man drubbing pianoforte,0.37054062,0.47818027092860294
A man is packing away the guitar,man package leaving pianoforte,0.47819936,0.49005210399627686
The man is playing the flute,man playing plume,0.38632298,0.6108522951602936
The person is playing the flute,guy playing plume,0.26176214,0.598957234621048
The man in not playing the flute,man playing plume,0.34276947,0.6076616102998907
There is no woman adding spices to some meat,female supplement flavor meat,0.34885263,0.5154710091077365
A woman is adding spices to some meat,female supplement flavor meat,0.7961832,0.49094050129254657
The woman is adding sugar to the meat slowly,female supplement sweetener meat slow,0.73612136,0.48218374252319335
The woman is adding sugar to the meat,female supplement sweetener meat,0.73656124,0.4788089990615845
The woman is not adding sugar to the meat,female supplement sweetener meat,0.40754738,0.47175101722989765
A dog is biting a can,dog rubbing,0.6011034,0.5752798676490783
A can is being bitten by a dog,being hit dog,0.7304315,0.612960631197149
A dog is dropping a can,dog drop,0.85839164,0.5950911641120911
A dog is opening a can of food,dog onset food,0.8020474,0.5206808556209911
A dog is opening a jar of food,dog onset pot food,0.77475625,0.5216420392195383
A dog is closing a can of food,dog close food,0.735379,0.5788934230804443
A cat is playing with a watermelon,cat playing prune,0.8894386,0.58428426583608
One cat is playing with a watermelon,unit cat playing prune,0.8720919,0.5006558620012723
There is no cat playing with a watermelon,cat playing prune,0.3994429,0.5583009215501639
The cat is playing passionately with a watermelon,cat playing fervor prune,0.84382766,0.542336493730545
The cat is playing with a watermelon,cat playing prune,0.87119687,0.5872139235337576
The cat isn't playing with a watermelon,cat playing prune,0.5216981,0.5903104075363704
The boy is playing a guitar,boy playing pianoforte,0.31220192,0.5258399248123169
A boy is playing a guitar,boy playing pianoforte,0.33285,0.5294683774312338
There is no boy playing a guitar,boy playing pianoforte,0.119574934,0.4945970892906189
A teenager is playing the guitar,young playing pianoforte,0.27552032,0.5066995554500155
A kid is playing a guitar,guy playing pianoforte,0.26522917,0.48114856746461654
A kid is putting the guitar away,guy assigning pianoforte leaving,0.31498647,0.44015251596768695
A woman is wakeboarding on a lake,female waken lake,0.75406134,0.5313211580117544
One woman is wakeboarding on the lake,unit female waken lake,0.69686365,0.44491174587836635
A woman is watching the lake,female seeing lake,0.9071685,0.5670720007684495
The woman is waterskiing fearlessly,female aquatics fright,0.6256889,0.4942706823348999
The woman is waterskiing,female aquatics,0.72140527,0.5319541361596849
The woman is not waterskiing,female aquatics,0.44940865,0.5157183289527894
Someone is banging the lens of a camera against a nail,someone beating glass room lash,0.6596627,0.5421194013427285
Someone is banging a camera lens against a nail,someone beating room glass lash,0.6434712,0.5199235518773396
There is no one banging a camera lens against a nail,someone beating room glass lash,0.1464774,0.5245674778433407
Someone is nailing a camera lens with loud bangs,someone rubbing room glass solid shaving,0.27314505,0.44968002041180927
A camera is being hammered onto the nail by the man,room being pinniped till lash man,0.5410963,0.46599405705928804
The man is hammering a nail with a camera,man thrashing lash room,0.53454244,0.49170586839318275
The man is not hammering a nail with a camera,man thrashing lash room,0.23983315,0.49001048242344575
The camera man is nailing a hammer to the wall,room man rubbing whip mural,0.6339903,0.5096420224975137
A person is slicing an onion,guy slash ail,0.27525848,0.5001606404781341
A person is cutting an onion,guy slash ail,0.31359124,0.45563283893797135
A person near an onion has a cut,guy near ail cut,0.5175631,0.5460465947786967
One person is cutting an onion,unit guy slash ail,0.3343932,0.3781800329685211
There is no person cutting an onion,guy slash ail,0.17784882,0.44422063827514646
A person is eating a cut onion,guy eating cut ail,0.7268103,0.50911714813926
A person is wrapping up an onion,guy wrapping ail,0.46764994,0.555959141254425
The oriental lady is cutting a carrot into thin pieces,ocean dame slash citrus tyke fraction,0.28469086,0.45587220262078676
The oriental lady is cutting a carrot into pieces that are thin,ocean dame slash citrus fraction tyke,0.27963635,0.49633729457855225
The oriental lady is not cutting a carrot into thin pieces,ocean dame slash citrus tyke fraction,0.26370248,0.4718599120775859
A thin lady is piecing together oriental carrot cuts,tyke dame parcelling unite ocean citrus slash,0.24519137,0.44711264497355413
A man is pouring a plate of shredded cheese into a pot of sauce,man pour panel crumble sauce pot sauce,0.8638004,0.5230780321618785
A man is pouring a plate of cheese which is shredded into a pot of sauce,man pour panel sauce crumble pot sauce,0.8528533,0.5496550059318542
A man is taking a plate of shredded cheese off of a pot of sauce,man takings panel crumble sauce pot sauce,0.8228067,0.5236837935447692
A man is pouring a pot of cheese sauce into a shredded plate,man pour pot sauce sauce crumble panel,0.85976666,0.530018768527291
The woman is adding cheese to the sauce,female supplement sauce sauce,0.65921557,0.5142380098501841
The lady is adding cheese to the sauce,dame supplement sauce sauce,0.6074797,0.5353497664133707
The woman is removing cheese from the sauce,female eliminate sauce sauce,0.7912943,0.5454781800508499
Some cameras are being burned by a person with a blow torch,room being kindle guy blast flame,0.6771305,0.5092258798448663
A person is burning some cameras with a blow torch,guy kindle room blast flame,0.6668692,0.5017999038100243
A person is repairing some cameras with a blow torch,guy mending room blast flame,0.6246791,0.5206512212753296
A person by some cameras is blowing on a burning torch,guy room outpouring kindle flame,0.63907593,0.47601092802850825
The tall person is setting fire to the cameras,senior guy set fire room,0.6229453,0.5218772845608848
The person is setting fire to the cameras,guy set fire room,0.6753925,0.518750473856926
There is no person setting fire to the cameras,guy set fire room,0.19498326,0.4766925344100365
One man is playing the guitar,unit man playing pianoforte,0.30778295,0.43340444564819336
The man is playing an acoustic guitar,man playing harmonic pianoforte,0.3978641,0.44267011682192486
The man is playing a guitar which is acoustic,man playing pianoforte harmonic,0.3914641,0.4789747766086033
The man isn't playing an acoustic guitar,man playing harmonic pianoforte,0.18342656,0.44648416127477375
A person is cutting an onion into pieces,guy slash ail fraction,0.30907708,0.44307663043340045
A person is dicing an onion,guy rubbing ail,0.33353198,0.5079886750741438
A person is piecing together an onion,guy parcelling unite ail,0.30846828,0.4804159632095924
A person is slicing a carrot into pieces,guy slash citrus fraction,0.35940543,0.5144052276244531
A carrot is being sliced into pieces by a person,citrus being slash fraction guy,0.35347322,0.5084548830986023
There is no person slicing a carrot into pieces,guy slash citrus fraction,0.27158597,0.52740849341665
The man is slicing a potato,man slash pie,0.68493986,0.5291691243648529
The person is carefully slicing a potato,guy attention slash pie,0.52672684,0.4899081587791443
The man is wrapping a potato,man wrapping pie,0.78335375,0.5602248112360636
The man is cooking slices of potato,man cook slash pie,0.7997106,0.5214262333783236
The man is slicing the potato,man slash pie,0.6864698,0.5309462726116181
The person is slicing the potato,guy slash pie,0.6067616,0.539326673746109
The man is not slicing the potato,man slash pie,0.3817481,0.5196145447817716
Somebody is cutting a tomato,someone slash pome,0.53604364,0.48780750632286074
Someone is cutting a tomato,someone slash pome,0.52276593,0.4482678241199917
There is no one cutting a tomato,someone slash pome,0.19594726,0.4750997099009427
The lady is slicing a tomato,dame slash pome,0.32393047,0.5087054696950045
The woman is slicing a tomato,female slash pome,0.40560728,0.4857972643592141
The woman is holding a whole tomato,female keep totality pome,0.37751424,0.4377837089391855
A man is preparing some dish,man preparation pot,0.79268295,0.4806242320272658
A man is preparing a dish,man preparation pot,0.8046274,0.5079700681898329
A man is cleaning a dish,man cleaning pot,0.88435066,0.5490579538875155
The woman is slicing an onion with a knife,female slash ail handgun,0.3190605,0.4683862129847209
An onion is being sliced with a knife by the woman,ail being slash handgun female,0.34423435,0.4975581204189974
The woman is not slicing an onion with a knife,female slash ail handgun,0.3607595,0.47061415761709213
Some runners are competing in a race,rider competition race,0.7296498,0.4932353734970093
Runners are competing in a race,rider competition race,0.72691315,0.5349618858761258
Runners are not taking part in the race,rider takings part race,0.34166974,0.5068810628010676
Runners are racing in a competition,rider race competition,0.7495266,0.5253277685907152
The runners are racing impetuously around a track,rider race deliberate environs lane,0.5911894,0.5130447037518024
The runners are racing around a track,rider race environs lane,0.73551977,0.506365488875996
The runners are not racing around a track,rider race environs lane,0.307617,0.5003263652324677
A man is racing,man race,0.92038095,0.5591910779476166
A man is running,man running,0.9901699,0.6041808029015859
A man is standing still,man standing continue,0.819274,0.5545480400323868
A man is running down the road,man running road,0.94044554,0.6039964020252228
One man is running down the road,unit man running road,0.87332684,0.5026256225325845
There is no man running down the road,man running road,0.41985115,0.563061838800257
The keyboard is being played with his nose by a man,typeface being playing mouth man,0.58320117,0.5567714642075932
A man is playing the keyboard with his nose,man playing typeface mouth,0.5873809,0.5435428534235273
A man is idling,man impinging,0.7132782,0.5456282421946526
A man at the keyboard is playing with his nose,man typeface playing mouth,0.61318016,0.5541887521743775
The man is funnily playing the piano with his nose,man fun playing pianoforte mouth,0.9011817,0.5964690186083317
The man is playing the piano with his nose,man playing pianoforte mouth,0.9010786,0.6003748178482056
There is no man playing the piano with his nose,man playing pianoforte mouth,0.43433917,0.5794545752661568
A baby rhino is following an adult rhino,young monkey hereafter adult monkey,0.48889905,0.5162329189479351
"A rhino, which is little, is following an adult rhino",swine young hereafter adult monkey,0.5216912,0.5421534918603443
A baby rhino is shunning an adult rhino,young monkey avoid adult monkey,0.5375654,0.5677601955831051
A baby and an adult are being followed by a rhino,young adult being continue monkey,0.41742802,0.5428766047253328
"A rhino, which is a youngling, is walking around a pen with its mother",swine young walking environs stylus madam,0.46235648,0.5976734662055969
A baby rhino is walking around a pen with its mother,young monkey walking environs stylus madam,0.65274936,0.5124707122643789
A baby rhino and its mother are standing in a pen,young monkey madam standing stylus,0.55829227,0.5256937847417944
A mother is giving the baby a pen with a walking rhino on it,madam giving young stylus walking monkey,0.64507043,0.5506844747634161
A man is riding a motorcycle,man rider rider,0.64728373,0.47046588526831734
A man is getting off the motorcycle,man getting rider,0.6078639,0.5449463605880738
A man is dangerously riding a motorcycle through a town,man danger rider rider country,0.52734303,0.4736823998391628
A man is riding a motorcycle through the town,man rider rider country,0.50630456,0.45419306938464826
There is no man riding a motorcycle through the town,man rider rider country,0.27364007,0.4607576813016619
A group of people is singing,group folk singing,0.8310071,0.5647757516966926
A few people are singing,folk singing,0.78181946,0.48946874482291086
A group of people is silent,group folk quiet,0.86293024,0.5717180106374953
Some people are singing,folk singing,0.7914495,0.452716459830602
Some persons are singing,personnel singing,0.9342962,0.4701370298862457
Some people are silent,folk quiet,0.9054792,0.4675766925017039
A man is playing a trumpet brightly,man playing thump light,0.45107883,0.5627158113888332
A man is playing a trumpet,man playing thump,0.4081148,0.5735982981595126
A man is putting a trumpet away,man assigning thump leaving,0.53462434,0.49894632611955914
The man is playing a guitar,man playing pianoforte,0.31156906,0.5098393691910638
A guitar is being played by the man,pianoforte being playing man,0.39136636,0.5323297133048376
The man is not playing a guitar,man playing pianoforte,0.176251,0.48788799047470094
One man is dancing,unit man dance,0.87225485,0.4631401981626238
A man is motionless,man invariable,0.43840396,0.46218881342146134
A man is speaking,man speak,0.93692625,0.6026389797528585
A man is silent,man quiet,0.9452133,0.5937625467777252
A man is carefully climbing a rope,man attention climb cord,0.74926734,0.502823840488087
A man is climbing a rope,man climb cord,0.829871,0.5703283548355103
A man is untying a rope,man unhinge cord,0.8409478,0.5056898345549902
A man is being roped before a climb,man being cord climb,0.81942964,0.5743470788002014
One panda is climbing,unit monkey climb,0.7191918,0.426672773701804
A panda is climbing,monkey climb,0.69165355,0.5195123652617136
There is no panda climbing,monkey climb,0.34545586,0.5137707931654794
A woman is dancing beautifully in a cage,female dance tidy cistern,0.59597695,0.46532107775027937
A woman is dancing in a cage,female dance cistern,0.6578236,0.4964436075904153
There is no woman dancing in a cage,female dance cistern,0.26958582,0.4972275197505951
A woman is being caged for the dance,female being trap dance,0.7534071,0.5925455689430237
The woman is dancing,female dance,0.9355203,0.5731593271096548
The lady is dancing,dame dance,0.8399068,0.57254691918691
The woman is not dancing,female dance,0.43418115,0.542778560093471
Four people are floating on a raft,quarter folk submersible ship,0.5154623,0.38398563403349656
A few people are floating on a raft,folk submersible ship,0.5521052,0.40132733491750866
Nobody is floating on a raft,someone submersible ship,0.2565298,0.4255789409984242
People are riding and paddling a raft,folk rider pitching ship,0.46489924,0.5175881683826447
Some persons are riding and paddling a raft,personnel rider pitching ship,0.3870662,0.47848691848608166
People are not riding and paddling a raft,folk rider pitching ship,0.23034486,0.5129652802760785
People are paddling near a raft that is being ridden,folk pitching near ship being rider,0.5218572,0.5898932582802243
A cat is eagerly eating corn on the cob,cat willing eating hay cube,0.86852515,0.5804996530214945
A cat is eating corn on the cob,cat eating hay cube,0.9079983,0.5721197326978048
There is no cat eating corn on the cob,cat eating hay cube,0.47573474,0.5481309844897344
A cat is eating some corn,cat eating hay,0.86374176,0.5640741388003031
The cat is eating some corn,cat eating hay,0.8382743,0.5636698338720534
A cat is walking away from some corn,cat walking leaving hay,0.88244265,0.5533194144566854
Someone is slicing a tomato,someone slash pome,0.5053295,0.495485657453537
Nobody is slicing a tomato,someone slash pome,0.20120254,0.46398561596870425
The person is quickly slicing a vegetable,guy fast slash herb,0.5012373,0.5299332390228907
The person is slicing a vegetable,guy slash herb,0.48104703,0.538949704170227
The person isn't slicing a vegetable,guy slash herb,0.39096326,0.5316108763217926
A little girl is playing a grand piano on stage,young female playing chasten pianoforte stage,0.87884635,0.4844912991804235
"A little girl is playing a piano, which is very big, on stage",young female playing pianoforte adult stage,0.89353323,0.5602318133626666
There is no little girl playing a grand piano on stage,young female playing chasten pianoforte stage,0.5330739,0.4891490704483456
"A girl, who is little, is playing the piano",female young playing pianoforte,0.92561233,0.600125765800476
A little girl is playing the piano,young female playing pianoforte,0.9404693,0.5305287675424055
There is no little girl playing the piano,young female playing pianoforte,0.4137815,0.5150264004866282
A man is packing a guitar,man package pianoforte,0.45756024,0.4838378098275926
Someone is strumming the guitar,someone drubbing pianoforte,0.34029943,0.47075367470582324
Someone is playing the guitar,someone playing pianoforte,0.3077973,0.47941529005765915
Someone is putting the guitar away,someone assigning pianoforte leaving,0.41581255,0.42125029455531726
The man is dancing frantically,man dance fervor,0.87056834,0.5178626239299774
The man is dancing,man dance,0.9557717,0.5974212189515432
The man is not dancing,man dance,0.35164067,0.5727160573005676
Three women are dancing,quarter female dance,0.84082913,0.39998706749507357
A few women are dancing,female dance,0.94969785,0.5175490209034511
Three women are standing still,quarter female standing continue,0.7593504,0.39986048804389107
A man is playing a flute made of bamboo,man playing plume create lumber,0.30254915,0.5393746048212051
A man is playing a bamboo flute,man playing lumber plume,0.41307735,0.5436459504641019
There is no man playing a bamboo flute,man playing lumber plume,0.18217963,0.5246044737952096
The man is playing a flute,man playing plume,0.39094776,0.6106712877750397
A flute is being played by the man,plume being playing man,0.43372506,0.6034048383052533
The man is not playing a flute,man playing plume,0.25564617,0.5922379276969216
A person is absently cutting mushrooms with a knife,guy inattention slash herb handgun,0.3064577,0.41836704148186576
A person is cutting mushrooms with a knife,guy slash herb handgun,0.48746544,0.42449928247011626
A person is putting away the mushrooms,guy assigning leaving herb,0.60691345,0.46959919730822247
A person is slicing some mushrooms,guy slash herb,0.4184811,0.4983844459056854
A person is cutting some mushrooms,guy slash herb,0.44752136,0.463796251349979
There is no person cutting some mushrooms,guy slash herb,0.36697263,0.46671752333641053
A tiger is pacing around a cage,monkey pitching environs cistern,0.41322255,0.4872620151593135
A tiger is walking around a cage,monkey walking environs cistern,0.5398202,0.45441654324531555
A tiger is walking outside a cage,monkey walking outside cistern,0.5643265,0.48378483454386395
A tiger is walking around with no aim,monkey walking environs aim,0.4922771,0.5312032947937647
A tiger is walking around aimlessly,monkey walking environs deliberate,0.5888691,0.4799895981947581
A tiger is sitting,monkey sit,0.69578034,0.5128398338953654
A tiger is aimlessly walking around,monkey deliberate walking environs,0.5762619,0.4797825167576472
A monkey is brushing the dog,monkey shaving dog,0.835237,0.5332080125808716
The monkey is brushing the dog,monkey shaving dog,0.81648815,0.5400130450725555
There is no monkey brushing the dog,monkey shaving dog,0.41228554,0.5126060735095631
A bull dog is being brushed by the monkey,swine dog being rubbing monkey,0.8517752,0.5282575525343418
The monkey is brushing a bull dog,monkey shaving swine dog,0.81474566,0.4860761853364798
The monkey is not brushing a bull dog,monkey shaving swine dog,0.49753094,0.47952415687697275
A bull dog is brushing the monkey,swine dog shaving monkey,0.82679397,0.47769610239909244
A woman is swiftly cutting an onion,female fast slash ail,0.48837268,0.4687628547350566
The lady is dicing onions,dame rubbing ail,0.29980487,0.5156848013401032
The woman is dicing onions,female rubbing ail,0.36485663,0.4831592798233032
The woman is throwing onions away,female pitching ail leaving,0.43658906,0.4667080342769623
A man is wearing a hard hat and dancing,man dressing solid cape dance,0.6806365,0.5592706331184932
A man is wearing a hat which is hard and is dancing,man dressing cape solid dance,0.6824244,0.6045051076832939
A man is naked and standing still,man blind standing continue,0.77629113,0.5378511981530623
A man is dancing with a worn hard hat,man dance weary solid cape,0.714265,0.5159355918566386
A man with a hard hat is dancing,man solid cape dance,0.64497685,0.5721559673547745
The man with a hard hat is dancing,man solid cape dance,0.63731015,0.5767018347978592
There is no man with a hard hat dancing,man solid cape dance,0.5432259,0.56228474011788
Two boys are playing a video game,second guy playing movie game,0.73663557,0.4571528236071269
A couple of boys are playing a video game,couple guy playing movie game,0.7808102,0.5431986919471196
Two boys are studying,second guy study,0.7934506,0.42914052520479473
Two boys on a couch are playing games on the TV,second guy bench playing game television,0.7779434,0.49972384466844444
Two boys on a couch are playing video games,second guy bench playing movie game,0.64619625,0.4696605841318766
Two boys on a couch are reading a book,second guy bench reading book,0.76042217,0.4622713880879538
Video games of two playing boys are on a couch,movie game second playing guy bench,0.5321948,0.48619405552744865
A woman is cutting a potato,female slash pie,0.6838515,0.4468667242262099
The man is slicing vegetables,man slash herb,0.5037384,0.5407969488037957
Vegetables are being sliced by a man,vegetation being slash man,0.5798569,0.5781751076380411
The man is not slicing vegetables,man slash herb,0.4644652,0.5195682048797607
The lady is breaking an egg for the mixer,dame breakup meat mix,0.40345374,0.5199211963585445
The lady is cracking an egg for the mixer,dame crack meat mix,0.45491666,0.555470911356119
The lady isn't cracking an egg for the mixer,dame crack meat mix,0.15528247,0.5710643728574117
The lady is carefully slicing up the meat,dame attention slash meat,0.6306529,0.5469822058310876
The lady is slicing up the meat,dame slash meat,0.7368274,0.6169086748903448
The lady isn't slicing up the meat,dame slash meat,0.30291912,0.6110253563294044
The lady is eating slices of meat,dame eating slash meat,0.85847175,0.5710340467366305
Some ferrets are climbing down from a shelf,faeces climb bench,0.5680646,0.4691879107401921
Ferrets are climbing down from a shelf,faeces climb bench,0.6110853,0.5178221662839254
Ferrets are climbing up a shelf,faeces climb bench,0.5794183,0.5143580707636747
A few ferrets are climbing out of the cage,faeces climb cistern,0.4510982,0.48086231549580893
Several ferrets are climbing out of the cage,multiple faeces climb cistern,0.44914478,0.481231145064036
Several ferrets are climbing into the cage,multiple faeces climb cistern,0.40941882,0.460352007831846
A man is getting into an automobile,man getting machine,0.58726317,0.5166310429573059
A man is getting into a car,man getting car,0.91790104,0.5990358233451843
A man is getting off the car,man getting car,0.79768175,0.5937221586704254
A man is hurriedly getting into a car in a garage,man fast getting car depository,0.67844355,0.5482265478686282
A man is getting into a car in a garage,man getting car depository,0.75713253,0.5244381705919902
A man is parking a car in a garage,man reservation car depository,0.6816963,0.44817778893879484
