OG_sentences,gen_sentences,cosine_similarity_BERT,jaccard_similarity_BERT
A girl is getting a tattoo on her hand,dame getting incision hands,0.5256306,0.4480695000716618
A girl is getting a tattoo removed from her hand,dame getting incision delete hands,0.57235897,0.45183873176574707
A tattoo is being drawn by the woman in the white sweater on the hand of a teenager,incision being pulling dame belie sweater hands youth,0.529927,0.5049704632588795
The woman in the white sweater is drawing a tattoo on the hand of a teenager,dame belie sweater depiction incision hands youth,0.3816151,0.4502013554939857
The woman in the white sweater is not drawing a tattoo on the hand of a teenager,dame belie sweater depiction incision hands youth,0.27864838,0.4714190363883972
A woman in a purple top is walking a bicycle between two stone columns,dame pink overtop walking wheel two rock array,0.5488439,0.4398715159167414
A woman in a top which is purple is walking a bicycle between two stone columns,dame overtop pink walking wheel two rock array,0.539469,0.47608610153198244
There is no woman in a purple top walking a bicycle between two stone columns,dame pink overtop walking wheel two rock array,0.42023164,0.4830024143060048
"A stone woman and bicycle are on top of two purple columns, between which people are walking",rock dame wheel overtop two pink array human walking,0.5968637,0.5229508600064686
A girl dressed in purple and blue is slowly walking beside her bike at night,dame dressing pink blue slow walking outside bike nightfall,0.77314115,0.4868210005760193
A girl dressed in purple and blue is walking beside her bike at night,dame dressing pink blue walking outside bike nightfall,0.750747,0.4902673778326615
A naked girl is walking beside her bike at night,empty dame walking outside bike nightfall,0.8200963,0.4753678791663226
A man in a red jacket is standing next to a yellow kayak on some rocks by the ocean,man red jacket standing following blue sailing rock seafarer,0.7823716,0.5285545786221822
The man in the red jacket is standing next to the yellow kayak on some rocks by the ocean,man red jacket standing following blue sailing rock seafarer,0.77461636,0.534985194603602
There is no man in a red jacket standing next to a yellow kayak on some rocks by the ocean,man red jacket standing following blue sailing rock seafarer,0.5021292,0.534987699600958
A man is wearing a red jacket and standing beside a yellow canoe on some rocks with water in the background,man wear red jacket standing outside blue canal rock liquid groundwork,0.79614484,0.5354113614920414
A man is wearing a red jacket and standing beside a yellow canoe on some boulders with water in the background,man wear red jacket standing outside blue canal rock liquid groundwork,0.80038774,0.5466707454008215
A man is standing bare-chested beside a yellow canoe on some rocks with water in the background,man standing breast outside blue canal rock liquid groundwork,0.64470345,0.5295715550581614
The dog with the black coat is walking along a tree trunk bridge over water,pet blacken coat walking accompany wood stem bridge liquid,0.70602846,0.4687144064903259
The black dog is walking along a tree trunk bridge over water,blacken pet walking accompany wood stem bridge liquid,0.63883924,0.4464752475420634
The black dog is not walking along a tree trunk bridge over water,blacken pet walking accompany wood stem bridge liquid,0.43750685,0.46517038345336914
A river is being crossed by a dog on a bridge made from a fallen tree,flow being elapse pet bridge create downfall wood,0.49647546,0.4880456076218532
A dog is crossing a river on a bridge made from a fallen tree,pet pass flow bridge create downfall wood,0.5127291,0.47264500097794965
There is no dog crossing a river on a bridge made from a fallen tree,pet pass flow bridge create downfall wood,0.34840864,0.5036897659301758
A tree is falling over a bridge made over the river which a dog is crossing,wood downfall bridge create flow pet pass,0.41828778,0.4927767664194107
A child in a green and white sports uniform is running over the grass,offspring blue belie sportfishing garment running grassland,0.58406425,0.4044358271818895
A child in a green and white uniform for sports is running over the grass,offspring blue belie garment sportfishing running grassland,0.5905353,0.42600927971027513
A child in a green and white sports uniform is resting on the grass,offspring blue belie sportfishing garment rest grassland,0.46356103,0.4050226647120256
A little boy is proudly wearing a green soccer strip and is running on the grass,bit boy disgrace wear blue ballgame sliver running grassland,0.57132894,0.44818334182103475
A little boy is wearing a green soccer strip and is running on the grass,bit boy wear blue ballgame sliver running grassland,0.71304834,0.4873250906284039
There is no little boy wearing a green soccer strip and running on the grass,bit boy wear blue ballgame sliver running grassland,0.512777,0.4778368381353525
The girl in the black hat is wearing a bikini at the beach,dame blacken coat wear chicane edge,0.27824765,0.4343413426762536
A girl in a black hat is wearing a bikini at the beach,dame blacken coat wear chicane edge,0.2853486,0.42413835298447383
A girl in a black hat is standing topless at the beach,dame blacken coat standing overtop edge,0.49669954,0.44540642840521677
A black girl with no bikini is wearing a hat at the beach,blacken dame chicane wear coat edge,0.31132844,0.4341635817573184
A young lady in a bikini is lying on the beach,young dame chicane falsehood edge,0.28148043,0.41435059573915267
A lady who looks young is lying on the beach,dame seem young falsehood edge,0.37369573,0.47483181580901146
A young lady in a bikini is standing on the beach,young dame chicane standing edge,0.45991296,0.4576071360531975
The man is doing a handstand on the wet shore at the edge of the water at the beach,man hands wetness edge edge liquid edge,0.35763344,0.5321399463074548
The man is doing a handstand on the wet sand at the edge of the water at the beach,man hands wetness soil edge liquid edge,0.38876086,0.5494097215788705
The man at the beach is not doing a handstand on the wet sand at the edge of the water,man edge hands wetness soil edge liquid,0.27391654,0.5466373912219343
A man is performing a handstand on the beach,man executing hands edge,0.4759774,0.513627819220225
A handstand is being performed by a man on the beach,hands being perform man edge,0.5477075,0.5549911716405083
A man is sitting on the beach,man sit edge,0.6850868,0.5143799424171448
A boy of young age is playing in the park with his mother,boy young adulthood playing paseo mother,0.64090633,0.5260312616825104
A young boy is playing in the park with his mother,young boy playing paseo mother,0.61253625,0.5614691562950611
There is no young boy playing in the park with his mother,young boy playing paseo mother,0.28538257,0.5431937855832717
A young mother is playing with her boy in the park,young mother playing boy paseo,0.7157947,0.5573982708156109
The boy in blue is running away from the woman in blue,boy blue running outside dame blue,0.71525455,0.5660044385327233
A boy in blue is running away from a woman in blue,boy blue running outside dame blue,0.74700534,0.5599156949255202
A boy in blue is running towards a woman in blue,boy blue running going dame blue,0.8520045,0.5442871801993426
One little boy with brown hair is jumping off of the brown chair onto the floor,unit bit boy pink hair climb pink seats going floor,0.7153965,0.49797800412544835
A little boy with brown hair is jumping off of a brown chair onto the floor,bit boy pink hair climb pink seats going floor,0.72802067,0.5377572631835937
There is no little boy with brown hair jumping off of a brown chair onto the floor,bit boy pink hair climb pink seats going floor,0.4061314,0.5362252959838281
A young boy is quickly jumping off a chair,young boy quicken climb seats,0.7364644,0.5212086955706279
A young boy is jumping off a chair,young boy climb seats,0.6959053,0.5768629163503647
A young boy is jumping onto a chair,young boy climb going seats,0.71459585,0.5433860054382911
Two children are bouncing on colorful balls,two offspring swing color ball,0.7466545,0.48183431369917734
Two kids are bouncing on colorful balls,two offspring swing color ball,0.74186885,0.47936906133379253
Two kids are sitting on colorful balls,two offspring sit color ball,0.77378905,0.4684295608447148
Two balls are bouncing against some colorful kids,two ball swing color offspring,0.67442954,0.47436755498250327
The children are wearing black tights and hopping,offspring wear blacken hosiery swing,0.75358987,0.3808879641925587
Some children are wearing black tights and hopping,offspring wear blacken hosiery swing,0.7598805,0.35653217399821563
The children are not wearing black tights and are not hopping,offspring wear blacken hosiery swing,0.25502497,0.42097766399383546
A little girl is smiling and wearing a fake nose and glasses,bit dame humour wear falsify mouth glass,0.5216503,0.4839033246040344
The little girl is smiling and wearing a fake nose and glasses,bit dame humour wear falsify mouth glass,0.5289533,0.48683382868766784
A little girl is frowning and taking off a fake nose and glasses,bit dame rubbing takings falsify mouth glass,0.61657465,0.4860540454586347
The blonde girl with the pink top is smiling and wearing funny glasses with a large nose attached,pink dame pink overtop humour wear humour glass magnitude mouth adjunct,0.66186374,0.444732799132665
The blonde girl with the pink top is happily smiling and wearing funny glasses with a large nose attached,pink dame pink overtop joy humour wear humour glass magnitude mouth adjunct,0.7090832,0.44822128117084503
The blonde girl with the pink top is not smiling and not wearing funny glasses with a large nose attached,pink dame pink overtop humour wear humour glass magnitude mouth adjunct,0.50229025,0.474820950999856
Water is being squirted by a man into the mouth of a white dog with a squirt gun,watercraft being erupt man mouth belie pet pour rifle,0.67335016,0.5358096198602156
A man is squirting water into the mouth of a white dog with a squirt gun,man outpouring liquid mouth belie pet pour rifle,0.59893763,0.5243675927321116
There is no man squirting water into the mouth of a white dog with a squirt gun,man outpouring liquid mouth belie pet pour rifle,0.35810673,0.5293473428295504
A man is spraying a super soaker into the mouth of a dog,man drubbing overtop soak mouth pet,0.67590475,0.5318254580100378
The man is spraying a super soaker into the mouth of the dog,man drubbing overtop soak mouth pet,0.66462815,0.5407167673110962
There is no man spraying a super soaker into the mouth of a dog,man drubbing overtop soak mouth pet,0.31042415,0.533658812046051
A boy under an umbrella is being held by his father who is wearing a coat dyed in blue,boy coat being happening mother wear coat colouring blue,0.70438266,0.555278851588567
A boy under an umbrella is being held by his father who is wearing a blue coat,boy coat being happening mother wear blue coat,0.7087306,0.5760094785690307
A boy under an umbrella is being let go by his father who is wearing a blue coat,boy coat being allow go mother wear blue coat,0.6986966,0.566892526767872
"A boy, who is wearing a blue coat, is being held by his father under an umbrella ",man wear blue coat being happening mother coat,0.67670536,0.5824576439680876
A child is amazedly experiencing a new world,offspring astound feel renew world,0.7376908,0.4081876315176487
A child is experiencing a new world,offspring feel renew world,0.7113053,0.3995911379655202
A child is falling asleep,offspring downfall waken,0.34851956,0.3044359738176519
A dog is walking along the snowdrift,pet walking accompany nightfall,0.41764408,0.4555701750975389
A dog is walking along a snowdrift,pet walking accompany nightfall,0.41035917,0.4466360624019916
There is no dog walking along a snowdrift,pet walking accompany nightfall,0.29145387,0.4720290856701987
A dog is playing alone on a beach covered by snow,pet playing solo edge covering fog,0.6000888,0.44501933280159445
A dog is playing alone on the shore covered by snow,pet playing solo edge covering fog,0.6613704,0.4762943422093111
A dog is sleeping on a beach covered by snow,pet waken edge covering fog,0.26884848,0.39341695606708527
A light brown dog is running up a street,illumination pink pet running walkway,0.58128196,0.4312618672847748
The light brown dog is running up a street,illumination pink pet running walkway,0.5801555,0.44365546852350235
There is no light brown dog running up a street,illumination pink pet running walkway,0.3133368,0.44766666959313783
The dog is running into a brown light,pet running pink illumination,0.56796235,0.46962499160033006
A great dog is climbing a steep hill,goody pet climb steep hill,0.7936299,0.4649468958377838
A great dog is wildly climbing a steep hill,goody pet brute climb steep hill,0.80629194,0.4824695867650649
A great dog is getting down a steep hill,goody pet getting steep hill,0.85681385,0.4831067085266113
A man and a woman are walking down the street of a city,man dame walking walkway municipality,0.644392,0.4431121349334717
A man and a woman are walking down a city street,man dame walking municipality walkway,0.6384321,0.4197239379088084
A man and a woman are idling in a city street,man dame flowing municipality walkway,0.35827765,0.41926154964848567
People are walking through a crowded street,folk walking crowd walkway,0.81697536,0.44349270562330884
People are walking through a street which is crowded,folk walking walkway crowd,0.8319292,0.4841585414750235
People are not walking through a crowded street,folk walking crowd walkway,0.53153425,0.45422953825730544
People are walking through a crowd in the street,folk walking crowd walkway,0.8826288,0.5004741932664599
A surfer is riding a big wave across dark green water,seafarer ride magnitude tide exceed dark blue liquid,0.6900479,0.4147074364480518
A big wave is being ridden by a surfer across dark green water,magnitude tide being ride seafarer exceed dark blue liquid,0.65513885,0.46297489166259764
No surfer is riding a big wave across dark green water,seafarer ride magnitude tide exceed dark blue liquid,0.36302716,0.41610926957357497
A surfer is riding a big wave,seafarer ride magnitude tide,0.7271209,0.4171166465832637
The surfer is riding a big wave,seafarer ride magnitude tide,0.72654045,0.42822155585655797
The surfer is riding a small wave,seafarer ride bit tide,0.70224875,0.4359685503519498
The big surfer is riding and waving,magnitude seafarer ride bending,0.46153194,0.4689997562340328
The shirtless man in striped shorts and sunglasses is standing near a man in a white shirt and sunglasses,shirt man sliver hosiery glass standing proximity man belie shirt glass,0.54235804,0.4467428359720442
The shirtless man in striped shorts and sunglasses is standing near a person in a white shirt and sunglasses,shirt man sliver hosiery glass standing proximity man belie shirt glass,0.5146078,0.4440401875310474
The shirtless man in striped shorts and sunglasses is not standing near a man in a white shirt and sunglasses,shirt man sliver hosiery glass standing proximity man belie shirt glass,0.2771839,0.4619355588345914
The muscular black man is dancing and the man behind him is wearing green beads,muscularity blacken man dancing man back wear blue jewelry,0.82463515,0.49411190702364993
The muscular man is dancing and the man behind him is wearing green beads,muscularity man dancing man back wear blue jewelry,0.7447847,0.5190723201502925
The muscular white man is dancing and the man behind him is wearing green beads,muscularity belie man dancing man back wear blue jewelry,0.70028484,0.48795305765592134
A person wearing grey pants is airborne on a snowboard,man wear blue hosiery air sandpiper,0.27356693,0.4091313689947128
A person is wearing grey pants on a snowboard,man wear blue hosiery sandpiper,0.32547414,0.40102366275257534
There is no person wearing grey pants who is airborne on a snowboard,man wear blue hosiery air sandpiper,0.17134887,0.4343835452328558
A snowboarding man is jumping through the air,sportfishing man climb air,0.52263224,0.47885216077168785
A snowboarder is jumping through the air,sandpiper climb air,0.23276863,0.472867319217095
A snowboarding woman is jumping through the air,sportfishing dame climb air,0.47809997,0.44457988341649374
A tennis player is lunging to the left,dancing actor licking leave,0.19846192,0.45246535998124343
A tennis player is jumping to the left,dancing actor climb leave,0.3149147,0.43935875594615936
There is no tennis player lunging to the left,dancing actor licking leave,0.19504157,0.45747762492724825
A tennis player with a green headband is hitting the ball,dancing actor blue hairpin beating ball,0.30806318,0.47654769608848974
The tennis player with a green headband is hitting the ball,dancing actor blue hairpin beating ball,0.31347924,0.4809986384291398
A tennis player with a green headband is missing the ball,dancing actor blue hairpin vanish ball,0.31566128,0.44172077178955077
A man is crouching and holding a camera,man drubbing holder photograph,0.65373206,0.4878394082188606
A person is crouching and holding a camera,man drubbing holder photograph,0.44565016,0.47879697009921074
A woman is crouching and holding a camera,dame drubbing holder photograph,0.552994,0.44009842723608017
A man is squatting in brush and taking a photograph,man sacking whip takings photograph,0.61866593,0.5308319164646996
A man is squatting in brush and taking a photo,man sacking whip takings photo,0.59299827,0.5305272075865004
There is no man squatting in brush and taking a photograph,man sacking whip takings photograph,0.29697323,0.52894589775487
Some dogs are playing in a river,pet playing flow,0.5120065,0.4075536608695984
Some dogs are playing in a stream,pet playing flow,0.560501,0.4534479022026062
Some dogs are not playing in a stream,pet playing flow,0.35805422,0.4506067362698642
Two dogs are looking at something that is moving in the water,two pet looking thing move liquid,0.64280665,0.5177284446027544
Two dogs are looking at something that is splashing in the water,two pet looking thing drubbing liquid,0.6406777,0.4896849478994097
Two cats are looking at something that is splashing in the water,two pet looking thing drubbing liquid,0.38087466,0.5030504266421
A black dog is jumping from a cylindrical hay bale,blacken pet climb spiral grassland ball,0.6455221,0.4679950161984092
A black dog is leaping from a cylindrical hay bale,blacken pet swing spiral grassland ball,0.562668,0.47496230006217954
A white dog is leaping from a cylindrical hay bale,belie pet swing spiral grassland ball,0.4165126,0.4496462821960449
A black dog is jumping from n hay ball to another hay ball,blacken pet climb nix grassland ball alter grassland ball,0.69507384,0.4226639580726623
A black dog is leaping from a hay ball to another hay ball,blacken pet swing grassland ball alter grassland ball,0.68335766,0.42841200828552245
A black cat is jumping from a hay ball to another hay ball,blacken pet climb grassland ball alter grassland ball,0.51531076,0.4293801710009575
The brown dog is jumping in the air,pink pet climb air,0.4359166,0.5154441644748052
The brown animal is jumping in the air,pink animal climb air,0.5863111,0.5507353742917379
A brown dog is jumping in the water,pink pet climb liquid,0.4048961,0.4374127934376399
A dog is jumping in the air,pet climb air,0.57862055,0.505544102191925
There is no brown dog jumping in the air,pink pet climb air,0.26264808,0.5015147695174584
A man on a motorcycle is riding on a track and waving happily,man motorboat ride track bending joy,0.78141594,0.5483778232619876
A man on a motorcycle is riding on a track and waving,man motorboat ride track bending,0.70654345,0.5653042103114881
A man on a horse is riding on a track and waving,man horse ride track bending,0.8510195,0.6264205707444085
The person on the motorcycle is holding up his arm,man motorboat holder hands,0.57911026,0.5317159056663513
The person on the motorcycle is holding up an arm,man motorboat holder hands,0.5597329,0.5336967746416728
The person on the motorcycle is not holding up an arm,man motorboat holder hands,0.42517126,0.5283691398799419
Two adults are standing on a scooter in a field of yellow flowers,two adulthood standing motorboat grassland blue blossom,0.4845623,0.47242303516553796
Two adults are standing on a scooter in a field of flowers,two adulthood standing motorboat grassland blossom,0.53933215,0.48193482274100896
Two adults are not standing on a scooter in a field of yellow flowers,two adulthood standing motorboat grassland blue blossom,0.35425752,0.48972606162230176
Two people wearing helmets are riding over the yellow and white flowers,two human wear armor ride blue belie blossom,0.47318327,0.4982101592150601
Two people wearing helmets are driving over the yellow and white flowers,two human wear armor driver blue belie blossom,0.369111,0.4890430434183641
Two people wearing helmets are not riding over the yellow and white flowers,two human wear armor ride blue belie blossom,0.30800894,0.5077083033064137
A man is riding a dirt bike down a dirt hill,man ride dirt bike dirt hill,0.94664705,0.5861644218949711
A person is riding a dirt bike down a dirt hill,man ride dirt bike dirt hill,0.8902685,0.5770808107712689
A person is riding a dirt bike up a dirt hill,man ride dirt bike dirt hill,0.89238954,0.5797976956647986
A person is riding a bike along a muddy trail,man ride bike accompany dull track,0.7248465,0.5583204066052156
A person is riding a bike along the trail,man ride bike accompany track,0.812798,0.5556241869926453
There is no person riding a bike along a muddy trail,man ride bike accompany dull track,0.53578043,0.5667308237817552
A man in blue is riding a horse on a dirt road,man blue ride horse dirt road,0.9358799,0.6034019721878899
A man in blue is riding a animal on a dirt road,man blue ride animal dirt road,0.918986,0.5972315437263913
A woman in blue is riding a horse on a dirt road,dame blue ride horse dirt road,0.8914082,0.5493676198853387
A man is riding a dirty horse on a blue road,man ride dirt horse blue road,0.8725192,0.5919062880908742
A white horse is being ridden by a man in a blue cowboy hat,belie horse being ride man blue bovid coat,0.8185905,0.5216622090339661
A man in a blue cowboy hat is riding a white horse,man blue bovid coat ride belie horse,0.87422603,0.48823262680144536
A man in a blue cowboy hat is riding a black horse,man blue bovid coat ride blacken horse,0.9422905,0.4960304413522993
Three people are driving ATVs,two human driver automobile,0.55046576,0.38614208102226255
ATVs are being driven by three people,automobile being driver two human,0.6550771,0.416382766686953
There are no people driving ATVs,human driver automobile,0.3123014,0.41164050102233884
Three people are driving four wheel ATVs in a field,two human driver quarter wheel automobile grassland,0.66288924,0.44189183335555227
Three people are driving four wheel vehicles in a field,two human driver quarter wheel vehicle grassland,0.6743829,0.4401421944300334
Three people are driving four wheel ATVs in a street,two human driver quarter wheel automobile walkway,0.55432194,0.43254081199043676
Two white dogs and one brown dog are chasing a ball,two belie pet unit pink pet hunt ball,0.4629215,0.38774729073047637
Two white dogs and one brown dog are chasing a toy,two belie pet unit pink pet hunt play,0.45060283,0.38944338262081146
Two white dogs and one brown dog are not chasing a ball,two belie pet unit pink pet hunt ball,0.3155344,0.4068036817369007
Two white dogs are playing with a brown dog and a tennis ball,two belie pet playing pink pet dancing ball,0.5208756,0.45418262210759247
Two white dogs are playing with a brown dog and a ball,two belie pet playing pink pet ball,0.5277852,0.48425230383872986
Two white cats are playing with a brown dog and a ball,two belie pet playing pink pet ball,0.565359,0.47867417633533477
A white race car is driving through a puddle,belie breed car driver muck,0.5482414,0.4458309622371898
A white racing vehicle is driving through a puddle,belie racehorse vehicle driver muck,0.32764536,0.4389822516176436
There is no white race car driving through a puddle,belie breed car driver muck,0.19394258,0.45586326718330383
The white rally car is throwing mud into the air and is approaching a bend in the track,belie gathering car throw dirt air proximity bending track,0.67492384,0.5386517431054797
A white rally car is throwing mud into the air and is approaching a bend in the track,belie gathering car throw dirt air proximity bending track,0.67616653,0.5341098542724337
A black rally car is throwing mud into the air and is approaching a bend in the track,blacken gathering car throw dirt air proximity bending track,0.8087173,0.5453389457293919
A dog is jumping at a shiny blue soccer ball in a field of dry leaves,pet climb gloss blue ballgame ball grassland froth papers,0.5993074,0.4574325254985264
An animal is jumping at a shiny blue soccer ball in a field of dry leaves,animal climb gloss blue ballgame ball grassland froth papers,0.6318207,0.4769378645079477
There is no dog jumping at a shiny blue soccer ball in a field of dry leaves,pet climb gloss blue ballgame ball grassland froth papers,0.42150757,0.4716144327459664
A dog is jumping at dry leaves in a field of shiny blue soccer balls,pet climb froth papers grassland gloss blue ballgame ball,0.5931455,0.44709975410390784
A small black dog is wearing a red collar and is in the leaves with a blue ball,bit blacken pet wear red hook papers blue ball,0.71091694,0.5348767957517079
A little black dog is wearing a red collar and is in the leaves with a blue ball,bit blacken pet wear red hook papers blue ball,0.7328067,0.5390064737626484
