OG_sentences,gen_sentences,cosine_similarity_BERT,jaccard_similarity_BERT
There is no man loading a rifle with bullets,man filling rifle ball,0.34283602,0.5613928650106702
A woman is seasoning a ham,dame condiment sausage,0.63828886,0.4658159180120988
A woman is seasoning a piece of meat,dame condiment fraction meat,0.7590668,0.4644633190972464
A woman is eating a piece of meat,dame eat fraction meat,0.8420285,0.5085423936446508
Some food is being prepared by a chef,food being prepare caretaker,0.77393824,0.4242381198065622
A chef is preparing some food,caretaker preparation food,0.734865,0.36436512795361603
A chef is discarding some food,caretaker debasement food,0.66353476,0.4014181409563337
A chef is preparing a meal,caretaker preparation meal,0.6937546,0.40207481384277344
A chef is cooking a meal,caretaker meal meal,0.6258886,0.3755195140838623
There is no chef preparing a meal,caretaker preparation meal,0.17986727,0.40873511135578156
A man is riding a water toy in the water,man ride liquid play liquid,0.74206066,0.5096402009328206
A man is playing with a water toy in the water,man playing liquid play liquid,0.70773834,0.5237986035645008
There is no man riding a water toy in the water,man ride liquid play liquid,0.23543052,0.5173627063632011
Two sumo ringers are fighting,two tum calling fighting,0.6370939,0.4849602520465851
Two sumo wrestlers are fighting,two tum fighting fighting,0.7713467,0.5034239292144775
Two sumo ringers are not fighting,two tum calling fighting,0.20084733,0.5037735375491056
A person is playing a piano,man playing singing,0.34002155,0.540003690454695
There is no person playing a piano,man playing singing,0.12110906,0.4832870543003082
A person is slicing a potato,man shaving pie,0.5919274,0.44188337976282294
A potato is being sliced by a person,pie being cutter man,0.5805217,0.5457260012626648
There is no person slicing a potato,man shaving pie,0.2020486,0.460095872481664
A man is sprinkling shredded cheese on a pizza,man rubbing breaking sausage pie,0.78151375,0.5654724836349487
A man is sprinkling cheese on a pizza,man rubbing sausage pie,0.7508545,0.5550076325734457
There is no man sprinkling shredded cheese on a pizza,man rubbing breaking sausage pie,0.46518564,0.5587803595944455
A man is putting seasoning on a pizza,man giving condiment pie,0.8376007,0.5311501707349505
A man is putting some cheese on a pizza,man giving sausage pie,0.8046349,0.5433995861273545
There is no man putting some cheese on a pizza,man giving sausage pie,0.40217966,0.5440691454069955
A man is doing a card trick,man card deceit,0.6135088,0.5155733173543756
A man is doing a magic trick,man enchantment deceit,0.59223616,0.4278722909780649
There is no man doing a card trick,man card deceit,0.4268965,0.515545109907786
A man is having fun with water,man amusement liquid,0.73258734,0.5017333149909973
A man is playing with water,man playing liquid,0.7937741,0.5469973219765557
A man is not playing with water,man playing liquid,0.3859436,0.5421991765499115
A man is buttering a piece of bread,man rubbing fraction pie,0.81543165,0.5247797327382224
A man is buttering a slice of bread,man rubbing clew pie,0.808179,0.5004261493682861
A woman is buttering a piece of bread,dame rubbing fraction pie,0.677212,0.4562876990863255
A lemur is hanging on a cord,salamander lacing wire,0.4390339,0.506400268811446
A lemur is hanging on a rope,salamander lacing rope,0.54392207,0.5064999002676743
There is no lemur hanging on a cord,salamander lacing wire,0.11076239,0.5039495612893786
A woman is putting a baby in a waste bin,dame giving bit garbage sack,0.68746537,0.45715443789958954
A woman is putting a child in a waste bin,dame giving offspring garbage sack,0.733387,0.44501057442496805
There is no woman putting a child in a waste bin,dame giving offspring garbage sack,0.3114364,0.4633045792579651
The woman is poking holes in the potato,dame pitching hollow pie,0.62054974,0.520313982780163
The woman is poking a potato,dame pitching pie,0.64031863,0.5029885590076446
The woman is not poking holes in the potato,dame pitching hollow pie,0.33249485,0.5205024991716657
A man is pouring cleaner into the sink,man pour cleanser soak,0.77622855,0.5413835048675537
A man is cleaning the sink,man cleansing soak,0.7555447,0.556397921509213
There is no man pouring cleaner into the sink,man pour cleanser soak,0.30917117,0.5324252673557827
The drums are being played by the man,clutches being playing man,0.58107007,0.5466439586419326
The man is playing the drums,man playing clutches,0.5558645,0.5323435187339782
The man is not playing the drums,man playing clutches,0.35280818,0.5323461077430032
A woman is deep frying food,dame dark fry food,0.6594162,0.4473027288913727
Food is being deep fried by a woman,food being dark fry dame,0.57556725,0.4965469745489267
There is no woman deep frying food,dame dark fry food,0.45495218,0.4776400490240617
A woman is frying some food,dame fry food,0.8062967,0.46164147059122723
Some food is being fried by a woman,food being fry dame,0.7986338,0.4937596917152405
A woman is not frying some food,dame fry food,0.3019989,0.47292189598083495
A man is petting two dogs,man licking two pet,0.5680748,0.5301765366034075
Two dogs are being petted by a man,two pet being covert man,0.675122,0.49605898062388104
A man is petting two cats,man licking two pet,0.5255472,0.5458306128328497
A woman is pouring eggs into a frying pan,dame pour chicken fry fry,0.80603987,0.4544014036655426
A woman is pouring eggs into a pan,dame pour chicken fry,0.75347555,0.44374085466067
A woman is removing eggs from a frying pan,dame eliminate chicken fry fry,0.7060095,0.44101946694510324
A baby is talking,bit talking,0.66312724,0.5062055985132853
A child is talking,offspring talking,0.87416905,0.43120975153786795
There is no baby talking,bit talking,0.21280187,0.47959831782749723
A boy is saying a word,boy saying words,0.9502451,0.6015444464153714
A boy is saying something,boy saying thing,0.8772835,0.5605904385447502
The child is silent,offspring hush,0.5060675,0.35754086822271347
Some sticky goo is being pulled out of a bowl by a woman,tough gully being pulling sack dame,0.4530564,0.49907082035428
A woman is pulling some sticky goo out of a bowl,dame pulling tough gully sack,0.5501784,0.4780278503894806
A woman is putting some sticky goo in a bowl,dame giving tough gully sack,0.5034468,0.44296827035791736
The woman is putting pasta into a dish,dame giving pie meal,0.7468453,0.4844673275947571
Pasta is being put into a dish by a woman,pie being put meal dame,0.73899114,0.5283049424489339
The woman is not putting pasta into a dish,dame giving pie meal,0.29887742,0.4796397777704092
There is no man riding a motorcycle,man ride motorboat,0.34987366,0.4763145013289018
The men are playing soccer,male playing ballgame,0.54140437,0.43806708521313137
The men are playing with a ball,male playing ball,0.94899,0.6044321358203888
The men are not playing soccer,male playing ballgame,0.3568036,0.42457652688026426
A dog is looking around,pet looking besiege,0.59735763,0.44073530038197833
An animal is looking around,animal looking besiege,0.65665066,0.4901495774586995
There is no dog looking around,pet looking besiege,0.11198342,0.43745627999305725
A dog is looking at a store counter,pet looking store compute,0.5902531,0.5301762074232101
A dog is looking at a piece of furniture in a shop,pet looking fraction furniture shop,0.65921277,0.5467822060865515
A cat is looking at a store counter,pet looking store compute,0.39820114,0.5400847792625427
A tiger cub is roaring,raptor goat yell,0.4705813,0.4635666446252303
A tiger cub is making a sound,raptor goat manufacturing audio,0.33155638,0.45713141063849133
There is no tiger cub making a sound,raptor goat manufacturing audio,0.20157832,0.4600028762450585
A tiger is walking around,raptor walking besiege,0.5269183,0.41944963335990904
A tiger is strolling around,raptor walking besiege,0.49700373,0.4620399529283697
A tiger is not walking around,raptor walking besiege,0.33830678,0.43630989031358197
A woman is frying meat,dame fry meat,0.87592995,0.4807027280330658
A woman is frying food,dame fry food,0.8190606,0.45533331483602524
A woman is not frying meat,dame fry meat,0.22831678,0.476174983713362
A woman is placing food in a pot of hot water,dame position food sack warmer liquid,0.49055433,0.3817299008369446
A woman is cooking food in a pot of hot water,dame meal food sack warmer liquid,0.42823136,0.3674112194114261
A woman is placing food in a pot of cold water,dame position food sack cold liquid,0.6342938,0.42693693439165753
The trumpet is being played by a man,thump being playing man,0.47907495,0.5737070313521794
A man is playing the trumpet,man playing thump,0.39946282,0.5733936591581865
A woman is playing the trumpet,dame playing thump,0.46522254,0.4973813566294583
Someone is playing with a toad,man playing crook,0.36076552,0.4842799365520477
Someone is playing with a frog,man playing monkey,0.42551523,0.505923330783844
Nobody is playing with a toad,nix playing crook,0.20503771,0.44149560332298277
The person is riding the horse,man ride horse,0.8805733,0.5973880357212491
The person is riding the animal,man ride animal,0.79558253,0.5950359834565057
The person is not riding the horse,man ride horse,0.45547622,0.5841516494750977
A person is folding a sheet,man bending table,0.47661328,0.504528714550866
A person is folding a piece of paper,man bending fraction paper,0.72632885,0.5223065217336019
A person is not folding a piece of paper,man bending fraction paper,0.30112135,0.5251695330326374
Somebody is folding a piece of paper,man bending fraction paper,0.73732793,0.5090321997801462
Someone is folding a piece of paper,man bending fraction paper,0.7300929,0.4824403090910478
Nobody is folding a piece of paper,nix bending fraction paper,0.19505957,0.4412768537347967
A girl is using sign language,dame use sign language,0.83657,0.48650369644165037
A girl is communicating with sign language,dame communication sign language,0.7383645,0.49003480781208386
There is no girl communicating with sign language,dame communication sign language,0.3728723,0.494220236937205
A young girl is using sign language,young dame use sign language,0.92630064,0.5086415310700735
Sign language is being used by a young girl,sign language being use young dame,0.8450718,0.5418483932813009
A young boy is using sign language,young boy use sign language,0.987319,0.5592253555854162
A rabbit is playing with a stuffed bunny,monkey playing filling monkey,0.6219744,0.557981992761294
A bunny is playing with a stuffed bunny,monkey playing filling monkey,0.6614499,0.5614678313334783
There is no bunny playing with a stuffed bunny,monkey playing filling monkey,0.34536898,0.548227975001702
A rabbit is playing with a toy rabbit,monkey playing play monkey,0.57386965,0.5388651589552561
A rabbit is playing with a toy,monkey playing play,0.628261,0.5505249738693238
There is no rabbit playing with a toy rabbit,monkey playing play monkey,0.30601177,0.5237498925282404
A man is jumping rope in a field,man climb rope grassland,0.85343874,0.528779671742366
A man is jumping rope outside,man climb rope outside,0.9068458,0.5520655989646912
A woman is jumping rope outside,dame climb rope outside,0.8440681,0.4738836228847504
A woman is slicing a cucumber,dame shaving hawthorn,0.43064362,0.4065285275379817
A person is slicing a cucumber,man shaving hawthorn,0.47937626,0.4714374641577403
A woman is not slicing a cucumber,dame shaving hawthorn,0.34559453,0.41417461175184983
Potatoes are being sliced by a man,sausage being cutter man,0.6974485,0.5553752730290095
A man is slicing potatoes,man shaving sausage,0.7293116,0.46767932176589966
There is no man slicing potatoes,man shaving sausage,0.27061144,0.46635324304754083
A potato is being sliced by the man,pie being cutter man,0.68275166,0.560834546883901
The man is not slicing a potato,man shaving pie,0.27785042,0.4520520120859146
A girl is playing a flute,dame playing flutter,0.5484315,0.487013117833571
There is no girl playing a flute,dame playing flutter,0.2373861,0.4794817964235942
A wind instrument is being played by a girl,air apparatus being playing dame,0.6334578,0.5258659550121852
A girl is playing a wind instrument,dame playing air apparatus,0.7128868,0.4858153679154136
A boy is playing a wind instrument,boy playing air apparatus,0.7551283,0.5618888410654935
A keyboard is being played by a person,key being playing man,0.33327484,0.5372150192658106
A person is playing a keyboard,man playing key,0.45820186,0.549975057442983
A person is not playing a keyboard,man playing key,0.24573137,0.5399431824684143
Someone is playing piano,man playing singing,0.33010823,0.42201994146619526
Someone is not playing piano,man playing singing,0.24734558,0.43602921813726425
A man is jumping into a pool,man climb pond,0.63527524,0.5782634794712067
A man is diving into a pool,man dip pond,0.6593475,0.5229828774929046
A woman is diving into a pool,dame dip pond,0.45652902,0.4253613352775574
A man is jumping out of a pool,man climb pond,0.6495625,0.5795203338969838
A man is diving into the water,man dip liquid,0.6712737,0.4675062716007233
The man is adding seasoning to the water in a bowl,man plus condiment liquid sack,0.6434089,0.48302701272462545
Seasoning is being added to the water by the man,condiment being plus liquid man,0.5787841,0.5239403949064367
The man is not adding seasoning to the/some water in a bowl,man plus condiment thing liquid sack,0.38649082,0.49291716710380884
The man is seasoning the sausages,man condiment sausage,0.8756382,0.5951178967952728
The man is seasoning the meat,man condiment meat,0.8870965,0.5574613538655367
The man is not seasoning the sausages,man condiment sausage,0.49362013,0.58551974938466
A man is playing a large flute,man playing magnitude flutter,0.37630463,0.5277634813235357
A large flute is being played by a man,magnitude flutter being playing man,0.4233881,0.5525937601923943
A man is playing a small flute,man playing bit flutter,0.42491552,0.5516276909754827
A woman is not peeling a potato,dame peel pie,0.28246677,0.4601842999458313
The lady is peeling the potato,dame peel pie,0.60584784,0.552487313747406
The potato is being peeled by the lady,pie being peel dame,0.6767763,0.5570996801058451
There is no lady peeling the potato,dame peel pie,0.3093914,0.5266643345355988
A man is riding a scooter,man ride motorboat,0.6295482,0.4930402159690857
A man is not riding a scooter,man ride motorboat,0.34207094,0.4868468533862721
A man is playing the instrument,man playing apparatus,0.8637945,0.5502050386534797
An octopus is being sliced by a woman,duck being cutter dame,0.45076138,0.5113680225152236
A woman is slicing an octopus,dame shaving duck,0.5721888,0.457851509253184
A woman is not slicing an octopus,dame shaving duck,0.2635895,0.4561370106843802
A man is not playing the drums,man playing clutches,0.34647286,0.5259402881969105
A man is putting some food in a box,man giving food bag,0.7949039,0.5597519140977126
A man is putting some food in a container,man giving food receptacle,0.88612497,0.5121347691331591
A man is removing some food from a box,man eliminate food bag,0.7712227,0.5573600347225482
The man is putting chicken into the box,man giving chicken bag,0.8091728,0.5656438916921616
The man is putting chicken into the container,man giving chicken receptacle,0.8957985,0.5210745884821966
The man is not putting chicken into the container,man giving chicken receptacle,0.3598325,0.5096829107829502
Eggs are being cracked into a bowl by a woman,chicken being crack sack dame,0.68296427,0.47908085584640503
A woman is cracking eggs into a bowl,dame crack chicken sack,0.6518301,0.418694427380195
A woman is taking eggs out of a bowl,dame takings chicken sack,0.6347609,0.4307335615158081
A woman is placing skewers onto a rack,dame position whiskers going rod,0.4049968,0.41302034457524617
Skewers are being placed onto a rack by a woman,clutches being position going rod dame,0.3956552,0.4511010897786994
There is no woman placing skewers onto a rack,dame position whiskers going rod,0.1675566,0.4512600563466549
A baby is playing a guitar,bit playing chorus,0.50066936,0.48876355754004586
A guitar is being played by a baby,chorus being playing bit,0.48063973,0.5120689372221628
A baby is not playing a guitar,bit playing chorus,0.19556844,0.4827768564224243
The little boy is singing and playing the guitar,bit boy singing playing chorus,0.7833876,0.5552652648517064
The little kid is singing and playing the guitar,bit bit singing playing chorus,0.7236397,0.5149320193699428
The little boy is not singing and playing the guitar,bit boy singing playing chorus,0.4669506,0.5493739008903503
A man is passionately playing a guitar in front of an audience,man passion playing chorus front audience,0.6687409,0.5523895527187147
A person is passionately playing a guitar in front of an audience,man passion playing chorus front audience,0.58560157,0.5461689547488564
A woman is passionately playing a guitar in front of an audience,dame passion playing chorus front audience,0.6133316,0.5046480486267492
A woman is peeling food,dame peel food,0.7424308,0.44309549778699875
A man is reading the email,man read mail,0.8613342,0.589420861668057
A person is reading the email,man read mail,0.7134094,0.5617568227979872
There is no man reading the email,man read mail,0.3392821,0.5544149875640869
Someone is checking the email,man examination mail,0.5980176,0.42808739840984344
Someone is reading the email,man read mail,0.7131842,0.496907077729702
Someone is not reading the email,man read mail,0.35019913,0.4938337670432197
Two baby pandas are playing,two bit monkey playing,0.67788744,0.4878862679004669
Two cubs are playing,two cattle playing,0.6205298,0.5479664131999016
Two baby pandas are sleeping,two bit monkey waken,0.47225493,0.4213591380552812
Two pandas are lying together,two monkey falsehood unite,0.47222856,0.42917245626449585
Two panda bears are lying together,two monkey oxen falsehood unite,0.4385116,0.3625057844015268
Two pandas are not lying together,two monkey falsehood unite,0.3843426,0.45455216864744824
Fish is being cooked by a woman,fish being fry dame,0.800656,0.5063426061110063
A woman is cooking fish,dame meal fish,0.7814782,0.4106656610965729
There is no woman cooking fish,dame meal fish,0.34331107,0.4269656605190701
A woman is frying fish,dame fry fish,0.8544291,0.47009796649217606
Fish is being fried by a woman,fish being fry dame,0.8432069,0.5251934582536871
A woman is not frying fish,dame fry fish,0.33115822,0.4752972788280911
A man is not playing a flute,man playing flutter,0.22386342,0.5686403065919876
A woman is playing the flute,dame playing flutter,0.53521484,0.5062924190001055
The flute is being played by a woman,flutter being playing dame,0.5491042,0.5265252334730965
A man is playing the flute,man playing flutter,0.41348314,0.5752909779548645
A boy is mowing the lawn,boy shaving grassland,0.8058934,0.5213407476743063
A guy is mowing the lawn,man shaving grassland,0.7820772,0.5079709738492966
There is no guy mowing the lawn,man shaving grassland,0.34917396,0.49136993518242467
Grass is being mowed by a man,grassland being cutter man,0.7298071,0.535446244936723
A man is mowing grass,man shaving grassland,0.80964607,0.47821165214885364
There is no man mowing grass,man shaving grassland,0.36944002,0.46625439325968426
A person is frying meat in a pan,man fry meat fry,0.89307934,0.5256489763657252
A person is frying food in a pan,man fry food fry,0.8585079,0.5139583895603815
A person is not frying meat in a pan,man fry meat fry,0.20884252,0.515662106183859
A skunk is being held by a person,muck being happening man,0.48003012,0.5086920133658818
A person is holding a skunk,man holder muck,0.51381147,0.5494431365620006
A person is not holding a skunk,man holder muck,0.28584778,0.5445608148972193
The lady is cracking an egg into a bowl,dame crack chicken sack,0.65804845,0.5082614336694989
The lady is cracking an egg into a dish,dame crack chicken meal,0.7099253,0.5356046419877273
The lady is taking an egg out of a bowl,dame takings chicken sack,0.6392049,0.5149184092879295
The man is cracking eggs into a bowl,man crack chicken sack,0.7306156,0.5040759719335116
The person is cracking eggs into a bowl,man crack chicken sack,0.65795887,0.5030587819906381
A man is cutting tomatoes,man cutter tomentum,0.42083573,0.40666171577241683
A man is slicing tomatoes,man shaving tomentum,0.5202585,0.4267588799650019
There is no man cutting tomatoes,man cutter tomentum,0.24077758,0.4538555324077606
Broccoli are being cut by a woman,coronach being cut dame,0.5102179,0.4389272133509318
A woman is not cutting broccoli,dame cutter broach,0.29434463,0.37147471904754636
A woman is cutting a lemon,dame cutter limo,0.22389108,0.4235696792602539
A woman is cutting fruit,dame cutter yield,0.37323844,0.3580370545387268
A man is cutting a lemon,man cutter limo,0.31834024,0.48377448982662624
A woman is firing a rifle,dame shooting rifle,0.8702073,0.4850364658567641
A woman is firing a weapon,dame shooting ammunition,0.78463984,0.4388207263416714
There is no woman firing a rifle,dame shooting rifle,0.35045952,0.49852375984191893
Guitar is being played by a man,music being playing man,0.7333984,0.49038340828635474
A woman is playing the drums,dame playing clutches,0.48383138,0.46287851929664614
A man is drawing on a digital dry erase board,man depiction computing froth delete table,0.5715218,0.46497371949647603
A man is drawing on a board,man depiction table,0.5278447,0.49404251033609564
A man is not drawing on a digital dry erase board,man depiction computing froth delete table,0.28939706,0.4699614316225052
A man is drawing some figures,man depiction depicting,0.5191773,0.3917362527413802
A person is drawing some figures,man depiction depicting,0.43192312,0.3627121123400601
A man is erasing some figures,man delete depicting,0.7347967,0.5099178660999645
A woman is cutting onions,dame cutter sausage,0.5485581,0.359918512403965
A woman is chopping onions,dame shaving sausage,0.6653625,0.3846743881702423
There is no woman cutting onions,dame cutter sausage,0.2830163,0.4218139383527968
A woman is slicing tofu,dame shaving sausage,0.64830816,0.41208718419075013
A woman is cutting tofu,dame cutter sausage,0.5270207,0.3891558051109314
A woman is not cutting tofu,dame cutter sausage,0.21522936,0.40816015005111694
A group of people are dancing at a concert,group human dancing chorus,0.7031436,0.5458336564210745
A group of people are dancing in a show,group human dancing show,0.8666345,0.5737597438005301
A group of people are not dancing at a concert,group human dancing chorus,0.22739418,0.536657805953707
A group of people are marching,group human walking,0.755774,0.5831241548061371
A group of people are walking,group human walking,0.9169204,0.5715813504325019
A group of people are standing,group human standing,0.9221905,0.5527543822924296
A man is working on the laptop,man job printer,0.4912378,0.4868893802165985
A man is working on the computer,man job computing,0.77846193,0.5058306634426117
There is no man working on the laptop,man job printer,0.22473747,0.4771700013767589
The man is feeding the snake with a mouse,man feeding monkey monkey,0.62005633,0.5783833357004019
The man is feeding the snake with an animal,man feeding monkey animal,0.69647515,0.5785185557145339
The man is not feeding the snake with a mouse,man feeding monkey monkey,0.42794523,0.5637667902878353
A boy is playing on a toy phone,boy playing play phone,0.8908357,0.5880858153104782
A boy is playing on a toy,boy playing play,0.86974436,0.5940593898296356
A girl is playing on a toy phone,dame playing play phone,0.7825495,0.4874517222245534
The man is aiming a gun,man purpose rifle,0.70922583,0.5368746982680427
The man is handling a gun,man processing rifle,0.68462324,0.5098117589950562
The man is drawing a gun,man depiction rifle,0.6065253,0.4789781093597412
A horse is being ridden by a girl,horse being ride dame,0.8231608,0.5535077040012066
A girl is riding a horse,dame ride horse,0.9122226,0.49453555213080513
There is no girl riding a horse,dame ride horse,0.44224864,0.4864616870880127
The girl is trotting on the horse,dame drubbing horse,0.71509045,0.4767463207244873
The person is trotting on the horse,man drubbing horse,0.6242275,0.5403836048566378
The boy is trotting on the horse,boy drubbing horse,0.7548058,0.5569648238328787
A man is breaking a slab of concrete with a sledge hammer,man breaking dull concrete sled whip,0.79215753,0.5933958668457834
A man is breaking a block of concrete with a sledge hammer,man breaking lock concrete sled whip,0.8679614,0.5787550869740938
There is no man breaking a slab of concrete with a sledge hammer,man breaking dull concrete sled whip,0.5367473,0.612181431055069
The man is using a sledgehammer to break a concrete block that is on another man,man use shackle break concrete lock alter man,0.81966615,0.5715385697506092
The man is using a sledgehammer to break a concrete block that is on another person,man use shackle break concrete lock alter man,0.82026446,0.5675858148822078
The woman is using a sledgehammer to break a concrete block that is on another man,dame use shackle break concrete lock alter man,0.687294,0.5289475167239154
A dog is barking at a ball,pet beating ball,0.7022679,0.5771251645955172
An animal is barking at a ball,animal beating ball,0.7753031,0.6200803464109247
There is no dog barking at a ball,pet beating ball,0.25156748,0.554649626215299
A dog is swimming after a tennis ball,pet sailing dancing ball,0.5633408,0.43650193015734357
A dog is swimming after a ball,pet sailing ball,0.54941356,0.4532251536846161
A cat is swimming after a tennis ball,pet sailing dancing ball,0.6045482,0.4426079988479614
A cupcake is being eaten by a girl,biscuit being eat dame,0.7449925,0.5168442477782568
A girl is eating a cupcake,dame eat biscuit,0.8234557,0.48849644925859237
A boy is eating a cupcake,boy eat biscuit,0.9052274,0.594609710905287
