OG_sentences,gen_sentences,cosine_similarity_BERT,jaccard_similarity_BERT
A group of kids is playing in a yard and an old man is standing in the background,group offspring playing porch yesteryear man standing groundwork,0.6994917,0.48784156441688536
A group of boys in a yard is playing and a man is standing in the background,group male porch playing man standing groundwork,0.76858675,0.5540132260322571
A group of children is playing in the house and there is no man standing in the background,group offspring playing home man standing groundwork,0.3092124,0.5550565366391782
The young boys are playing outdoors and the man is smiling nearby,young male playing outside man humour neighbourhood,0.87883866,0.5373768649603191
The kids are playing outdoors near a man with a smile,offspring playing outside proximity man humour,0.75896394,0.5039991471502516
There is no boy playing outdoors and there is no man smiling,boy playing outside man humour,0.2772182,0.5529513078577378
A brown dog is attacking another animal in front of the tall man in pants,pink pet assault alter animal front steep man hosiery,0.45494783,0.4656660327544579
A brown dog is attacking another animal in front of the man in pants,pink pet assault alter animal front man hosiery,0.36408237,0.45761962980031967
A brown dog is helping another animal in front of the man in pants,pink pet aid alter animal front man hosiery,0.39986646,0.46105213711659115
Two dogs are fighting,two pet fighting,0.8685069,0.4766678810119629
Two dogs are wrestling and hugging,two pet fighting embracing,0.8209421,0.5331695025617426
There is no dog wrestling and hugging,pet fighting embracing,0.2444251,0.5348381400108337
A person in a black jacket is doing tricks on a motorbike,man blacken jacket clutches motorboat,0.64622253,0.5196476663861956
A man in a black jacket is doing tricks on a motorbike,man blacken jacket clutches motorboat,0.72002184,0.5156430516924176
There is no man in a black jacket doing tricks on a motorbike,man blacken jacket clutches motorboat,0.38116682,0.5236271592703733
A person on a black motorbike is doing tricks with a jacket,man blacken motorboat clutches jacket,0.65997684,0.512594705536252
A skilled person is riding a bicycle on one wheel,savvy man ride wheel unit wheel,0.56745154,0.4729830473661423
A person is riding the bicycle on one wheel,man ride wheel unit wheel,0.5922101,0.45050194433757235
Nobody is riding the bicycle on one wheel,nix ride wheel unit wheel,0.26382583,0.39507482602046085
A man with a jersey is dunking the ball at a basketball game,man shirt dip ball baseball play,0.45815802,0.5851186573505401
The ball is being dunked by a man with a jersey at a basketball game,ball being dip man shirt baseball play,0.45360965,0.5975318032762279
There is no man dunking the ball at a basketball game,man dip ball baseball play,0.2603383,0.5407590936211979
The game of basketball consists of a ball being dunked by a man with a jersey,play baseball comprise ball being dip man shirt,0.448622,0.5738525462150573
A man who is playing dunks the basketball into the net and a crowd is in background,man playing dip baseball net crowd groundwork,0.5760596,0.5956721099523398
The player is dunking the basketball into the net and a crowd is in background,actor dip baseball net crowd groundwork,0.4277079,0.5571628057438395
The player is missing the basket and a crowd is in background,actor vanish bag crowd groundwork,0.60880995,0.5022086030558536
Two people are kickboxing and spectators are watching,two human kick audience seeing,0.80719984,0.557555878162384
Two people are fighting and spectators are watching,two human fighting audience seeing,0.9150091,0.561396062374115
Two people are kickboxing and spectators are not watching,two human kick audience seeing,0.5621977,0.5647071525454521
Two spectators are kickboxing and some people are watching,two audience kick human seeing,0.7572246,0.5483369417488575
Two young women are sparring in a kickboxing fight,two young dame fighting kick fighting,0.9034003,0.5084845647215843
Two women are sparring in a kickboxing match,two dame fighting kick correspond,0.75348485,0.4864229900496347
Two young women are not sparring in a kickboxing fight,two young dame fighting kick fighting,0.5017168,0.5191132250954124
Kids in red shirts are playing in the leaves,youth red shirt playing papers,0.73262596,0.5332501786095756
Children in red shirts are playing in the leaves,offspring red shirt playing papers,0.6538875,0.5083493749300639
Children in red shirts are sleeping in the leaves,offspring red shirt waken papers,0.29763222,0.458588182926178
Children covered by leaves are playing with red shirts,offspring covering papers playing red shirt,0.74094176,0.49576786905527115
Three boys are jumping in the leaves,two male climb papers,0.50578904,0.4488110704855485
Three kids are jumping in the leaves,two offspring climb papers,0.52552414,0.4298174132903417
Three kids are sitting in the leaves,two offspring sit papers,0.59002507,0.43070098757743835
Two children are lying in the snow and are drawing angels,two offspring falsehood fog depiction spirit,0.15680398,0.40838517248630524
Two children are lying in the snow and are making snow angels,two offspring falsehood fog manufacturing fog spirit,0.20249347,0.4201683061463492
There is no child lying in the snow and making snow angels,offspring falsehood fog manufacturing fog spirit,0.2757724,0.42758142948150635
Two angels are making snow on the lying children,two spirit manufacturing fog falsehood offspring,0.37386176,0.41263259158414956
Two people wearing snowsuits are on the ground making snow angels,two human wear nightclothes soil manufacturing fog spirit,0.4097992,0.46452083794966986
Two people in snowsuits are lying in the snow and making snow angels,two human nightclothes falsehood fog manufacturing fog spirit,0.33542937,0.45686769485473633
Nobody in snowsuits is lying in the snow and making snow angels,nix nightclothes falsehood fog manufacturing fog spirit,0.38004464,0.4371030703186989
A little girl is looking at a woman in costume,bit dame looking dame garment,0.5752517,0.5036472002665202
A young girl is looking at a woman in costume,young dame looking dame garment,0.72057134,0.5203240871429443
The little girl is looking at a man in costume,bit dame looking man garment,0.4010957,0.5479406634966533
A little girl in costume looks like a woman,bit dame garment seem like dame,0.70942086,0.4553605238596598
People wearing costumes are gathering in a forest and are looking in the same direction,folk wear apparel gathering wilderness looking orientate,0.7740513,0.5412808838097946
Masked people are looking in the same direction in a forest,covert human looking orientate wilderness,0.7172501,0.5051414025457281
People wearing costumes are scattering in a forest and are looking in different directions,folk wear apparel dissemination wilderness looking vary route,0.68135047,0.5159985770781835
People are looking at some costumes gathered in the vicinity of the forest,folk looking apparel gather vicinity wilderness,0.6933187,0.5518902596973237
A lone biker is jumping in the air,solo runner climb air,0.7744404,0.5528670946756998
"A biker is jumping in the air, alone",runner climb air solo,0.75699186,0.5683704431240375
There is no biker jumping in the air,runner climb air,0.3686759,0.5487405820326372
A man is jumping into an empty swimming pool,man climb empty sailing pond,0.6997303,0.5415125318935939
A man is jumping into an empty pool,man climb empty pond,0.6800145,0.5728829950094223
A man is jumping into a full pool,man climb perfect pond,0.5754059,0.5562026153008143
The man's jumper is in the empty pool,man runner empty pond,0.7480215,0.597724267414638
Four kids are doing backbends in the park,quarter offspring back paseo,0.12428549,0.41761860450108845
Four children are doing backbends in the park,quarter offspring back paseo,0.12801546,0.4275816440582275
Four children are doing backbends in the gym,quarter offspring back workshop,0.12314187,0.44639861583709717
Four girls are doing backbends and playing in the garden,quarter dame back playing grassland,0.6288257,0.47670187883906895
Four girls are doing backbends and playing outdoors,quarter dame back playing outside,0.63441837,0.5049373706181844
Four girls are doing backbends and playing indoors,quarter dame back playing inwardness,0.29448098,0.4454626335817225
A man who is playing is running with the ball in his hands,man playing running ball hands,0.93329513,0.6431588662995232
A player is running with the ball,actor running ball,0.828188,0.5525245904922486
A player is throwing the ball,actor throw ball,0.7531476,0.5389073226186964
Two groups of people are playing football,two group human playing ballgame,0.4991408,0.44441984249995303
Two teams are competing in a football match,two team rival ballgame correspond,0.47183365,0.4490925541945866
Two teams are competing in a baseball game,two team rival baseball play,0.8790428,0.535135608453017
Football is being played by two competing teams,golf being playing two rival team,0.5872673,0.4835192390850612
Five children are standing in front of a wooden hut,quarter offspring standing front wood stump,0.6822847,0.41592850618892246
Five children are standing in front of a hut made of wood,quarter offspring standing front stump create wood,0.6944871,0.4341824934596107
Five children are standing in a wooden hut,quarter offspring standing wood stump,0.6026279,0.3767947276433309
Five wooden stands are in front of each child's hut,quarter wood stand front offspring stump,0.57295704,0.44253514111042025
Five kids are standing close together and one kid has a gun,quarter offspring standing close unite unit bit rifle,0.51235825,0.3748726305507478
Five kids are standing close together and one kid has a weapon,quarter offspring standing close unite unit bit ammunition,0.4332429,0.3887978224527268
Five kids are standing close together and none of the kids has a gun,quarter offspring standing close unite nix offspring rifle,0.20818505,0.3735886986056964
An old man is sitting in a field,yesteryear man sit grassland,0.85706097,0.4423705498377482
A man is sitting in a field,man sit grassland,0.93984526,0.5570424470034513
A man is running in a field,man running grassland,0.93779635,0.5491045875982805
A person is wearing a hat and is sitting on the grass,man wear coat sit grassland,0.7666013,0.5823812716537051
A person is sitting in a field and is wearing a hat,man sit grassland wear coat,0.8142011,0.5701721939775679
There is no person wearing a hat and sitting on the grass,man wear coat sit grassland,0.3872428,0.5436020725303226
A person is sitting and wearing a grass hat,man sit wear grassland coat,0.77307785,0.5292776624361674
The current is being ridden by a group of friends in a raft,current being ride group friendship rod,0.49805695,0.5983529806137085
A group of friends are riding the current in a raft,group friendship ride current rod,0.4871536,0.5642709881067276
A group is not riding the current in a raft,group ride current rod,0.35708618,0.5786673682076591
This group of people is practicing water safety and wearing preservers,group human executing liquid secure wear savior,0.593219,0.42695621081760954
Preservers are being worn by a group of people who are practicing water safety,savior being wear group human executing liquid secure,0.49536535,0.5067535901069641
Nobody is practicing water safety and wearing preservers,nix executing liquid secure wear savior,0.17649075,0.36950162579031554
A deer is jumping over a fence,goat climb fence,0.520338,0.5519314348697663
A deer is jumping over the enclosure,goat climb enclosure,0.44520417,0.5572714924812316
A deer isn't jumping over the fence,goat climb fence,0.41504627,0.567658265431722
A wild deer is jumping a fence,wilderness goat climb fence,0.521078,0.5433345491235907
A deer is jumping a fence,goat climb fence,0.5654431,0.5648157331678603
There is no deer jumping fences,goat climb fence,0.39292392,0.5407002329826355
People are walking outside a building that has many murals on it,folk walking outside building plenty mural,0.6898175,0.5882449683390165
People are walking outside the building that has several murals on it,folk walking outside building plenty mural,0.6822978,0.5831290859925119
People are walking inside a building that has many murals on it,folk walking inwardness building plenty mural,0.49976882,0.50056163753782
Several people are in front of a building which is covered by colors,plenty human front building covering color,0.5614271,0.5712660990263286
Several people are in front of a colorful building,plenty human front color building,0.60675097,0.5093598919255393
Nobody is in front of the colorful building,nix front color building,0.28530124,0.4965425779422124
A boy is hitting a baseball,boy beating baseball,0.83133614,0.6284613410631815
A child is hitting a baseball,offspring beating baseball,0.75284016,0.503223317861557
A child is missing a baseball,offspring vanish baseball,0.68687075,0.43973865834149445
A family is watching a little boy who is hitting a baseball,family seeing bit boy beating baseball,0.80144036,0.6231979197925992
A family is watching a boy who is hitting a baseball,family seeing boy beating baseball,0.8197361,0.6446466781198978
A family is watching a little boy who is missing a baseball,family seeing bit boy vanish baseball,0.7952068,0.575750752499229
A little boy is watching a family that is hitting a baseball,bit boy seeing family beating baseball,0.80552316,0.6297678748766581
A large group of Asian people is eating at a restaurant,magnitude group ethnos human eat restaurant,0.7025178,0.4198806087176005
A group of people from Asia is eating at a restaurant,group human story eat restaurant,0.822318,0.4860324561595917
A small group of people is waiting to eat in a restaurant,bit group human await eat restaurant,0.80704296,0.5459743330353185
A group of people in a large Asian restaurant is eating,group human magnitude ethnos restaurant eat,0.7605827,0.42391685644785565
Various people are eating at red tables in a crowded restaurant with purple lights,vary human eat red table crowd restaurant pink illumination,0.78104395,0.4870491499702136
Various customers are eating in a crowded restaurant with purple lights,vary customer eat crowd restaurant pink illumination,0.72621125,0.49089408548254715
Few people are eating at red tables in a restaurant without lights,human eat red table restaurant idle illumination,0.8357165,0.4981844246387482
A purple crowd of people is eating on various red lit restaurant tables,pink crowd human eat vary red illumination restaurant table,0.7578056,0.4967817715976549
A motorcycle rider is standing up on the seat of a white motorcycle,motorboat runner standing sit belie motorboat,0.40397537,0.47804597291079437
A motorcycle is riding standing up on the seat of the vehicle,motorboat ride standing sit vehicle,0.5496576,0.5525709489981333
No motorcycle rider is standing up on the seat of a motorcycle,motorboat runner standing sit motorboat,0.45765007,0.4937705428976762
Someone is on a black and white motorcycle and is standing on the seat,man blacken belie motorboat standing sit,0.5189694,0.5002465429513351
A rider is on a black and white bike and is standing on the seat,runner blacken belie bike standing sit,0.6653756,0.5470206011896548
Nobody is on a motorcycle and is standing on the seat,nix motorboat standing sit,0.3968009,0.46350790932774544
A motorcyclist is riding a motorbike dangerously along a roadway,motorboat ride motorboat endanger accompany motorway,0.71780014,0.4882036018371582
A motorcyclist is riding a motorbike along a roadway,motorboat ride motorboat accompany motorway,0.6777426,0.5074112330164228
There is no motorcyclist riding a motorbike along a roadway,motorboat ride motorboat accompany motorway,0.2882144,0.5036364902149547
A man with a helmet painted red is riding a blue motorcycle down the road,man coat coloring red ride blue motorboat road,0.7935015,0.5274207616845766
A motorcyclist with a red helmet is riding a blue motorcycle down the road,motorboat red coat ride blue motorboat road,0.80098885,0.5311473774909973
A motorcyclist without a helmet is waiting on a blue motorcycle near the road,motorboat idle coat await blue motorboat proximity road,0.75253963,0.48147732460940323
A dog is catching a stick in the air and another is watching,pet seizing rod air alter seeing,0.53495467,0.48452063500881193
A dog is leaping high in the air and another is watching,pet swing steep air alter seeing,0.49090648,0.47639358671087967
There is no dog leaping in the air,pet swing air,0.25000882,0.49678418536980945
Two dogs are playing by a tree,two pet playing wood,0.6285623,0.5399075529792092
Two dogs are playing by a plant,two pet playing plant,0.715131,0.5347184484655206
Two dogs are sleeping by a tree,two pet waken wood,0.3052153,0.4623938997586568
A girl in white is dancing,dame belie dancing,0.74887633,0.44124557375907897
A girl is wearing white clothes and is dancing,dame wear belie clothing dancing,0.79256445,0.45209403038024903
There is no girl in white dancing,dame belie dancing,0.38213503,0.4476100910793651
The dancer is dancing in front of the sound equipment,dancing dancing front audio apparatus,0.9071113,0.5788048148155213
The blond girl is dancing in front of the sound equipment,pink dame dancing front audio apparatus,0.7216511,0.5358803377431982
The blond girl is dancing behind the sound equipment,pink dame dancing back audio apparatus,0.6767293,0.4951581915219625
The equipment in front of the blond dancing girl is sound,apparatus front pink dancing dame audio,0.6256099,0.5534498481189504
The children of a family are patiently playing and waiting,offspring family tolerate playing await,0.7346155,0.5083367040282801
The children of a family are playing and waiting,offspring family playing await,0.8594756,0.5180506149927775
There are no children playing and waiting,offspring playing await,0.20347732,0.45323002835114795
Three Asian kids are dancing and a serious man is looking,two ethnos offspring dancing tough man looking,0.6602622,0.40574893057346345
Three Asian kids are dancing and a man is looking,two ethnos offspring dancing man looking,0.76579154,0.40349647733900285
Three Asian kids are dancing and there is no man looking,two ethnos offspring dancing man looking,0.52113444,0.4172866469935367
An Asian man is dancing and three kids are looking,ethnos man dancing two offspring looking,0.79679286,0.4121166567007701
A woman is wearing an Egyptian hat on her head,dame wear epic coat header,0.5910256,0.4928901195526123
A woman is wearing an Egyptian headdress,dame wear epic header,0.55641997,0.5005691001812617
A woman is wearing an Indian headdress,dame wear national header,0.5469794,0.45041514933109283
An Egyptian is wearing a woman's headdress,epic wear dame header,0.48297274,0.5460540567125592
The woman is wearing glasses and a black headdress,dame wear glass blacken header,0.77571213,0.4827108792960644
The woman with a black hat is wearing sunglasses,dame blacken coat wear glass,0.7074957,0.4417119781176249
The woman is not wearing glasses or a headdress,dame wear glass header,0.3500756,0.45551516328539166
The black woman is wearing glasses over the headdress,blacken dame wear glass header,0.73635244,0.5115194320678711
A hiker is on top of the mountain and is doing a joyful dance,traveller overtop mountain joy dance,0.8184031,0.5892753108688022
A hiker is on top of the mountain and is dancing,traveller overtop mountain dancing,0.9028248,0.5693177514606051
There is no hiker dancing on top of the mountain,traveller dancing overtop mountain,0.51595724,0.5387231953003827
A man is on a rock high above some trees and is standing in an uncomfortable position,man rock steep wood standing displease position,0.7768741,0.5088630524965433
A man is on a rock high above some trees and is standing in a strange position,man rock steep wood standing stranger position,0.75818825,0.5550546099742254
There is no man on a rock high above some trees standing in a strange position,man rock steep wood standing stranger position,0.64461076,0.5494127143984255
A cowgirl is riding a brown horse and is cornering a barrel,feline ride pink horse angle ball,0.6226897,0.5552200050581069
A cowgirl is riding a horse and corners a barrel,feline ride horse angle ball,0.6768564,0.5430025423274321
A cowboy is riding a horse and cornering a barrel,bovid ride horse angle ball,0.75842535,0.5388953019590939
A cowgirl is riding a barrel near a horse in the corner,feline ride ball proximity horse angle,0.538435,0.5482994824647903
The brown horse is very near a red barrel at the rodeo,pink horse proximity red ball racehorse,0.553535,0.5089534521102905
The brown horse is near a red barrel at the rodeo,pink horse proximity red ball racehorse,0.53855085,0.4966422981686062
The brown horse is far from a red barrel at the rodeo,pink horse outside red ball racehorse,0.4137401,0.5002517010036268
A boy is standing in the cold water,boy standing cold liquid,0.83276343,0.5744775434335073
A boy is standing in the water,boy standing liquid,0.7876165,0.5429404854774476
A boy is standing outside the water,boy standing outside liquid,0.9315635,0.5376101136207581
The kid is swimming through the blue ocean,bit sailing blue seafarer,0.57252717,0.41806074125426157
The boy is wading through the blue ocean,boy wander blue seafarer,0.7706388,0.5118429064750671
The boy is sitting near the blue ocean,boy sit proximity blue seafarer,0.84313285,0.45745900869369505
A skilled man is playing a guitar on stage,savvy man playing chorus stage,0.6271341,0.5258764411721911
A man is playing a guitar on stage,man playing chorus stage,0.65893114,0.5202078372240067
There is no man playing a guitar on stage,man playing chorus stage,0.31134298,0.5050357580184937
A person has blonde and flyaway hair and is playing a guitar,man pink fly hair playing chorus,0.4663002,0.5307168458637438
A guitarist has blonde and flyaway hair,musician pink fly hair,0.5569378,0.5141063630580902
A bald person is playing a guitar,dull man playing chorus,0.51849645,0.5095776969736273
Several children are sitting down and have their knees raised,plenty offspring sit leg raise,0.56752366,0.5062553398311138
Several children are lying down and are raising their knees,plenty offspring falsehood rising leg,0.25487426,0.4479489712154164
Several children are standing up,plenty offspring standing,0.6998633,0.42838793992996216
Two young girls are sitting on the ground,two young dame sit soil,0.7720352,0.5295657653074998
Two girls are sitting on the ground,two dame sit soil,0.72559047,0.5036711584437977
Two girls are lying on the ground,two dame falsehood soil,0.3649268,0.4222770531972249
A nude lady is walking in front of many people in body paint,empty dame walking front plenty human organism coloring,0.6637822,0.5196283828644526
A nude lady is walking in front of a crowd in body paint,empty dame walking front crowd organism coloring,0.6768079,0.5558503419160843
There is no lady walking in body paint in front of a crowd ,dame walking organism coloring front crowd,0.31596285,0.5683175043055886
A nude crowd in body paint is walking in front of a lady ,empty crowd organism coloring walking front dame,0.6975845,0.5569675862789154
"A young, topless woman is covered in paint",youth overtop dame covering coloring,0.37649706,0.5146344713866711
A topless girl is covered in paint,overtop dame covering coloring,0.4576071,0.5039311922513522
"An old, topless woman is covered in paint",yesteryear overtop dame covering coloring,0.4344373,0.4559953146510654
A group of people is near the ocean,group human proximity seafarer,0.74452996,0.4402078262397221
A crowd of people is near the water,crowd human proximity liquid,0.7567594,0.49929073452949524
A crowd of people is far from the water,crowd human outside liquid,0.60893023,0.5178102988463181
A group of children in uniforms is standing at a gate and one is kissing the mother,group offspring apparel standing door unit licking mother,0.6055162,0.5328346777845312
A group of children wearing the same clothes is waiting at a gate and one is kissing the mother,group offspring wear clothing await door unit licking mother,0.61700773,0.5234566688537597
A group of children in uniforms is standing at a gate and there is no one kissing the mother,group offspring apparel standing door unit licking mother,0.39860833,0.550059032851252
A group of mothers in uniforms is standing near the children and one is kissing the gate,group mother apparel standing proximity offspring unit licking door,0.6599219,0.5176101412091937
A man is in a parking lot and is playing tennis against a large wall,man stopover plenty playing dancing magnitude wall,0.44280532,0.47692104007886804
A lone man is in a parking lot and is playing tennis against a large wall,solo man stopover plenty playing dancing magnitude wall,0.5140757,0.47712125778198244
A man is in a parking lot and is playing tennis against a friend,man stopover plenty playing dancing friendship,0.45427802,0.4655022167024158
A man is pointing at a silver sedan,man depicting money hereafter,0.27725756,0.42770957946777344
A man is pointing at a car,man depicting car,0.8704112,0.5423178239302202
There is no man pointing at a car,man depicting car,0.3587259,0.4936896860599518
A group of people is on a beach,group human edge,0.42471176,0.48415450074455957
A group of people is near the sea,group human proximity seafarer,0.7978451,0.43413049834115164
A group of people is on a mountain,group human mountain,0.81135917,0.5945866866545244
"A man, a woman and two girls are walking on the beach",man dame two dame walking edge,0.41056007,0.41949933453610067
Four people are walking on the beach,quarter human walking edge,0.34779322,0.41994018988175824
"A man, a woman and two girls are sitting on the beach",man dame two dame sit edge,0.38366544,0.40667745941563654
