OG_sentences,gen_sentences,cosine_similarity_BERT,jaccard_similarity_BERT
A dog is pushing a toddler into a rain puddle,pet pushing youth rainfall muck,0.73404086,0.49990508953730267
A dog is pushing a toddler into a puddle of rain,pet pushing youth muck rainfall,0.73808527,0.5185985031880831
A dog is pulling a toddler out of a rain puddle,pet pulling youth rainfall muck,0.7097787,0.5162635822045175
The dog is knocking a boy into the water,pet beating boy liquid,0.6818558,0.5265029285635267
A boy is being knocked into the water by the dog,boy being beating liquid pet,0.68543196,0.5289909243583679
The dog is not knocking the boy into the water,pet beating boy liquid,0.39454037,0.5133796811103821
A boy is knocking a dog with a bottle of water,boy beating pet bottle liquid,0.80324423,0.5740800394731409
A man is hungrily eating a bowl of cereal,man longing eat sack fodder,0.57486093,0.489720387591256
A man is eating a bowl of cereal,man eat sack fodder,0.6565419,0.49517531054360525
There is no man eating a bowl of cereal,man eat sack fodder,0.29467207,0.48678142627080284
Cereal is being eaten by the man,fodder being eat man,0.62390256,0.5483085742363563
The man is eating cereal,man eat fodder,0.62502635,0.4974009063508775
There is no man eating cereal,man eat fodder,0.25682804,0.4727218747138977
A man is strumming the guitar,man drubbing chorus,0.4178636,0.47609602029506976
A man is packing away the guitar,man packaging outside chorus,0.4106772,0.4573567888953469
The man is playing the flute,man playing flutter,0.37364843,0.5832585909149863
The person is playing the flute,man playing flutter,0.26076356,0.5672364722598683
The man in not playing the flute,man playing flutter,0.3038603,0.5839196443557739
There is no woman adding spices to some meat,dame plus condiment meat,0.36892182,0.4689488240650722
A woman is adding spices to some meat,dame plus condiment meat,0.6720353,0.4373764716661893
The woman is adding sugar to the meat slowly,dame plus dessert meat slow,0.6263401,0.4679705628326961
The woman is adding sugar to the meat,dame plus dessert meat,0.6044591,0.4686836550633113
The woman is not adding sugar to the meat,dame plus dessert meat,0.28042004,0.46233848425058216
A dog is biting a can,pet rubbing,0.44845557,0.5027371227741242
A can is being bitten by a dog,being beating pet,0.6445658,0.5437742363322865
A dog is dropping a can,pet downfall,0.48738918,0.4477401044633653
A dog is opening a can of food,pet revealing food,0.6580021,0.5190663987940008
A dog is opening a jar of food,pet revealing sack food,0.65317273,0.4872204065322876
A dog is closing a can of food,pet close food,0.5459721,0.5257775241678412
A cat is playing with a watermelon,pet playing hawthorn,0.3701837,0.514115497469902
One cat is playing with a watermelon,unit pet playing hawthorn,0.2832467,0.45355846790167004
There is no cat playing with a watermelon,pet playing hawthorn,0.21497989,0.5119477877250085
The cat is playing passionately with a watermelon,pet playing passion hawthorn,0.37713367,0.5357972423235575
The cat is playing with a watermelon,pet playing hawthorn,0.36269844,0.5223953624566396
The cat isn't playing with a watermelon,pet playing hawthorn,0.23046467,0.5247821807861328
The boy is playing a guitar,boy playing chorus,0.5086092,0.5284331440925598
A boy is playing a guitar,boy playing chorus,0.54875344,0.5269003444247775
There is no boy playing a guitar,boy playing chorus,0.20235509,0.495620334148407
A teenager is playing the guitar,youth playing chorus,0.5082941,0.5016482339964973
A kid is playing a guitar,bit playing chorus,0.50500286,0.47715066538916695
A kid is putting the guitar away,bit giving chorus outside,0.23493233,0.4591300054029985
A woman is wakeboarding on a lake,dame sailing pond,0.6220991,0.47522247379476373
One woman is wakeboarding on the lake,unit dame sailing pond,0.5418847,0.4104299197594325
A woman is watching the lake,dame seeing pond,0.67483795,0.472377876440684
The woman is waterskiing fearlessly,dame watercraft fearlessness,0.663059,0.4656934142112732
The woman is waterskiing,dame watercraft,0.53481483,0.48175891240437824
The woman is not waterskiing,dame watercraft,0.39572644,0.4610057234764099
Someone is banging the lens of a camera against a nail,man beating glass photograph knot,0.5836749,0.5323070217581356
Someone is banging a camera lens against a nail,man beating photograph glass knot,0.58323157,0.507648503780365
There is no one banging a camera lens against a nail,unit beating photograph glass knot,0.17984998,0.5098405410261715
Someone is nailing a camera lens with loud bangs,man lacing photograph glass tough whiskers,0.47894344,0.4475408395131429
A camera is being hammered onto the nail by the man,photograph being shot going knot man,0.5896806,0.5357108182377286
The man is hammering a nail with a camera,man beating knot photograph,0.6621808,0.5470824071339199
The man is not hammering a nail with a camera,man beating knot photograph,0.24361806,0.5395561695098877
The camera man is nailing a hammer to the wall,photograph man lacing whip wall,0.62943816,0.5383877649026758
A person is slicing an onion,man shaving sausage,0.5825707,0.5007192058996721
A person is cutting an onion,man cutter sausage,0.5275223,0.4778928558031718
A person near an onion has a cut,man proximity sausage cut,0.49514878,0.5384293595949808
One person is cutting an onion,unit man cutter sausage,0.5289062,0.4040274441242218
There is no person cutting an onion,man cutter sausage,0.13739063,0.4879849374294281
A person is eating a cut onion,man eat cut sausage,0.75036633,0.5426371368494901
A person is wrapping up an onion,man wrapping sausage,0.6752666,0.5758088767528534
The oriental lady is cutting a carrot into thin pieces,orientate dame cutter sausage gentle fraction,0.51057136,0.4745811995337991
The oriental lady is cutting a carrot into pieces that are thin,orientate dame cutter sausage fraction gentle,0.51352584,0.5211552914820219
The oriental lady is not cutting a carrot into thin pieces,orientate dame cutter sausage gentle fraction,0.23723218,0.4863588909308116
A thin lady is piecing together oriental carrot cuts,gentle dame parcelling unite orientate sausage incision,0.5638602,0.4341904580593109
A man is pouring a plate of shredded cheese into a pot of sauce,man pour table breaking sausage sack sauce,0.8122872,0.5523386390312858
A man is pouring a plate of cheese which is shredded into a pot of sauce,man pour table sausage breaking sack sauce,0.8414705,0.5776802706718445
A man is taking a plate of shredded cheese off of a pot of sauce,man takings table breaking sausage sack sauce,0.82527035,0.549736328125
A man is pouring a pot of cheese sauce into a shredded plate,man pour sack sausage sauce breaking table,0.77534235,0.5507123307748274
The woman is adding cheese to the sauce,dame plus sausage sauce,0.5895901,0.513205940524737
The lady is adding cheese to the sauce,dame plus sausage sauce,0.60358965,0.553438221414884
The woman is removing cheese from the sauce,dame eliminate sausage sauce,0.6393391,0.5299626439809799
Some cameras are being burned by a person with a blow torch,photograph being burning man blow flame,0.84150743,0.5073874090847216
A person is burning some cameras with a blow torch,man burning photograph blow flame,0.84119713,0.5159929171204567
A person is repairing some cameras with a blow torch,man repair photograph blow flame,0.77247524,0.5531764977118548
A person by some cameras is blowing on a burning torch,man photograph blow burning flame,0.82509184,0.530466658227584
The tall person is setting fire to the cameras,steep man setting fire photograph,0.774758,0.5117078253201076
The person is setting fire to the cameras,man setting fire photograph,0.76781577,0.519057626525561
There is no person setting fire to the cameras,man setting fire photograph,0.20529823,0.47697600493064296
One man is playing the guitar,unit man playing chorus,0.51708007,0.42722356915473936
The man is playing an acoustic guitar,man playing audio chorus,0.42713788,0.5076992891051553
The man is playing a guitar which is acoustic,man playing chorus audio,0.44715065,0.5336012519322909
The man isn't playing an acoustic guitar,man playing audio chorus,0.29442838,0.5150705209145179
A person is cutting an onion into pieces,man cutter sausage fraction,0.52804524,0.4570685625076294
A person is dicing an onion,man licking sausage,0.5717313,0.5618533968925477
A person is piecing together an onion,man parcelling unite sausage,0.56446475,0.5080431745602534
A person is slicing a carrot into pieces,man shaving sausage fraction,0.5196826,0.49072766304016113
A carrot is being sliced into pieces by a person,sausage being cutter fraction man,0.48110977,0.536196521917979
There is no person slicing a carrot into pieces,man shaving sausage fraction,0.1659679,0.5011614878972371
The man is slicing a potato,man shaving pie,0.6813446,0.453455079685558
The person is carefully slicing a potato,man attention shaving pie,0.6480428,0.47439658641815186
The man is wrapping a potato,man wrapping pie,0.78335375,0.5602248112360636
The man is cooking slices of potato,man meal sliver pie,0.8035567,0.44284090399742126
The man is slicing the potato,man shaving pie,0.6890124,0.4564084844155745
The person is slicing the potato,man shaving pie,0.6039614,0.4688481959429654
The man is not slicing the potato,man shaving pie,0.33650923,0.45151229202747345
Somebody is cutting a tomato,man cutter tomentum,0.30528164,0.4428857147693634
Someone is cutting a tomato,man cutter tomentum,0.2905712,0.40255773729748195
There is no one cutting a tomato,unit cutter tomentum,0.13158429,0.45623249357396906
The lady is slicing a tomato,dame shaving tomentum,0.36823744,0.48033276696999866
The woman is slicing a tomato,dame shaving tomentum,0.35464674,0.43548912306626636
The woman is holding a whole tomato,dame holder perfect tomentum,0.23791614,0.4498617599407832
A man is preparing some dish,man preparation meal,0.88080543,0.5145399769147238
A man is preparing a dish,man preparation meal,0.87121624,0.5375247332784865
A man is cleaning a dish,man cleansing meal,0.86864996,0.5448219577471415
The woman is slicing an onion with a knife,dame shaving sausage cutter,0.6101723,0.4294894337654114
An onion is being sliced with a knife by the woman,sausage being cutter cutter dame,0.5189899,0.4833413064479828
The woman is not slicing an onion with a knife,dame shaving sausage cutter,0.27454877,0.4328479953110218
Some runners are competing in a race,runner rival breed,0.6491648,0.462001770734787
Runners are competing in a race,runner rival breed,0.6477175,0.52569537030326
Runners are not taking part in the race,runner takings part breed,0.26594543,0.4672401868380033
Runners are racing in a competition,runner racehorse rival,0.673096,0.47784053683280947
The runners are racing impetuously around a track,runner racehorse brute besiege track,0.70270133,0.49121304820565614
The runners are racing around a track,runner racehorse besiege track,0.7515619,0.4557350186201242
The runners are not racing around a track,runner racehorse besiege track,0.37237832,0.45673811009952
A man is racing,man racehorse,0.6443215,0.46903131689344135
A man is running,man running,0.9901699,0.6041808029015859
A man is standing still,man standing still,0.99077666,0.5805549323558807
A man is running down the road,man running road,0.94044554,0.6039964020252228
One man is running down the road,unit man running road,0.87332684,0.5026256225325845
There is no man running down the road,man running road,0.41985115,0.563061838800257
The keyboard is being played with his nose by a man,key being playing mouth man,0.5402338,0.5858928970992565
A man is playing the keyboard with his nose,man playing key mouth,0.54188704,0.5861450983927801
A man is idling,man flowing,0.6265394,0.5891664028167725
A man at the keyboard is playing with his nose,man key playing mouth,0.5651392,0.5839712406907763
The man is funnily playing the piano with his nose,man humour playing singing mouth,0.54363847,0.5627210550010204
The man is playing the piano with his nose,man playing singing mouth,0.40387845,0.5715334369586065
There is no man playing the piano with his nose,man playing singing mouth,0.18374065,0.5378258100577763
A baby rhino is following an adult rhino,bit feline following adulthood feline,0.32854736,0.4736023181014591
"A rhino, which is little, is following an adult rhino",oxen bit following adulthood feline,0.38868272,0.5419070666486566
A baby rhino is shunning an adult rhino,bit feline evasion adulthood feline,0.35959232,0.46222064197063445
A baby and an adult are being followed by a rhino,bit adulthood being following feline,0.35959548,0.5161368501813788
"A rhino, which is a youngling, is walking around a pen with its mother",oxen youth walking besiege penning mother,0.5239969,0.5842516422271729
A baby rhino is walking around a pen with its mother,bit feline walking besiege penning mother,0.50674975,0.4851847092310588
A baby rhino and its mother are standing in a pen,bit feline mother standing penning,0.39494598,0.5276121810862893
A mother is giving the baby a pen with a walking rhino on it,mother giving bit penning walking feline,0.55525184,0.5597135683764582
A man is riding a motorcycle,man ride motorboat,0.7142204,0.4986152648925781
A man is getting off the motorcycle,man getting motorboat,0.67462355,0.5228169614618475
A man is dangerously riding a motorcycle through a town,man endanger ride motorboat municipality,0.61516464,0.4570616044496235
A man is riding a motorcycle through the town,man ride motorboat municipality,0.6310665,0.4567001541455587
There is no man riding a motorcycle through the town,man ride motorboat municipality,0.3692711,0.47540998458862305
A group of people is singing,group human singing,0.91029894,0.5745055807961358
A few people are singing,human singing,0.79837286,0.5214771287781852
A group of people is silent,group human hush,0.61355186,0.5018012046813964
Some people are singing,human singing,0.79754436,0.4775830606619517
Some persons are singing,human singing,0.839695,0.4700208902359009
Some people are silent,human hush,0.6859318,0.3608143499919346
A man is playing a trumpet brightly,man playing thump glow,0.4862044,0.571090144770486
A man is playing a trumpet,man playing thump,0.4081148,0.5735982981595126
A man is putting a trumpet away,man giving thump outside,0.44136587,0.5248528122901917
The man is playing a guitar,man playing chorus,0.5254542,0.5166676176918877
A guitar is being played by the man,chorus being playing man,0.5006758,0.5291124929984411
The man is not playing a guitar,man playing chorus,0.25561583,0.49877525568008424
One man is dancing,unit man dancing,0.89400053,0.473900352205549
A man is motionless,man immovable,0.82303154,0.4931195312076145
A man is speaking,man speech,0.8919238,0.5552826623121897
A man is silent,man hush,0.68601644,0.5039110694612775
A man is carefully climbing a rope,man attention climb rope,0.9034172,0.5177534981207415
A man is climbing a rope,man climb rope,0.9691497,0.5971662203470866
A man is untying a rope,man eliminate rope,0.6346081,0.6100335061550141
A man is being roped before a climb,man being rope climb,0.877385,0.5882174189274127
One panda is climbing,unit monkey climb,0.7191918,0.426672773701804
A panda is climbing,monkey climb,0.69165355,0.5195123652617136
There is no panda climbing,monkey climb,0.34545586,0.5137707931654794
A woman is dancing beautifully in a cage,dame dancing goody enclosure,0.6530292,0.4288467443906344
A woman is dancing in a cage,dame dancing enclosure,0.6841785,0.4914635956287384
There is no woman dancing in a cage,dame dancing enclosure,0.34167454,0.5037879618731412
A woman is being caged for the dance,dame being enclosure dance,0.703593,0.541797610429617
The woman is dancing,dame dancing,0.87719953,0.5312918523947397
The lady is dancing,dame dancing,0.8864368,0.5931049187978109
The woman is not dancing,dame dancing,0.34666488,0.5016207865306309
Four people are floating on a raft,quarter human flowing rod,0.35476476,0.4516288529742848
A few people are floating on a raft,human flowing rod,0.4858455,0.4726695580915971
Nobody is floating on a raft,nix flowing rod,0.2110166,0.42418909735149807
People are riding and paddling a raft,folk ride sailing rod,0.64643604,0.5346263895432154
Some persons are riding and paddling a raft,human ride sailing rod,0.612637,0.4838234598820026
People are not riding and paddling a raft,folk ride sailing rod,0.3041757,0.5295911202063928
People are paddling near a raft that is being ridden,folk sailing proximity rod being ride,0.67711926,0.5587024324470096
A cat is eagerly eating corn on the cob,pet fervor eat cornucopia cube,0.6370877,0.43414337436358136
A cat is eating corn on the cob,pet eat cornucopia cube,0.6826258,0.44860272322382244
There is no cat eating corn on the cob,pet eat cornucopia cube,0.3564815,0.46271437803904214
A cat is eating some corn,pet eat cornucopia,0.59276414,0.40920709479938855
The cat is eating some corn,pet eat cornucopia,0.5972997,0.41292817484248767
A cat is walking away from some corn,pet walking outside cornucopia,0.41374514,0.43398602519716534
Someone is slicing a tomato,man shaving tomentum,0.39286008,0.40919737924229016
Nobody is slicing a tomato,nix shaving tomentum,0.22797209,0.3642034476453608
The person is quickly slicing a vegetable,man quicken shaving vegetation,0.6634146,0.4808126986026764
The person is slicing a vegetable,man shaving vegetation,0.58894706,0.5234022844921459
The person isn't slicing a vegetable,man shaving vegetation,0.29186893,0.5303285351166358
A little girl is playing a grand piano on stage,bit dame playing goody singing stage,0.5574659,0.47175510140026317
"A little girl is playing a piano, which is very big, on stage",bit dame playing singing magnitude stage,0.5624938,0.5835896985871452
There is no little girl playing a grand piano on stage,bit dame playing goody singing stage,0.31880832,0.4812929365370009
"A girl, who is little, is playing the piano",dame bit playing singing,0.4839756,0.5646733085314433
A little girl is playing the piano,bit dame playing singing,0.4483073,0.4998591813174161
There is no little girl playing the piano,bit dame playing singing,0.22951181,0.4987112085024516
A man is packing a guitar,man packaging chorus,0.5477652,0.4731594655248854
Someone is strumming the guitar,man drubbing chorus,0.29298756,0.41133899490038556
Someone is playing the guitar,man playing chorus,0.43491185,0.427021287381649
Someone is putting the guitar away,man giving chorus outside,0.23257919,0.4090354800224304
The man is dancing frantically,man dancing brute,0.8495884,0.578183458911048
The man is dancing,man dancing,0.97722805,0.6043725609779358
The man is not dancing,man dancing,0.3564782,0.5811862008912223
Three women are dancing,two dame dancing,0.9182921,0.40597483941486906
A few women are dancing,dame dancing,0.85134566,0.4738191281046186
Three women are standing still,two dame standing still,0.9118097,0.41057876083585954
A man is playing a flute made of bamboo,man playing flutter create lumber,0.31554568,0.5145407284007353
A man is playing a bamboo flute,man playing lumber flutter,0.38632828,0.5153537477765765
There is no man playing a bamboo flute,man playing lumber flutter,0.16666588,0.5032715757687887
The man is playing a flute,man playing flutter,0.38252336,0.5835280147465792
A flute is being played by the man,flutter being playing man,0.41860217,0.5783304699829647
The man is not playing a flute,man playing flutter,0.22155179,0.5728581498066584
A person is absently cutting mushrooms with a knife,man idle cutter shellfish cutter,0.47161895,0.4608835279941559
A person is cutting mushrooms with a knife,man cutter shellfish cutter,0.3671602,0.41700394795491147
A person is putting away the mushrooms,man giving outside shellfish,0.38509995,0.4582279473543167
A person is slicing some mushrooms,man shaving shellfish,0.36392868,0.44984445969263714
A person is cutting some mushrooms,man cutter shellfish,0.34787473,0.4184494435787201
There is no person cutting some mushrooms,man cutter shellfish,0.19154197,0.4446400187232278
A tiger is pacing around a cage,raptor pitching besiege enclosure,0.39909366,0.4630145345415388
A tiger is walking around a cage,raptor walking besiege enclosure,0.561796,0.43843801204974836
A tiger is walking outside a cage,raptor walking outside enclosure,0.70561993,0.49235523243745166
A tiger is walking around with no aim,raptor walking besiege purpose,0.42958224,0.4688781372138432
A tiger is walking around aimlessly,raptor walking besiege meaninglessness,0.6795892,0.418548869235175
A tiger is sitting,raptor sit,0.75174904,0.4640241946492876
A tiger is aimlessly walking around,raptor meaninglessness walking besiege,0.70711404,0.4194193482398987
A monkey is brushing the dog,monkey washing pet,0.839576,0.5386022859149509
The monkey is brushing the dog,monkey washing pet,0.82455224,0.5476301776038276
There is no monkey brushing the dog,monkey washing pet,0.34305435,0.5178692758083343
A bull dog is being brushed by the monkey,goat pet being rubbing monkey,0.7925724,0.5435611605644226
The monkey is brushing a bull dog,monkey washing goat pet,0.80335945,0.5490237636999651
The monkey is not brushing a bull dog,monkey washing goat pet,0.5019125,0.5326716005802155
A bull dog is brushing the monkey,goat pet washing monkey,0.78429097,0.5352322567592968
A woman is swiftly cutting an onion,dame quicken cutter sausage,0.6066856,0.3963457987858699
The lady is dicing onions,dame licking sausage,0.7033239,0.5494166413942972
The woman is dicing onions,dame licking sausage,0.6950184,0.47510289483600193
The woman is throwing onions away,dame throw sausage outside,0.6207168,0.4524377703666687
A man is wearing a hard hat and dancing,man wear tough coat dancing,0.91096604,0.5890944514955793
A man is wearing a hat which is hard and is dancing,man wear coat tough dancing,0.90894526,0.6327327980714685
A man is naked and standing still,man empty standing still,0.87732595,0.5478157184340737
A man is dancing with a worn hard hat,man dancing wear tough coat,0.91858804,0.5756680752549853
A man with a hard hat is dancing,man tough coat dancing,0.87406564,0.595273936788241
The man with a hard hat is dancing,man tough coat dancing,0.85895246,0.59687772889932
There is no man with a hard hat dancing,man tough coat dancing,0.38022837,0.5812467061556302
Two boys are playing a video game,two male playing movie play,0.7075853,0.472090149919192
A couple of boys are playing a video game,wed male playing movie play,0.6011056,0.4750983417034149
Two boys are studying,two male teach,0.73292524,0.4608961343765259
Two boys on a couch are playing games on the TV,two male loafer playing play television,0.8289278,0.4865508841143714
Two boys on a couch are playing video games,two male loafer playing movie play,0.6582722,0.4390145614743233
Two boys on a couch are reading a book,two male loafer read book,0.78371483,0.45839985211690265
Video games of two playing boys are on a couch,movie play two playing male loafer,0.5767516,0.46247387633604164
A woman is cutting a potato,dame cutter pie,0.5393685,0.41310275925530326
The man is slicing vegetables,man shaving vegetation,0.6176384,0.49518750309944154
Vegetables are being sliced by a man,vegetation being cutter man,0.57588714,0.5737024794022242
The man is not slicing vegetables,man shaving vegetation,0.3773448,0.48430848663503473
The lady is breaking an egg for the mixer,dame breaking chicken blend,0.66912603,0.5795387213046734
The lady is cracking an egg for the mixer,dame crack chicken blend,0.5977458,0.568841970883883
The lady isn't cracking an egg for the mixer,dame crack chicken blend,0.30108896,0.5816281040509542
The lady is carefully slicing up the meat,dame attention shaving meat,0.7658393,0.5237087394509997
The lady is slicing up the meat,dame shaving meat,0.77135044,0.5837869197130203
The lady isn't slicing up the meat,dame shaving meat,0.25589627,0.5846708757536752
The lady is eating slices of meat,dame eat sliver meat,0.88642037,0.524508481224378
Some ferrets are climbing down from a shelf,feline climb table,0.67756623,0.45232007595208973
Ferrets are climbing down from a shelf,feline climb table,0.71231383,0.5018181006113688
Ferrets are climbing up a shelf,feline climb table,0.74790096,0.5038533319126476
A few ferrets are climbing out of the cage,feline climb enclosure,0.5701622,0.5092690118721553
Several ferrets are climbing out of the cage,plenty feline climb enclosure,0.4813429,0.5025742905480521
Several ferrets are climbing into the cage,plenty feline climb enclosure,0.44442382,0.48598236304063064
A man is getting into an automobile,man getting automobile,0.91500527,0.6071077704429626
A man is getting into a car,man getting car,0.91790104,0.5990358233451843
A man is getting off the car,man getting car,0.79768175,0.5937221586704254
A man is hurriedly getting into a car in a garage,man quicken getting car car,0.73546815,0.5450719814551505
A man is getting into a car in a garage,man getting car car,0.7870212,0.5525109001568386
A man is parking a car in a garage,man stopover car car,0.75058115,0.4625205525330135
A man is getting a garage for the car,man getting car car,0.7352798,0.5769306008632367
A person is cutting a capsicum into pieces,man cutter condiment fraction,0.5672613,0.4605600195271628
A capsicum is being cut into pieces by a person,condiment being cut fraction man,0.69123363,0.5244894343263963
Nobody is cutting a capsicum into pieces,nix cutter condiment fraction,0.18252298,0.42011797428131104
One person is slicing a clove of garlic into pieces,unit man shaving hawthorn sausage fraction,0.5985613,0.4317812740802765
The person is slicing a clove of garlic into pieces,man shaving hawthorn sausage fraction,0.62414473,0.49682982344376414
The person is not slicing a clove of garlic into pieces,man shaving hawthorn sausage fraction,0.21156716,0.4979032754898071
A man is performing with the guitar,man executing chorus,0.5993277,0.4742357947609641
